"J9P5PEIE","book","2015","Zheng, Alice","Evaluating Machine Learning Models","","","","","http://www.oreilly.com/data/free/evaluating-machine-learning-models.csp?intcmp=il-data-free-lp-lgen_free_reports_page","Data science today is a lot like the Wild West: there’s endless opportunity and excitement, but also a lot of chaos and confusion. If you’re new to data science and applied machine learning, evaluating a machine-learning model can seem pretty overwhelming...","2015-09","2019-09-24 22:30:57","2019-09-24 22:30:57","2015-12-15 18:26:39","","","","","","","","","","","","O'Reily Media","Sebastopol, CA","","","","","","","","","<p>    In this article, author Zheng introduces the workflow of machine learning and discusses the selection of evaluation indicators and models. The rest of the article covers hyper parameter tuning and A/B testing, which benefits more experienced machine learning practitioners. After reading this article, I learned about the basics of model evaluation, the metrics used to monitor learning models, and the stages involved in developing machine learning models for software applications</p>","","http://www.oreilly.com/data/free/evaluating-machine-learning-models.csp?intcmp=il-data-free-lp-lgen_free_reports_page","","","","","","","","","","","","","","","","","","","","","","","","","","","","","","","","","","","","","","","","","","","","","","","",""
"GC7YC8YV","blogPost","2015","Leong, B; Polonetsky, J","Why Opting Out of Student Data Collection Isn’t the Solution","EdSurge","","","","https://www.edsurge.com/news/2015-03-16-why-opting-out-of-student-data-collection-isn-t-the-solution","In every privacy debate across every industry, the same questions arise about the rights of individuals to “opt-out” of their data being collected or used. So it should come as no surprise that the “when” and “how” of parent and student opt-outs of education data collection or use has become a robust","2015-03-16","2019-09-24 22:30:57","2019-09-24 22:30:57","2016-01-16 16:31:25","","","","","","","","","","","","","","","","","","","","","","<p>    The article mainly discusses how privacy principles can help us consider student data. The problem has two parts.</p> <p>First is how does data collection help students</p> <p>· Schools need to know basic information about students and parents during their operations. These include the need to keep track of students' grades, know who is eligible for subsidies, and who has special learning needs</p> <p>· Evaluating performance through data analysis is a necessary step to improve education.</p> <p>Second is when to opt-out</p> <p>· Share student data when parents' expectations of education and activities are irrelevant.</p> <p>· FERPA requires schools to provide opt-out opportunities for parents.</p> <p>Third is why opting out isn't the solution</p> <p> </p> <p> </p>","","https://www.edsurge.com/news/2015-03-16-why-opting-out-of-student-data-collection-isn-t-the-solution","","","","","","","","","","","","","","","","","","","","","","","","","","","","","","","","","","","","","","","","","","","","","","","",""
"QHCLFAET","videoRecording","2015","Educause","Why Is Measuring Learning So Difficult?","","","","","https://www.youtube.com/watch?v=_iv8A1pHNYA","Several higher education learning and assessment professionals discuss the difficulties of measuring learning.","2015-08-17","2019-09-24 22:30:58","2019-09-24 22:30:58","2016-01-17 18:50:57","","","","","","","","","","","","","","","","","","","YouTube","","","<p>    Learning knowledge, learning skills, learning from other's experiences are three things that I think of learning. After we learn these things, we need to execute them for measureing. How well we execute them is also hard to measure to see how well we learned. Testing if we have learned is hard to complete.</p>","","","","Learning; Assessment; Education; educational assessment; EDUCAUSE; Higher Education; learners; Teaching and learning","","","","","","","","","","","","","","","","","","","","","470 seconds","","","","","","","","","","","","","","","","","","","","","","","","",""
"ASMENAWV","webpage","2016","Weinersmith, Zach","Saturday Morning Breakfast Cereal","","","","","http://www.smbc-comics.com/index.php?id=3978","","2016-01-05","2019-09-24 22:30:58","2019-09-24 22:30:58","2016-01-18 18:17:09","","","","","","","","","","","","","","","","","","","","","","<p>    The clocks means changeless test requirements. If the education goal is just pass the test requirement, the science, economy will also be encumbered. Creativity and various interests are the main sources of new discoveries in the progress of our culture and society.</p>","","http://www.smbc-comics.com/index.php?id=3978","","","","","","","","","","","","","","","","","","","","","","","","","","","","","","","","","","","","","","","","","","","","","","","",""
"756NT2EB","conferencePaper","2014","Clow, Doug","Data wranglers: human interpreters to help close the feedback loop","Proceedings of the Fourth International Conference on Learning Analytics And Knowledge","","","","","","2014","2019-09-24 22:30:58","2019-09-24 22:30:58","","49–53","","","","","","","","","","","ACM","","","","","","","","","","<p>    The authors of this article argue that closing the feedback loop to improve learning is central to good learning analysis practice. However, the amount of data and the different data sources may make it more difficult to take systematic action on this data.</p> <p>    This article describes an activity scheme in which a group of ""data adjusters"" is used for meaning analysis activities and learning to analyze data. The objective is to produce recommendations and reports for action. The overall goal is to promote the systematic improvement of the Open University community of practice through single-cycle and double-cycle learning.</p>","","","","","","","","","","","","","","","","","","","","","","","","","","","","","","","","","","","","","","","","","","","","","","","","","",""
"UL7LRC2A","magazineArticle","2015","Kucirkova, Natalia; FitzGerald, Elizabeth","Zuckerberg is ploughing billions into 'personalised learning' – why?","The Conversation","","","","http://theconversation.com/zuckerberg-is-ploughing-billions-into-personalised-learning-why-51940","Zuckerburg wants to plough billions into personalised learning, but his way may not be the right way.","2015-12-09","2019-09-24 22:30:58","2019-09-24 22:30:58","2016-01-18 19:14:05","","","","","","","","","","","","","","","","","","","","","","<p>    Can we put the requirements into the personalized learning that including essential general knowledge into each person's personalized learning, changing learning ways in each period to train each person's ability to cope different learning ways, and reminding some new and different topics during studying? If we can, this personalized learning could decrease its dangers mentioned in the article. This should be a study tool to help students studying easier and more efficiently.</p>","","https://theconversation.com/zuckerberg-is-ploughing-billions-into-personalised-learning-why-51940","","","","","","","","","","","","","","","","","","","","","","","","","","","","","","","","","","","","","","","","","","","","","","","",""
"DKF36JCZ","videoRecording","2015","Georgia Tech","Feature Selection","","","","","https://www.youtube.com/watch?v=8CpRLplmdqE","","2015-02-23","2019-09-24 22:30:58","2019-09-24 22:30:58","2016-01-18 19:18:06","","","","","","","","","","","","Youtube","","","","","","","","","","<p>    Because when we have n features, we need 2 to the power of N observations to well predict the features. In some cases, only a few variables among a lot of ones have association with the response variable, so feature selection is really important to make the problem easier to solve.</p>","","https://www.youtube.com/watch?v=8CpRLplmdqE","","","","","","","","","","","","","","","","","","","","","","","3:13","","","","","","","","","","","","","","","","","","","","","","","","",""
"RYV7HD67","bookSection","2016","Hanneman, R.A.; Riddle, M.","Chapter 1: Social Network Data","Introduction to Social Network Methods","","","","http://faculty.ucr.edu/~hanneman/nettext/C1_Social_Network_Data.html","","2016-01-18","2019-09-24 22:30:58","2019-09-24 22:30:58","2016-01-18 20:17:24","","","","","","","","","","","","","","","","","","","","","","<p>    The authors begin the article with a question: what's different about social network data?<br />First, social network analysts use a special language to describe the structure and content of their observation sets.<br />Second, data sets developed by social network analysts are often very different from the traditional rectangular data arrays familiar to survey researchers and statistical analysts. These differences lead to different ways of looking at data and thinking about how to apply statistics.</p>","","http://faculty.ucr.edu/~hanneman/nettext/C1_Social_Network_Data.html","","","","","","","","","","","","","","","","","","","","","","","","","","","","","","","","","","","","","","","","","","","","","","","",""
"Y57RT7P5","webpage","2014","Groelmund, Garrett","RStudio Cheat Sheets","RStudio","","","","https://www.rstudio.com/resources/cheatsheets/","","2014-08-01","2019-09-24 22:30:58","2019-09-24 22:30:58","2016-01-19 21:17:28","","","","","","","","","","","","","","","","","","","","","","<p>    R Studio cheat sheets helped me a lot. It tells me how to create a new .Rmd file, how to write document, how to knit document to create report, preview output and how to publish. It contains all the introductions to the rstudio. This is a good cheat sheet for a beginner in rstudio.</p>","","http://shiny.rstudio.com/articles/rm-cheatsheet.html","","","","","","","","","","","","","","","","","","","","","","","","","","","","","","","","","","","","","","","","","","","","","","","",""
"MPQ29UZ3","conferencePaper","2013","san Pedro, Maria Ofelia; Baker, Ryan; Bowers, Alex; Heffernan, Neil","Predicting college enrollment from student interaction with an intelligent tutoring system in middle school","Educational Data Mining 2013","","","","","","2013","2019-09-24 22:30:58","2019-09-24 22:30:58","","","","","","","","","","","","","","","","","","","","","","","<p>    This article discusses measurement and its application in learning analysis. It also introduces educational and psychometric practitioners in learning to analyze and mine educational data.</p>","","","","","","","","","","","","","","","","","","","","","","","","","","","","","","","","","","","","","","","","","","","","","","","","","",""
"5ARHKVZX","journalArticle","2012","Greller, Wolfgang; Drachsler, Hendrik","Translating Learning into Numbers: A Generic Framework for Learning Analytics","Journal of Educational Technology & Society","","1176-3647","","http://www.jstor.org/stable/jeductechsoci.15.3.42","ABSTRACT With the increase in available educational data, it is expected that Learning Analytics will become a powerful means to inform and support learners, teachers and their institutions in better understanding and predicting personal learning needs and performance. However, the processes and requirements behind the beneficial application of Learning and Knowledge Analytics as well as the consequences for learning and teaching are still far from being understood. In this paper, we explore the key dimensions of Learning Analytics (LA), the critical problem zones, and some potential dangers to the beneficial exploitation of educational data. We propose and discuss a generic design framework that can act as a useful guide for setting up Learning Analytics services in support of educational practice and learner guidance, in quality assurance, curriculum development, and in improving teacher effectiveness and efficiency. Furthermore, the presented article intends to inform about soft barriers and limitations of Learning Analytics. We identify the required skills and competences that make meaningful use of Learning Analytics data possible to overcome gaps in interpretation literacy among educational stakeholders. We also discuss privacy and ethical issues and suggest ways in which these issues can be addressed through policy guidelines and best practice examples.","2012","2019-09-24 22:30:58","2019-09-24 22:30:58","2016-09-03 18:55:41","42-57","","3","15","","Journal of Educational Technology & Society","Translating Learning into Numbers","","","","","","","","","","","","JSTOR","","","<p>    In this paper, the authors explore the key dimensions of learning analysis, problem areas, and potential dangers to the beneficial use of educational data. The authors present and discuss a design framework as a guide for establishing learning analysis services to support educational practice and learner mentoring, quality assurance, curriculum development, and teacher effectiveness and efficiency. In addition, this article will introduce the soft barriers and limitations of learning analysis. We identified the skills and capabilities necessary to meaningfully use learning analysis data to overcome gaps in explanatory literacy among education stakeholders. The final article also discusses the privacy and ethical issues and suggests how to address them through policy guidance and examples of best practices.</p>","","","","","","","","","","","","","","","","","","","","","","","","","","","","","","","","","","","","","","","","","","","","","","","","","",""
"XF8DY6S8","bookSection","2006","Kay, Judy; Maisonneuve, Nicolas; Yacef, Kalina; Reimann, Peter","The Big Five and Visualisations of Team Work Activity","Intelligent Tutoring Systems","978-3-540-35159-7 978-3-540-35160-3","","","http://link.springer.com/chapter/10.1007/11774303_20","We have created a set of novel visualisations of group activity: they mirror activity of individuals and their interactions, based upon readily available authentic data. We evaluated these visualisations in the context of a semester long software development project course. We give a theoretical analysis of the design of our visualizations using the framework from the “Big 5” theory of team work as well as a qualitative study of the visualisations and the students’ reflective reports. We conclude that these visualisations provide a powerful and valuable mirroring role with potential, when well used, to help groups learn to improve their effectiveness.","2006-06-26","2019-09-24 22:30:59","2019-09-24 22:30:59","2016-09-03 19:10:12","197-206","","","","","","","Lecture Notes in Computer Science","4053","","","Springer Berlin Heidelberg","","en","©2006 Springer-Verlag Berlin Heidelberg","","","","link.springer.com","","DOI: 10.1007/11774303_20","<p>    The authors have created a novel set of visualizations of group activities that reflect the interaction of individual activities. The author then evaluates these visualizations in a software development project course. Using the framework of ""big five"" teamwork theory, the author makes a theoretical analysis of visual design, and carries out a qualitative research on visual design and students' reflection reports. Finally, a conclusion is reached. These visual approaches provide a powerful and valuable mirroring effect that can help teams learn more efficiently.</p>","","https://link.springer.com/chapter/10.1007/11774303_20","","Multimedia Information Systems; User Interfaces and Human Computer Interaction; Artificial Intelligence (incl. Robotics); Computers and Education; Information Systems Applications (incl. Internet)","Ikeda, Mitsuru; Ashley, Kevin D.; Chan, Tak-Wai","","","","","","","","","","","","","","","","","","","","","","","","","","","","","","","","","","","","","","","","","","","","",""
"7E3EH6FC","journalArticle","2015","Konstan, Joseph A.; Walker, J. D.; Brooks, D. Christopher; Brown, Keith; Ekstrand, Michael D.","Teaching Recommender Systems at Large Scale: Evaluation and Lessons Learned from a Hybrid MOOC","ACM Trans. Comput.-Hum. Interact.","","1073-0516","10.1145/2728171","http://doi.acm.org/10.1145/2728171","","2015-04","2019-09-24 22:30:59","2019-09-24 22:30:59","2016-09-03 20:38:02","10:1–10:23","","2","22","","","Teaching Recommender Systems at Large Scale","","","","","","","","","","","","ACM Digital Library","","","<p>    This article introduces the recommendation system through Coursera, and USES Coursera platform and flipped classroom teaching model to provide the credit version of online courses. The purpose of this course is to experiment with new ways of teaching. So the authors conducted a wide range of assessments, including demographic surveys, self-assessment skills, and learning intentions. The authors also designed a knowledge assessment tool specific to the subject of the course, using it before and after the course to measure learning, and using it five months later to measure retention. In addition, the authors track students throughout the course, separating students who register for credit from those who only register for free open courses.</p>","","","","learning assessment; Massively Online Open Course (MOOC)","","","","","","","","","","","","","","","","","","","","","","","","","","","","","","","","","","","","","","","","","","","","","",""
"RA5H8HAD","bookSection","2013","Desmarais, Michel C.; Naceur, Rhouma","A Matrix Factorization Method for Mapping Items to Skills and for Enhancing Expert-Based Q-Matrices","Artificial Intelligence in Education","978-3-642-39111-8 978-3-642-39112-5","","","http://link.springer.com/chapter/10.1007/978-3-642-39112-5_45","Uncovering the right skills behind question items is a difficult task. It requires a thorough understanding of the subject matter and of the cognitive factors that determine student performance. The skills definition, and the mapping of item to skills, require the involvement of experts. We investigate means to assist experts for this task by using a data driven, matrix factorization approach. The two mappings of items to skills, the expert on one side and the matrix factorization on the other, are compared in terms of discrepancies, and in terms of their performance when used in a linear model of skills assessment and item outcome prediction. Visual analysis shows a relatively similar pattern between the expert and the factorized mappings, although differences arise. The prediction comparison shows the factorization approach performs slightly better than the original expert Q-matrix, giving supporting evidence to the belief that the factorization mapping is valid. Implications for the use of the factorization to design better item to skills mapping are discussed.","2013-07-09","2019-09-24 22:30:59","2019-09-24 22:30:59","2016-09-03 20:44:11","441-450","","","","","","","Lecture Notes in Computer Science","7926","","","Springer Berlin Heidelberg","","en","©2013 Springer-Verlag Berlin Heidelberg","","","","link.springer.com","","DOI: 10.1007/978-3-642-39112-5_45","<p>    By reading this article, I quite agree with the author. Finding the right skills behind a problem is a difficult task. The authors explore how to use data-driven matrix decomposition to help experts accomplish this task. Two maps of projects and skills, one is expert, the other is matrix factorization. Experts compared their differences and performance in a linear model of skill assessment and project outcome prediction. Visual analysis shows that expert maps and factor maps are relatively similar patterns, albeit with differences. The comparison of prediction results shows that the performance of the factorization method is slightly better than that of the original expert q matrix, which provides supporting evidence for the effectiveness of the factorization mapping.</p>","","https://link.springer.com/chapter/10.1007/978-3-642-39112-5_45","","User Interfaces and Human Computer Interaction; Artificial Intelligence (incl. Robotics); Computers and Education; Information Systems Applications (incl. Internet); alternating least squares matrix factorization; Cognitive modeling; Educational Technology; latent skills; Pedagogic Psychology; skills assessment; Student models","Lane, H. Chad; Yacef, Kalina; Mostow, Jack; Pavlik, Philip","","","","","","","","","","","","","","","","","","","","","","","","","","","","","","","","","","","","","","","","","","","","",""
"GPDAMHGS","book","2015","Matsuda, Noboru; Furukawa, Tadanobu; Bier, Norman; Faloutsos, Christos","Machine Beats Experts: Automatic Discovery of Skill Models for Data-Driven Online Course Refinement","","","","","http://eric.ed.gov/?id=ED560513","How can we automatically determine which skills must be mastered for the successful completion of an online course? Large-scale online courses (e.g., MOOCs) often contain a broad range of contents frequently intended to be a semester's worth of materials; this breadth often makes it difficult to articulate an accurate set of skills and knowledge (i.e., a skill model, or the QMatrix). We have developed an innovative method to discover skill models from the data of online courses. Our method assumes that online courses have a pre-defined skill map for which skills are associated with formative assessment items embedded throughout the online course. Our method carefully exploits correlations between various parts of student performance, as well as in the text of assessment items, to build a superior statistical model that even outperforms human experts. To evaluate our method, we compare our method with existing methods (LFA) and human engineered skill models on three Open Learning Initiative (OLI) courses at Carnegie Mellon University. The results show that (1) our method outperforms human-engineered skill models, (2) skill models discovered by our method are interpretable, and (3) our method is remarkably faster than existing methods. These results suggest that our method provides a significant contribution to the evidence-based, iterative refinement of online courses with a promising scalability. [For complete proceedings, see ED560503.]","2015-06","2019-09-24 22:30:59","2019-09-24 22:30:59","2016-09-03 20:48:57","","","","","","","Machine Beats Experts","","","","","International Educational Data Mining Society","","en","","","","","ERIC","","","<p>    This article compares the models developed by the authors' team with existing methods (LFA) and human engineering skills models that can find precise sets of skills and knowledge for specific courses. The results show that the author's model is explicable, better than the artificially-designed skill model, and much faster than the existing methods. The authors first describe their assumptions and how they process the data. Then the model is built and applied to an example. Finally, evaluating and analyzing the results.</p>","","http://eric.ed.gov/?id=ED560513","","data; Automation; Comparative Analysis; Correlation; Formative Evaluation; models; Online Courses; Skills","","","","","","","","","","","","","","","","","","","","","","","","","","","","","","","","","","","","","","","","","","","","","",""
"IZ22H3L4","conferencePaper","2008","Cortez, Paulo; Silva, Alice Maria Gonçalves","Using data mining to predict secondary school student performance","Proceedings of 5th Annual Future Business Technology Conference","978-90-77381-39-7","","","http://repositorium.sdum.uminho.pt/handle/1822/8024","Although the educational level of the Portuguese population has improved in the last decades, the statistics keep Portugal at Europe’s tail end due to its high student failure rates. In particular, lack of success in the core classes of Mathematics and the Portuguese language is extremely serious. On the other hand, the fields of Business Intelligence (BI)/Data Mining (DM), which aim at extracting high-level knowledge from raw data, offer interesting automated tools that can aid the education domain. The present work intends to approach student achievement in secondary education using BI/DM techniques. Recent real-world data (e.g. student grades, demographic, social and school related features) was collected by using school reports and questionnaires. The two core classes (i.e. Mathematics and Portuguese) were modeled under binary/five-level classification and regression tasks. Also, four DM models (i.e. Decision Trees, Random Forest, Neural Networks and Support Vector Machines) and three input selections (e.g. with and without previous grades) were tested. The results show that a good predictive accuracy can be achieved, provided that the first and/or second school period grades are available. Although student achievement is highly influenced by past evaluations, an explanatory analysis has shown that there are also other relevant features (e.g. number of absences, parent’s job and education, alcohol consumption). As a direct outcome of this research, more efficient student prediction tools can be be developed, improving the quality of education and enhancing school resource management.","2008-04","2019-09-24 22:31:00","2019-09-24 22:31:00","2016-09-04 01:23:19","","","","","","","","","","","","EUROSIS","Porto, Spain","eng","openAccess","","","","repositorium.sdum.uminho.pt","","","<p>    The high student failure rates in Portugal is mainly because of lack of success in Mathematics and the Portuguese language. Using business and data mining to analyze the data, including four data mining models. The results found that students' achievement has association with number of absences, parents' job and education, etc.</p>","","http://repositorium.sdum.uminho.pt/handle/1822/8024","","","","","","","","","","","","","","","","","","","","","","","","","","","","","","","","","5th Annual Future Business Technology Conference","","","","","","","","","","","","","","",""
