"Key","Item Type","Publication Year","Author","Title","Publication Title","ISBN","ISSN","DOI","Url","Abstract Note","Date","Date Added","Date Modified","Access Date","Pages","Num Pages","Issue","Volume","Number Of Volumes","Journal Abbreviation","Short Title","Series","Series Number","Series Text","Series Title","Publisher","Place","Language","Rights","Type","Archive","Archive Location","Library Catalog","Call Number","Extra","Notes","File Attachments","Link Attachments","Manual Tags","Automatic Tags","Editor","Series Editor","Translator","Contributor","Attorney Agent","Book Author","Cast Member","Commenter","Composer","Cosponsor","Counsel","Interviewer","Producer","Recipient","Reviewed Author","Scriptwriter","Words By","Guest","Number","Edition","Running Time","Scale","Medium","Artwork Size","Filing Date","Application Number","Assignee","Issuing Authority","Country","Meeting Name","Conference Name","Court","References","Reporter","Legal Status","Priority Numbers","Programming Language","Version","System","Code","Code Number","Section","Session","Committee","History","Legislative Body"
"RAIG4IJR","bookSection","2017","Bergner, Yoav","Measurement and its Uses in Learning Analytics","The Handbook of Learning Analytics","978-0-9952408-0-3","","","http://solaresearch.org/hla-17/hla17-chapter1","Psychological measurement is a process for making warranted claims about states of mind. As such, it typically comprises the following: de ning a construct; specifying a measurement model and (developing) a reliable instrument; analyzing and accounting for various sources of error (including operator error); and framing a valid argument for particular uses of the outcome. Measurement of latent variables is, after all, a noisy endeavor that can neverthe- less have high-stakes consequences for individuals and groups. This chapter is intended to serve as an introduction to educational and psychological measurement for practitioners in learning analytics and educational data mining. It is organized thematically rather than historically, from more conceptual material about constructs, instruments, and sources of measurement error toward increasing technical detail about particular measurement models and their uses. Some of the philosophical differences between explanatory and predictive modelling are explored toward the end.","2017","2019-09-24 22:30:56","2019-09-24 22:30:56","","34-48","","","","","","","","","","","Society for Learning Analytics Research (SoLAR)","Alberta, Canada","","","","","","","","","<p>    The authors of this article argue that the use of learning analysis tools is always consistent with the assessment system. The evaluation system is based on the epistemological hypothesis and teaching practice. Thus, a specific learning analysis tool expresses a commitment to a specific educational worldview, aimed at cultivating a specific type of learner. </p>","","","","","Lang, Charles; Siemens, George; Wise, Alyssa Friend; Gaševic, Dragan","","","","","","","","","","","","","","","","","","","1","","","","","","","","","","","","","","","","","","","","","","","","","",""
"RBXJQXRG","bookSection","2017","Prinsloo, Paul; Slade, Sharon","Ethics and Learning Analytics: Charting the (Un)Charted","The Handbook of Learning Analytics","978-0-9952408-0-3","","","http://solaresearch.org/hla-17/hla17-chapter1","As the field of learning analytics matures, and discourses surrounding the scope, de nition, challenges, and opportunities of learning analytics become more nuanced, there is bene t both in reviewing how far we have come in considering associated ethical issues and in looking ahead. This chapter provides an overview of how our own thinking has developed and maps our journey against broader developments in the  eld. Against a backdrop of technological advances and increasing concerns around pervasive surveillance and the role and unintended consequences of algorithms, the development of research in learning analytics as an ethical and moral practice provides a rich picture of fears and realities. More importantly, we begin to see ethics and privacy as crucial enablers within learning analytics. The chapter brie y locates ethics in learning analytics in the broader context of the forces shaping higher education and the roles of data and evidence before tracking our personal research journey, highlighting current work in the  eld, and concluding by mapping future issues for consideration.","2017","2019-09-24 22:30:56","2019-09-24 22:30:56","","49-57","","","","","","","","","","","Society for Learning Analytics Research (SoLAR)","Alberta, Canada","","","","","","","","","<p>    This chapter describes how our own minds have evolved, contrasting our journey learning analysis with broader developments. With technological advances, ubiquitous monitoring, and growing concerns about the role of algorithms and unintended consequences, the study of learning analytics as an ethical and moral practice has provided a rich picture of fear and reality.</p> <p>    Each framework, practical code, and the concept of ethical meaning in learning analysis discussed in this article adds a deeper level and richer understanding of how to move forward<br />It is economically feasible to use student data agents to improve the effectiveness and appropriateness of teaching, learning, and student support strategies<br />Methods. But actual implementation remains largely incomplete.</p>","","","","","Lang, Charles; Siemens, George; Wise, Alyssa Friend; Gaševic, Dragan","","","","","","","","","","","","","","","","","","","1","","","","","","","","","","","","","","","","","","","","","","","","","",""
"C2H6ZG6J","bookSection","2017","Brooks, Christopher; Thompson, Craig","Predictive Modelling in Teaching and Learning","The Handbook of Learning Analytics","978-0-9952408-0-3","","","http://solaresearch.org/hla-17/hla17-chapter1","This article describes the process, practice, and challenges of using predictive modelling in teaching and learning. In both the  elds of educational data mining (EDM) and learning analytics (LA) predictive modelling has become a core practice of researchers, largely with a focus on predicting student success as operationalized by academic achievement. In this chapter, we provide a general overview of considerations when using predictive modelling, the steps that an educational data scientist must consider when engaging in the process, and a brief overview of the most popular techniques in the  eld.","2017","2019-09-24 22:30:56","2019-09-24 22:30:56","","61-68","","","","","","","","","","","Society for Learning Analytics Research (SoLAR)","Alberta, Canada","","","","","","","","","<p>    Learning analysis is the embodiment of the transformation of society to the popularization of algorithms. In this article, the authors argue that the use of learning analysis tools is consistent with the assessment system. The evaluation system is based on the epistemological hypothesis and teaching practice. Therefore, fundamentally, the author believes that the development of a specific learning analysis tool expresses a commitment to a specific educational worldview in order to cultivate a specific type of learner. The author discusses some key problems in the development of learning analysis technology. For example, the purpose and hypothesis of learning analysis are proposed. And use ""claim analysis"" to analyze the position of the design of the technology.</p>","","","","","Lang, Charles; Siemens, George; Wise, Alyssa Friend; Gaševic, Dragan","","","","","","","","","","","","","","","","","","","1","","","","","","","","","","","","","","","","","","","","","","","","","",""
"VWV97FWV","bookSection","2017","Liu, Ren; Koedinger, Kenneth","Going Beyond Better Data Prediction to Create Explanatory Models of Educational Data","The Handbook of Learning Analytics","978-0-9952408-0-3","","","http://solaresearch.org/hla-17/hla17-chapter1","In the statistical modelling of educational data, approaches vary depending on whether the goal is to build a predictive or an explanatory model. Predictive models aim to  nd a combination of features that best predict outcomes; they are typically assessed by their accuracy in predicting held-out data. Explanatory models seek to identify interpretable causal relationships between constructs that can be either observed or inferred from the data. The vast majority of educational data mining research has focused on achieving pre- dictive accuracy, but we argue that the  eld could bene t from more focus on developing explanatory models. We review examples of educational data mining efforts that have pro- duced explanatory models and led to improvements to learning outcomes and/or learning theory. We also summarize some of the common characteristics of explanatory models, such as having parameters that map to interpretable constructs, having fewer parameters overall, and involving human input early in the model development process.","2017","2019-09-24 22:30:56","2019-09-24 22:30:56","","69-76","","","","","","","","","","","Society for Learning Analytics Research (SoLAR)","Alberta, Canada","","","","","","","","","<p>    In the statistical modeling of educational data, there are many ways to build prediction models or explain models according to the goal. The purpose of a predictive model is to find the combination that best predicts the outcome. Explanatory models attempt to find an interpretable causal relationship between constructs that are observable or inferred from data. </p> <p>    The article also summarizes some of the common characteristics of interpretive models, such as having parameters that map to interpretable constructs, having fewer parameters, and the manual inputs involved early in the model development process.</p>","","","","","Lang, Charles; Siemens, George; Wise, Alyssa Friend; Gaševic, Dragan","","","","","","","","","","","","","","","","","","","1","","","","","","","","","","","","","","","","","","","","","","","","","",""
"BV9LUV8B","journalArticle","2011","Gelman, A; Niemi, J","Statistical graphics: making information clear – and beautiful","Significance","","","","","","2011-09","2019-09-24 22:30:56","2019-09-24 22:30:56","","134-136","","","","","","","","","","","","","","","","","","","","","","","","","","","","","","","","","","","","","","","","","","","","","","","","","","","","","","","","","","","","","","","","","","","","","","",""
"MMAVBKZT","journalArticle","2012","Gelman, A; Unwin, A","Infovis and Statistical Graphics: Different Goals, Different Looks (with discussion)","","","","","","","2012","2019-09-24 22:30:56","2019-09-24 22:30:56","","","","","","","","","","","","","","","","","","","","","","","<p>    The author proposes a set of graphical display objectives, which are mainly based on and from the perspective of statistics to explore some inherent contradictions in the objectives that hinder the communication between statistics and information systems. For Infovis practitioners and statisticians, constructive advice is to try to present better in two or more charts. The authors realize that only one perspective is provided, and hope that this article is a starting point for a broad discussion of statistical methods among graphic designers, statisticians, and users. The purpose of this article is not to criticize but to explore different goals that lead researchers in different fields to value different aspects of data visualization.</p>","","","","","","","","","","","","","","","","","","","","","","","","","","","","","","","","","","","","","","","","","","","","","","","","","",""
"ATH4FRIG","blogPost","2014","Fung, K","Junkcharts Trifecta Checkup: The Definitive Guide","Junkcharts","","","","http://junkcharts.typepad.com/junk_charts/junk-charts-trifecta-checkup-the-definitive-guide.html","","2014","2019-09-24 22:30:56","2019-09-24 22:30:56","","","","","","","","","","","","","","","","","Blog","","","","","","<p>    After reading this article, I learned that the Trifecta examination framework established the classification of the dataviz review.</p> <p>    There are eight types of reviews：</p> <p>1.The trifecta</p> <p>2.The singles</p> <p>-Type Q</p> <p>-Type D</p> <p>-Type V</p> <p>3.Doubles</p> <p>-Type QD</p> <p>-Type QV</p> <p>-Type DV</p> <p>4.Triple (Type QDV)</p> <p> </p>","","","","","","","","","","","","","","","","","","","","","","","","","","","","","","","","","","","","","","","","","","","","","","","","","",""
"XYFMQRID","journalArticle","2010","Bowers, Alex J.","Analyzing the Longitudinal K-12 Grading Histories of Entire Cohorts of Students: Grades, Data Driven Decision Making, Dropping out and Hierarchical Cluster Analysis","Practical Assessment, Research & Evaluation","","1531-7714","","","School personnel currently lack an effective method to pattern and visually interpret disaggregated achievement data collected on students as a means to help inform decision making. This study, through the examination of longitudinal K-12 teacher assigned grading histories for entire cohorts of students from a school district (n=188), demonstrates a novel application of hierarchical cluster analysis and pattern visualization in which all data points collected on every student in a cohort can be patterned, visualized and interpreted to aid in data driven decision making by teachers and administrators. Additionally, as a proof-of-concept study, overall schooling outcomes, such as student dropout or taking a college entrance exam, are identified from the data patterns and compared to past methods of dropout identification as one example of the usefulness of the method. Hierarchical cluster analysis correctly identified over 80% of the students who dropped out using the entire student grade history patterns from either K-12 or K-8. (Contains 5 figures.)","2010-05","2019-09-24 22:30:56","2019-09-24 22:30:56","2014-09-24 19:31:29","","","7","15","","","Analyzing the Longitudinal K-12 Grading Histories of Entire Cohorts of Students","","","","","","","en","","","","","ERIC","","","<p>    At present, school staff lacks effective methods to model and visualize the collected data of student performance. The authors describe a study. In this study, an entire cohort of students was recorded using test scores assigned by longitudinal primary and secondary school teachers. It shows the novel's hierarchical cluster analysis and the pattern visualization of all the data points in the application queue. Visualization can help teachers and administrators in data-driven decision-making and interpretation. In addition, as a proof-of-concept study, overall school outcomes, such as students dropping out or taking college entrance exams, are identified from data patterns and compared over time<br />Dropout identification method. Hierarchical cluster analysis correctly identified more than 80% of dropouts using historical patterns throughout the grade.</p>","","http://eric.ed.gov/?id=EJ933686","","data; data analysis; Decision Making; Dropouts; Elementary School Students; Grades (Scholastic); Identification; MULTIVARIATE analysis; School Districts; Secondary School Students","","","","","","","","","","","","","","","","","","","","","","","","","","","","","","","","","","","","","","","","","","","","","",""
"FAGJHWMY","journalArticle","2014","Grunspan, Daniel Z.; Wiggins, Benjamin L.; Goodreau, Steven M.","Understanding Classrooms through Social Network Analysis: A Primer for Social Network Analysis in Education Research","CBE-Life Sciences Education","",", 1931-7913","10.1187/cbe.13-08-0162","http://www.lifescied.org/content/13/2/167","Social interactions between students are a major and underexplored part of undergraduate education. Understanding how learning relationships form in undergraduate classrooms, as well as the impacts these relationships have on learning outcomes, can inform educators in unique ways and improve educational reform. Social network analysis (SNA) provides the necessary tool kit for investigating questions involving relational data. We introduce basic concepts in SNA, along with methods for data collection, data processing, and data analysis, using a previously collected example study on an undergraduate biology classroom as a tutorial. We conduct descriptive analyses of the structure of the network of costudying relationships. We explore generative processes that create observed study networks between students and also test for an association between network position and success on exams. We also cover practical issues, such as the unique aspects of human subjects review for network studies. Our aims are to convince readers that using SNA in classroom environments allows rich and informative analyses to take place and to provide some initial tools for doing so, in the process inspiring future educational studies incorporating relational data.","2014-06-20","2019-09-24 22:30:57","2019-09-24 22:30:57","2014-08-20 20:21:46","167-178","","2","13","","CBE Life Sci Educ","Understanding Classrooms through Social Network Analysis","","","","","","","en","","","","","www.lifescied.org","","","<p>    This paper introduces the basic concept of SNA, the methods of data collection, data processing and data analysis. We analyzed the structure of the partnership network, explored the generation process, created a learning network of student observations, and tested the connection between network location and exam success. The article also discusses practical problems. Take, for example, the unique human commentary on Internet research. The author's goal is to make people feel that SNA can be used for rich and informative analysis in the classroom environment.</p>","","http://www.lifescied.org/content/13/2/167","Week 2","","","","","","","","","","","","","","","","","","","","","","","","","","","","","","","","","","","","","","","","","","","","","","",""
"766H946H","blogPost","2014","Young, Jeffrey R.","Why Students Should Own Their Educational Data","The Chronicle of Higher Education Blogs: Wired Campus","","","","http://chronicle.com/blogs/wiredcampus/why-students-should-own-their-educational-data/54329","","2014-08-21","2019-09-24 22:30:57","2019-09-24 22:30:57","2014-08-23 21:32:22","","","","","","","","","","","","","","","","","","","","","","<p><span style=""color: #333333; font-family: Heuristica, 'Times New Roman', Times, serif; font-size: 18px; font-style: normal; font-variant-ligatures: normal; font-variant-caps: normal; font-weight: 400; letter-spacing: normal; orphans: 2; text-align: start; text-indent: 0px; text-transform: none; white-space: normal; widows: 2; word-spacing: 0px; -webkit-text-stroke-width: 0px; background-color: #ffffff; text-decoration-style: initial; text-decoration-color: initial; display: inline !important; float: none;"">I have to draw inferences about a population from a sample because I cannot get the population data at most of times. This main idea structures the some knowledge of basis of statistics: inference, hypothesis test. <br /></span></p> <p><span style=""color: #333333; font-family: Heuristica, 'Times New Roman', Times, serif; font-size: 18px; font-style: normal; font-variant-ligatures: normal; font-variant-caps: normal; font-weight: 400; letter-spacing: normal; orphans: 2; text-align: start; text-indent: 0px; text-transform: none; white-space: normal; widows: 2; word-spacing: 0px; -webkit-text-stroke-width: 0px; background-color: #ffffff; text-decoration-style: initial; text-decoration-color: initial; display: inline !important; float: none;"">Because when the MOOC owns the student's data, students are given to study the knowledge that set by MOOC, teachers need to own their student's data, and nurture every single one's future. </span></p>","","http://chronicle.com/blogs/wiredcampus/why-students-should-own-their-educational-data/54329","","","","","","","","","","","","","","","","","","","","","","","","","","","","","","","","","","","","","","","","","","","","","","","",""
"3ULPFUCI","journalArticle","1994","Corbett, Albert T.; Anderson, John R.","Knowledge tracing: Modeling the acquisition of procedural knowledge","User Modeling and User-Adapted Interaction","","0924-1868, 1573-1391","10.1007/BF01099821","http://link.springer.com.ezp-prod1.hul.harvard.edu/article/10.1007/BF01099821","This paper describes an effort to model students' changing knowledge state during skill acquisition. Students in this research are learning to write short programs with the ACT Programming Tutor (APT). APT is constructed around a production rule cognitive model of programming knowledge, called theideal student model. This model allows the tutor to solve exercises along with the student and provide assistance as necessary. As the student works, the tutor also maintains an estimate of the probability that the student has learned each of the rules in the ideal model, in a process calledknowledge tracing. The tutor presents an individualized sequence of exercises to the student based on these probability estimates until the student has ‘mastered’ each rule. The programming tutor, cognitive model and learning and performance assumptions are described. A series of studies is reviewed that examine the empirical validity of knowledge tracing and has led to modifications in the process. Currently the model is quite successful in predicting test performance. Further modifications in the modeling process are discussed that may improve performance levels.","1994-12-01","2019-09-24 22:30:57","2019-09-24 22:30:57","2013-04-21 21:21:19","253-278","","4","4","","User Model User-Adap Inter","Knowledge tracing","","","","","","","en","","","","","link.springer.com.ezp-prod1.hul.harvard.edu","","","<p>    The author of this paper describes the modeling of students' knowledge state changes in the process of skill acquisition. In the study, students learned to write short programs under the guidance of the ACT programming tutor (APT). APT is built around the cognitive model of programming knowledge, which is an ideal student model. This model allows mentors to help students with their studies. In the process of learning, the tutor can also estimate the probability of each rule that the student learns in the model, which is called knowledge tracking. Based on these estimates, the instructor gives the students a personalized sequence of exercises until they ""master"" each rule.</p>","","","","Education (general); empirical validity; individual differences; intelligent tutoring systems; Learning; Management of Computing and Information Systems; mastery learning; Multimedia Information Systems; procedural knowledge; Psychology, general; student modeling; User Interfaces and Human Computer Interaction","","","","","","","","","","","","","","","","","","","","","","","","","","","","","","","","","","","","","","","","","","","","","",""
"5P7KKHNR","conferencePaper","2012","Siemens, George; Baker, Ryan S. J. d.","Learning Analytics and Educational Data Mining: Towards Communication and Collaboration","Proceedings of the 2Nd International Conference on Learning Analytics and Knowledge","978-1-4503-1111-3","","10.1145/2330601.2330661","http://doi.acm.org/10.1145/2330601.2330661","Growing interest in data and analytics in education, teaching, and learning raises the priority for increased, high-quality research into the models, methods, technologies, and impact of analytics. Two research communities -- Educational Data Mining (EDM) and Learning Analytics and Knowledge (LAK) have developed separately to address this need. This paper argues for increased and formal communication and collaboration between these communities in order to share research, methods, and tools for data mining and analysis in the service of developing both LAK and EDM fields.","2012","2019-09-24 22:30:57","2019-09-24 22:30:57","2015-01-16 03:15:55","252–254","","","","","","Learning Analytics and Educational Data Mining","LAK '12","","","","ACM","New York, NY, USA","","","","","","ACM Digital Library","","","<p>    This article focuses on increasing formal communication and collaboration between EDM and LAK. To develop research, methods, and tools for sharing data mining and analysis in the LAK and EDM domains. ""The EDM and LAK communities are defined in a relatively similar way"".</p> <p>    Both EDM and LAK reflect data-intensive approaches to education. In many departments, data mining and analysis have become an increasingly prominent activity for organizational insight. Extracting value from data for decision-making is a fundamental shift in the way an education system works. For example, LAK and EDM share the goal of improving educational assessment through improvements. Models and strategies. Both EDM and LAK communities have improved the quality of large-scale education data analysis and supported basic research and educational practices.</p>","","","","Collaboration; educational data mining; learning analytics and knowledge","","","","","","","","","","","","","","","","","","","","","","","","","","","","","","","","","","","","","","","","","","","","","",""
