"ZGUXMT9I","conferencePaper","2008","Cortez, Paulo; Silva, Alice Maria Gonçalves","Using data mining to predict secondary school student performance","Proceedings of 5th Annual Future Business Technology Conference","978-90-77381-39-7","","","http://repositorium.sdum.uminho.pt/handle/1822/8024","Although the educational level of the Portuguese population has improved in the last decades, the statistics keep Portugal at Europe’s tail end due to its high student failure rates. In particular, lack of success in the core classes of Mathematics and the Portuguese language is extremely serious. On the other hand, the fields of Business Intelligence (BI)/Data Mining (DM), which aim at extracting high-level knowledge from raw data, offer interesting automated tools that can aid the education domain. The present work intends to approach student achievement in secondary education using BI/DM techniques. Recent real-world data (e.g. student grades, demographic, social and school related features) was collected by using school reports and questionnaires. The two core classes (i.e. Mathematics and Portuguese) were modeled under binary/five-level classification and regression tasks. Also, four DM models (i.e. Decision Trees, Random Forest, Neural Networks and Support Vector Machines) and three input selections (e.g. with and without previous grades) were tested. The results show that a good predictive accuracy can be achieved, provided that the first and/or second school period grades are available. Although student achievement is highly influenced by past evaluations, an explanatory analysis has shown that there are also other relevant features (e.g. number of absences, parent’s job and education, alcohol consumption). As a direct outcome of this research, more efficient student prediction tools can be be developed, improving the quality of education and enhancing school resource management.","2008-04","2019-09-17 21:41:26","2019-09-17 21:41:26","2016-09-04 01:23:19","","","","","","","","","","","","EUROSIS","Porto, Spain","eng","openAccess","","","","repositorium.sdum.uminho.pt","","","","","http://repositorium.sdum.uminho.pt/handle/1822/8024","","","","","","","","","","","","","","","","","","","","","","","","","","","","","","","","","5th Annual Future Business Technology Conference","","","","","","","","","","","","","","",""
"HQIT5H5J","journalArticle","2008","Baker, Ryan S. J. d; Corbett, Albert T.; Roll, Ido; Koedinger, Kenneth R.","Developing a generalizable detector of when students game the system","User Modeling and User-Adapted Interaction","","0924-1868, 1573-1391","10.1007/s11257-007-9045-6","http://link.springer.com/article/10.1007/s11257-007-9045-6","Some students, when working in interactive learning environments, attempt to “game the system”, attempting to succeed in the environment by exploiting properties of the system rather than by learning the material and trying to use that knowledge to answer correctly. In this paper, we present a system that can accurately detect whether a student is gaming the system, within a Cognitive Tutor mathematics curricula. Our detector also distinguishes between two distinct types of gaming which are associated with different learning outcomes. We explore this detector’s generalizability, and find that it transfers successfully to both new students and new tutor lessons.","2008-01-23","2019-09-17 21:41:26","2019-09-17 21:41:26","2016-09-04 01:34:49","287-314","","3","18","","User Model User-Adap Inter","","","","","","","","en","","","","","link.springer.com","","","<p>Model students' changing knowledge state during skill acuqisition.</p> <p>Write short programs with the ACT programming tutor. As the student works, the ""tutor"" maintains an estiamte of the probability taht the student has learned each of the rules in the ideal model - knowledge tracing.</p> <p>Model is quite successful in predicting test performance.</p>","","https://link.springer.com/article/10.1007/s11257-007-9045-6","","","","","","","","","","","","","","","","","","","","","","","","","","","","","","","","","","","","","","","","","","","","","","","",""
"2IZPPQ9L","book","2014","Baker, R","Big Data in Education","","","","","","","2014","2019-09-17 21:41:27","2019-09-17 21:41:27","","","","","","","","","","","","","","New York, NY","","","","","","","","","","","","","","","","","","","","","","","","","","","","","","","","","1","","","","","","","","","","","","","","","","","","","","","","","","","",""
"2FY5XLVB","videoRecording","2016","Georgia Tech","Cross Validation","","","","","https://www.youtube.com/watch?v=sFO2ff-gTh0","","2016-09-09","2019-09-17 21:41:27","2019-09-17 21:41:27","2016-09-09 19:37:11","","","","","","","","","","","","Youtube","","","","","","","","","","","","https://www.youtube.com/watch?v=sFO2ff-gTh0","","","","","","","","","","","","","","","","","","","","","","","","","","","","","","","","","","","","","","","","","","","","","","","",""
"FMZXFDHU","book","2019","Grolemund, Garrett","Hands-On Programming with R","","","","","https://rstudio-education.github.io/hopr/","This book will teach you how to program in R, with hands-on examples. I wrote it for non-programmers to provide a friendly introduction to the R language. You’ll learn how to load data, assemble and disassemble data objects, navigate R’s environment system, write your own functions, and use all of R’s programming tools. Throughout the book, you’ll use your newfound skills to solve practical data science problems.","2019-09-12","2019-09-17 21:41:27","2019-09-17 21:41:27","2019-09-12 17:12:28","","","","","","","","","","","","","","","","","","","rstudio-education.github.io","","","","","https://rstudio-education.github.io/hopr/","","","","","","","","","","","","","","","","","","","","","","","","","","","","","","","","","","","","","","","","","","","","","","","",""
"89D6JQW2","webpage","2019","Powell, V; Lehe, L","Principal Component Analysis explained visually","Explained Visually","","","","http://setosa.io/ev/principal-component-analysis/","","2019-09-12","2019-09-17 21:41:27","2019-09-17 21:41:27","2019-09-12 17:17:07","","","","","","","","","","","","","","","","","","","","","","<p>PCA used to eliminate dimensions.</p> <p> </p> <p>Transforms variables to new variables called prcinciapl components (PC), and then drop those that contribute least to the variation in dependent variables.</p>","","http://setosa.io/ev/principal-component-analysis/","","","","","","","","","","","","","","","","","","","","","","","","","","","","","","","","","","","","","","","","","","","","","","","",""