"L6PJPQEB","book","2015","Zheng, Alice","Evaluating Machine Learning Models","","","","","http://www.oreilly.com/data/free/evaluating-machine-learning-models.csp?intcmp=il-data-free-lp-lgen_free_reports_page","Data science today is a lot like the Wild West: there’s endless opportunity and excitement, but also a lot of chaos and confusion. If you’re new to data science and applied machine learning, evaluating a machine-learning model can seem pretty overwhelming...","2015-09","2019-09-17 21:41:24","2019-09-17 21:41:24","2015-12-15 18:26:39","","","","","","","","","","","","O'Reily Media","Sebastopol, CA","","","","","","","","","<p>Evaluation metrics for supervised learning models</p> <p><span style=""text-decoration: underline;"">Classification metrics</span></p> <p>- accuracy = # correct predictions/ # total data points</p> <p>- confusion matrix: useful when you want to look at how many examples failed for class 0 vs class 1.</p> <p>- log-loss: can be used if classifier is a numeric probability instead of class label 0 or 1</p> <p>- AUC = area under curve for ROC curve. Perfect classifier model gives AUC of 1.</p> <p><span style=""text-decoration: underline;"">Ranking metrics</span></p> <p>- precision-recall = two concepts where precision = # happy corret answers/ # total items returned by ranker, and recall = # happy corret answers/ # total relevant items</p> <p>-precision recall curve and F1 score</p> <p>- NDCG</p> <p><span style=""text-decoration: underline;"">Regression metrics</span></p> <p>- RMSE</p> <p>- Quantiles of errors</p>","","http://www.oreilly.com/data/free/evaluating-machine-learning-models.csp?intcmp=il-data-free-lp-lgen_free_reports_page","","","","","","","","","","","","","","","","","","","","","","","","","","","","","","","","","","","","","","","","","","","","","","","",""
"V6RQLEHV","blogPost","2015","Leong, B; Polonetsky, J","Why Opting Out of Student Data Collection Isn’t the Solution","EdSurge","","","","https://www.edsurge.com/news/2015-03-16-why-opting-out-of-student-data-collection-isn-t-the-solution","In every privacy debate across every industry, the same questions arise about the rights of individuals to “opt-out” of their data being collected or used. So it should come as no surprise that the “when” and “how” of parent and student opt-outs of education data collection or use has become a robust","2015-03-16","2019-09-17 21:41:24","2019-09-17 21:41:24","2016-01-16 16:31:25","","","","","","","","","","","","","","","","","","","","","","","","https://www.edsurge.com/news/2015-03-16-why-opting-out-of-student-data-collection-isn-t-the-solution","","","","","","","","","","","","","","","","","","","","","","","","","","","","","","","","","","","","","","","","","","","","","","","",""
"269965TQ","videoRecording","2015","Educause","Why Is Measuring Learning So Difficult?","","","","","https://www.youtube.com/watch?v=_iv8A1pHNYA","Several higher education learning and assessment professionals discuss the difficulties of measuring learning.","2015-08-17","2019-09-17 21:41:24","2019-09-17 21:41:24","2016-01-17 18:50:57","","","","","","","","","","","","","","","","","","","YouTube","","","","","","","Learning; Assessment; Education; educational assessment; EDUCAUSE; Higher Education; learners; Teaching and learning","","","","","","","","","","","","","","","","","","","","","470 seconds","","","","","","","","","","","","","","","","","","","","","","","","",""
"EN6T8H46","webpage","2016","Weinersmith, Zach","Saturday Morning Breakfast Cereal","","","","","http://www.smbc-comics.com/index.php?id=3978","","2016-01-05","2019-09-17 21:41:24","2019-09-17 21:41:24","2016-01-18 18:17:09","","","","","","","","","","","","","","","","","","","","","","","","http://www.smbc-comics.com/index.php?id=3978","","","","","","","","","","","","","","","","","","","","","","","","","","","","","","","","","","","","","","","","","","","","","","","",""
"264394TV","conferencePaper","2014","Clow, Doug","Data wranglers: human interpreters to help close the feedback loop","Proceedings of the Fourth International Conference on Learning Analytics And Knowledge","","","","","","2014","2019-09-17 21:41:24","2019-09-17 21:41:24","","49–53","","","","","","","","","","","ACM","","","","","","","","","","<p>Role of human data wranglers at the Open University, UK (a LA program)</p> <p>Learning Analytics Cycle (Clow): Closing the feedback loop means actionable intelligence from data is produced, and interventions are made.</p> <p>Institution-wide capability-building learning analytics programs: Data wranglers deployed to engage in sensemaking activity with learning analytics data.</p> <p>Main data sources: survey feedback, activity from VLE/LMS, delivery data, completion and pass rates.</p> <p>Strong potential synergy with Learning Design, where it provides context for interpreting learning analytics, and learning analytics provide insight to underpin process of Learning Design.</p> <p>Examples of analyses:</p> <p>- activity on VLE/LMS - support development of proactive student support system, capture similar charts for new cohort of students</p> <p>- importance of assessments - students only do activity when specified in an assessment (as compared to just in the course)</p> <p>- students' reported enjoyment of different learning activities - when teaching online, use less text and more activities.</p> <p> </p> <p> </p> <p> </p> <p> </p> <p> </p> <p> </p>","","","","","","","","","","","","","","","","","","","","","","","","","","","","","","","","","","","","","","","","","","","","","","","","","",""
"GRHEP2VR","magazineArticle","2015","Kucirkova, Natalia; FitzGerald, Elizabeth","Zuckerberg is ploughing billions into 'personalised learning' – why?","The Conversation","","","","http://theconversation.com/zuckerberg-is-ploughing-billions-into-personalised-learning-why-51940","Zuckerburg wants to plough billions into personalised learning, but his way may not be the right way.","2015-12-09","2019-09-17 21:41:24","2019-09-17 21:41:24","2016-01-18 19:14:05","","","","","","","","","","","","","","","","","","","","","","<p>Zuckerberg argues for personalized learning</p> <p>Chan Zuckerberg Intiative's Personalized Learning Platform - algorithms provide users with content based on analysis of past behavior and demonsterated itnerset.</p> <p>Dangers of personalized learning:</p> <p>1. Only feeding what learner is interested in compromizes goal of general knowledge.</p> <p>2. When it is so personalized, lack of ability to compensate may mean they suffer in the real world.</p> <p>3. Preferences are not fixed.</p> <p>Where personalized learning could help</p> <p>- sense of ownership and relevance</p> <p>- personalized assessments</p> <p>- E.g. AltSchool, community of microschools whose personalized learning experience involves collecting data about pupils' attainemnt, grades and memory test results and energy levels.</p>","","https://theconversation.com/zuckerberg-is-ploughing-billions-into-personalised-learning-why-51940","","","","","","","","","","","","","","","","","","","","","","","","","","","","","","","","","","","","","","","","","","","","","","","",""
"43YM4VCY","videoRecording","2015","Georgia Tech","Feature Selection","","","","","https://www.youtube.com/watch?v=8CpRLplmdqE","","2015-02-23","2019-09-17 21:41:25","2019-09-17 21:41:25","2016-01-18 19:18:06","","","","","","","","","","","","Youtube","","","","","","","","","","","","https://www.youtube.com/watch?v=8CpRLplmdqE","","","","","","","","","","","","","","","","","","","","","","","3:13","","","","","","","","","","","","","","","","","","","","","","","","",""
"EDJSL2BH","bookSection","2016","Hanneman, R.A.; Riddle, M.","Chapter 1: Social Network Data","Introduction to Social Network Methods","","","","http://faculty.ucr.edu/~hanneman/nettext/C1_Social_Network_Data.html","","2016-01-18","2019-09-17 21:41:25","2019-09-17 21:41:25","2016-01-18 20:17:24","","","","","","","","","","","","","","","","","","","","","","<p>Social network methods</p> <p><span style=""text-decoration: underline;"">Social network data</span></p> <p>Data structure: square array of measurements, where both rows and columns are cases/ observations. The cell describes the relationship between the actors. </p> <p>Allows us to see which actors are similar to which, therefore helps us to see which actors have similar position in the network. (1) Where they are located or ""embedded"" in the overall network.</p> <p>Looking at data structure more holistically - e.g. ""density"" i.e. more 1s than 0s, cells above and below diagonal to see if there is reciprocity in choices. (2) how the whole pattern of individual choices gives rise to more holistic patterns.</p> <p>Conventional data focuses on actors and attributes. Network data focuses on actors and relations.</p> <p>Next sections - issues that arise in designm sampling and measurement</p> <p><span style=""text-decoration: underline;"">Nodes</span></p> <p>Network studies are more likely to include all of actors who occur within some (usually nturally occuring) bounary. Often network studies don't use ""samples"", but include all actors in the population. In this sense, the population may have been selected by probability methods. Hence, it is important for analyst to be clear about boundaries of each population to be studied and how each unit is selected. </p> <p>Types of boundaries - 1) imposed or created by actors themselves (i.e. who they are linked with, such as a club, neighborhood, classroom) = draw boundaries around a population that is known a priori to be a network, 2) demographic/ ecological appraoch e.g. people in a bounded spatial area or meet some income criterion, imposed by investigator. </p> <p>Expansion of boundaries is done by replicating populations.</p> <p>Multi-modal - individual is embedded in networks that are embedded in networks that are embedded in networks.</p> <p><span style=""text-decoration: underline;"">Edges</span></p> <p>All ties studied or different appraoches used that sample ties. When we collect network data, we are usually selecting from among a set of kinds of relations that we might have measured.</p> <p>- Full network methods</p> <p>- Snowball methods</p> <p>- Ego-centric networks (with alter connections)</p> <p>- Ego-centric networks (ego only)</p> <p>Multiple relations - in the most common type, only one kind of relation is described. Decisions on which relations to examine - conceptual appraoches may help e.g. systems theory.</p> <p>Note scales of measurement - nominal (binary and multi-categorical), ordinal, interval levels. Different approaches in SNA.</p> <p><span style=""text-decoration: underline;"">Note:</span> SNA is more a branch of mathematical sociology than of statistical analysis. Applications of statistic to social network data is ""cutting edge"" research - not covered in this article.</p>","","http://faculty.ucr.edu/~hanneman/nettext/C1_Social_Network_Data.html","","","","","","","","","","","","","","","","","","","","","","","","","","","","","","","","","","","","","","","","","","","","","","","",""
"BB5VXN23","webpage","2014","Groelmund, Garrett","RStudio Cheat Sheets","RStudio","","","","https://www.rstudio.com/resources/cheatsheets/","","2014-08-01","2019-09-17 21:41:25","2019-09-17 21:41:25","2016-01-19 21:17:28","","","","","","","","","","","","","","","","","","","","","","","","http://shiny.rstudio.com/articles/rm-cheatsheet.html","","","","","","","","","","","","","","","","","","","","","","","","","","","","","","","","","","","","","","","","","","","","","","","",""
"YSDX5X2P","conferencePaper","2013","san Pedro, Maria Ofelia; Baker, Ryan; Bowers, Alex; Heffernan, Neil","Predicting college enrollment from student interaction with an intelligent tutoring system in middle school","Educational Data Mining 2013","","","","","","2013","2019-09-17 21:41:25","2019-09-17 21:41:25","","","","","","","","","","","","","","","","","","","","","","","","","","","","","","","","","","","","","","","","","","","","","","","","","","","","","","","","","","","","","","","","","","","","","","","","",""
"THN793VB","journalArticle","2012","Greller, Wolfgang; Drachsler, Hendrik","Translating Learning into Numbers: A Generic Framework for Learning Analytics","Journal of Educational Technology & Society","","1176-3647","","http://www.jstor.org/stable/jeductechsoci.15.3.42","ABSTRACT With the increase in available educational data, it is expected that Learning Analytics will become a powerful means to inform and support learners, teachers and their institutions in better understanding and predicting personal learning needs and performance. However, the processes and requirements behind the beneficial application of Learning and Knowledge Analytics as well as the consequences for learning and teaching are still far from being understood. In this paper, we explore the key dimensions of Learning Analytics (LA), the critical problem zones, and some potential dangers to the beneficial exploitation of educational data. We propose and discuss a generic design framework that can act as a useful guide for setting up Learning Analytics services in support of educational practice and learner guidance, in quality assurance, curriculum development, and in improving teacher effectiveness and efficiency. Furthermore, the presented article intends to inform about soft barriers and limitations of Learning Analytics. We identify the required skills and competences that make meaningful use of Learning Analytics data possible to overcome gaps in interpretation literacy among educational stakeholders. We also discuss privacy and ethical issues and suggest ways in which these issues can be addressed through policy guidelines and best practice examples.","2012","2019-09-17 21:41:25","2019-09-17 21:41:25","2016-09-03 18:55:41","42-57","","3","15","","Journal of Educational Technology & Society","Translating Learning into Numbers","","","","","","","","","","","","JSTOR","","","","","","","","","","","","","","","","","","","","","","","","","","","","","","","","","","","","","","","","","","","","","","","","","","","","",""
"MWSBWVNW","bookSection","2006","Kay, Judy; Maisonneuve, Nicolas; Yacef, Kalina; Reimann, Peter","The Big Five and Visualisations of Team Work Activity","Intelligent Tutoring Systems","978-3-540-35159-7 978-3-540-35160-3","","","http://link.springer.com/chapter/10.1007/11774303_20","We have created a set of novel visualisations of group activity: they mirror activity of individuals and their interactions, based upon readily available authentic data. We evaluated these visualisations in the context of a semester long software development project course. We give a theoretical analysis of the design of our visualizations using the framework from the “Big 5” theory of team work as well as a qualitative study of the visualisations and the students’ reflective reports. We conclude that these visualisations provide a powerful and valuable mirroring role with potential, when well used, to help groups learn to improve their effectiveness.","2006-06-26","2019-09-17 21:41:25","2019-09-17 21:41:25","2016-09-03 19:10:12","197-206","","","","","","","Lecture Notes in Computer Science","4053","","","Springer Berlin Heidelberg","","en","©2006 Springer-Verlag Berlin Heidelberg","","","","link.springer.com","","DOI: 10.1007/11774303_20","","","https://link.springer.com/chapter/10.1007/11774303_20","","Multimedia Information Systems; User Interfaces and Human Computer Interaction; Artificial Intelligence (incl. Robotics); Computers and Education; Information Systems Applications (incl. Internet)","Ikeda, Mitsuru; Ashley, Kevin D.; Chan, Tak-Wai","","","","","","","","","","","","","","","","","","","","","","","","","","","","","","","","","","","","","","","","","","","","",""
"4GUVK6AW","journalArticle","2015","Konstan, Joseph A.; Walker, J. D.; Brooks, D. Christopher; Brown, Keith; Ekstrand, Michael D.","Teaching Recommender Systems at Large Scale: Evaluation and Lessons Learned from a Hybrid MOOC","ACM Trans. Comput.-Hum. Interact.","","1073-0516","10.1145/2728171","http://doi.acm.org/10.1145/2728171","","2015-04","2019-09-17 21:41:25","2019-09-17 21:41:25","2016-09-03 20:38:02","10:1–10:23","","2","22","","","Teaching Recommender Systems at Large Scale","","","","","","","","","","","","ACM Digital Library","","","<p>Case study: Introduction to Recommender Systems course on Coursera</p> <p>Coursera vs. on-campus for credit course using Coursera platform and flipped classroom instruction model.</p> <p>For ""knowledge gain"", main predictor was effort expended.</p> <p>For ""completion"", few factors had strong predictive power, main predictor was intent to complete.</p> <p>face-to-face tudents performed as well as the online-only students or better.</p> <p>Experiment design:</p> <p>- self-selection to enroll in MOOC and face-to-face means random assignment not possible. However, the rest held constant, and demographic data were used to ensure groups compared were similar in the relevant aspects.</p> <p>Measures:</p> <p>- Pre and post class surveys designed to measure students' backgroun, intentions with respect to the MOOC they are taking, and reactions to the MOOC expereince.</p> <p>- Knowledge test administered thrice, including one 5 months after the end of the course - to measure retention of subject matter knowledge.</p> <p>Results:</p> <p>- An exploratory PCA was conducted, and four factors were extracted. Eigenvalues &gt; 1 for all 15 individual items. 4 factors were underlying constructs: instructor, pragmatic, professional, interest. These constructs used to segment student population.</p> <p>- Completion - Logistic regression performed. Results = intention predicts completion; little else does.</p> <p>- Knowledge - Results = student knowledge increased.</p> <p>- face-to-face vs online-only: Using pre-test as a baseline, both groups were statistically equivalent in baseline knowledge. Compared the two groups in terms of normalized gains in knowledge achieved over semester. Nominal difference and low N compromises on statistical significance and external validity.</p> <p>- OLS that attempts to predict normalized knowledge gains, to understand factors that contribute to learning: baseline (-ve), concepts track, number of assignemtn completed (strongest), english proficiency (marginal).</p> <p>Unique part about this research: 1) offered in both MOOC online-only and face-to-face classroom allowed comparison, 2) mixed programming and non-programming students in a two-track course model, 3) extensive evaluation of student learning outcomes.</p> <p> </p> <p> </p> <p> </p> <p> </p>","","","","learning assessment; Massively Online Open Course (MOOC)","","","","","","","","","","","","","","","","","","","","","","","","","","","","","","","","","","","","","","","","","","","","","",""
"QKQLX8NL","bookSection","2013","Desmarais, Michel C.; Naceur, Rhouma","A Matrix Factorization Method for Mapping Items to Skills and for Enhancing Expert-Based Q-Matrices","Artificial Intelligence in Education","978-3-642-39111-8 978-3-642-39112-5","","","http://link.springer.com/chapter/10.1007/978-3-642-39112-5_45","Uncovering the right skills behind question items is a difficult task. It requires a thorough understanding of the subject matter and of the cognitive factors that determine student performance. The skills definition, and the mapping of item to skills, require the involvement of experts. We investigate means to assist experts for this task by using a data driven, matrix factorization approach. The two mappings of items to skills, the expert on one side and the matrix factorization on the other, are compared in terms of discrepancies, and in terms of their performance when used in a linear model of skills assessment and item outcome prediction. Visual analysis shows a relatively similar pattern between the expert and the factorized mappings, although differences arise. The prediction comparison shows the factorization approach performs slightly better than the original expert Q-matrix, giving supporting evidence to the belief that the factorization mapping is valid. Implications for the use of the factorization to design better item to skills mapping are discussed.","2013-07-09","2019-09-17 21:41:26","2019-09-17 21:41:26","2016-09-03 20:44:11","441-450","","","","","","","Lecture Notes in Computer Science","7926","","","Springer Berlin Heidelberg","","en","©2013 Springer-Verlag Berlin Heidelberg","","","","link.springer.com","","DOI: 10.1007/978-3-642-39112-5_45","","","https://link.springer.com/chapter/10.1007/978-3-642-39112-5_45","","User Interfaces and Human Computer Interaction; Artificial Intelligence (incl. Robotics); Computers and Education; Information Systems Applications (incl. Internet); alternating least squares matrix factorization; Cognitive modeling; Educational Technology; latent skills; Pedagogic Psychology; skills assessment; Student models","Lane, H. Chad; Yacef, Kalina; Mostow, Jack; Pavlik, Philip","","","","","","","","","","","","","","","","","","","","","","","","","","","","","","","","","","","","","","","","","","","","",""
"78UV6AFS","book","2015","Matsuda, Noboru; Furukawa, Tadanobu; Bier, Norman; Faloutsos, Christos","Machine Beats Experts: Automatic Discovery of Skill Models for Data-Driven Online Course Refinement","","","","","http://eric.ed.gov/?id=ED560513","How can we automatically determine which skills must be mastered for the successful completion of an online course? Large-scale online courses (e.g., MOOCs) often contain a broad range of contents frequently intended to be a semester's worth of materials; this breadth often makes it difficult to articulate an accurate set of skills and knowledge (i.e., a skill model, or the QMatrix). We have developed an innovative method to discover skill models from the data of online courses. Our method assumes that online courses have a pre-defined skill map for which skills are associated with formative assessment items embedded throughout the online course. Our method carefully exploits correlations between various parts of student performance, as well as in the text of assessment items, to build a superior statistical model that even outperforms human experts. To evaluate our method, we compare our method with existing methods (LFA) and human engineered skill models on three Open Learning Initiative (OLI) courses at Carnegie Mellon University. The results show that (1) our method outperforms human-engineered skill models, (2) skill models discovered by our method are interpretable, and (3) our method is remarkably faster than existing methods. These results suggest that our method provides a significant contribution to the evidence-based, iterative refinement of online courses with a promising scalability. [For complete proceedings, see ED560503.]","2015-06","2019-09-17 21:41:26","2019-09-17 21:41:26","2016-09-03 20:48:57","","","","","","","Machine Beats Experts","","","","","International Educational Data Mining Society","","en","","","","","ERIC","","","<p>Developed an online innovative method to discover skill models from the data of online courses.</p> <p>Online courses have a pre-defined skill map (Q-matrix) - skills are associated with formative assesment items embedded throughout the online course.</p> <p>Developed an efficient, practical, and scalable method called eEPIPHANY to automatically discover skill sets from online course data, through correlations between student performance and assessment item text data.</p> <p>- input: matrix representing a chronological record of students’ responses to assessment items, called an A-matrix.</p> <p>- output: skill mode (Q-matrix) that produces the best prediction of the A-matrix. Find Q-matrix by itself or refine a given Q-matrix by 1) clustering assessment items with latent features that characterize similarity in the difficulty of assessment items, 2) proposing new skill model by assuming that cluster provides a hint for new skills, 3) search for best skill model.</p> <p>Feature extraction</p> <p>- Matrix factorization strategy</p> <p>- Bag-of-words strategy</p> <p>Findings:</p> <p>- Using student respondse data always yields a better skill model than using BoW strategy (and BoW &gt; those hand-crafted by human experts).</p> <p>- Matrix factorization strategy efficiently discovers a latent skill model from teh student learning ata.</p> <p>- ePIPHANY can find a better skill model automatically without human interaction.</p>","","http://eric.ed.gov/?id=ED560513","","data; Automation; Comparative Analysis; Correlation; Formative Evaluation; models; Online Courses; Skills","","","","","","","","","","","","","","","","","","","","","","","","","","","","","","","","","","","","","","","","","","","","","",""
