"HQ6Y4N5C","journalArticle","2015","Konstan, Joseph A.; Walker, J. D.; Brooks, D. Christopher; Brown, Keith; Ekstrand, Michael D.","Teaching Recommender Systems at Large Scale: Evaluation and Lessons Learned from a Hybrid MOOC","ACM Trans. Comput.-Hum. Interact.","","1073-0516","10.1145/2728171","http://doi.acm.org/10.1145/2728171","","2015-04","2019-09-17 21:46:19","2019-09-17 21:46:19","2016-09-03 20:38:02","10:1–10:23","","2","22","","","Teaching Recommender Systems at Large Scale","","","","","","","","","","","","ACM Digital Library","","","<p>trial MOOCS: 1. we did not choose new material and we adjust design to reflect MOOC delivery to both world and students.2. developing the software platform which students could carry out many of the activities 3. accessible to nonprogrammers as well as programmers.</p> <p>Research Methods: 1. design: single-group cross-sectional research design. 2. participants 3. measures: use pre- and postclass surveys designed to measure students' background. 4. preliminary analyses: by examming a set of questions that asked students to rate.</p> <p>Difficult to study the differences in learning between face to face and MOOC due to the lack of a measure of baseline understanding or knowledge.</p> <p>Results: students knowledge increased; limited data suggests that face-to-face students learned at least as much as online-only students; students at all incoming knowledge levels benefited similarly from the course; students in the programming and concepts tracks had similar gains in concepts knowledge, but programming students gained further knowledge. Normalized knowledge gains are very difficult to predict; measures of relevant effort were strongest; predicting student end-of-term performance is difficult; appropriate predictor variables may be lacking.</p>","","","","learning assessment; Massively Online Open Course (MOOC)","","","","","","","","","","","","","","","","","","","","","","","","","","","","","","","","","","","","","","","","","","","","","",""
"T2KNHX5K","bookSection","2013","Desmarais, Michel C.; Naceur, Rhouma","A Matrix Factorization Method for Mapping Items to Skills and for Enhancing Expert-Based Q-Matrices","Artificial Intelligence in Education","978-3-642-39111-8 978-3-642-39112-5","","","http://link.springer.com/chapter/10.1007/978-3-642-39112-5_45","Uncovering the right skills behind question items is a difficult task. It requires a thorough understanding of the subject matter and of the cognitive factors that determine student performance. The skills definition, and the mapping of item to skills, require the involvement of experts. We investigate means to assist experts for this task by using a data driven, matrix factorization approach. The two mappings of items to skills, the expert on one side and the matrix factorization on the other, are compared in terms of discrepancies, and in terms of their performance when used in a linear model of skills assessment and item outcome prediction. Visual analysis shows a relatively similar pattern between the expert and the factorized mappings, although differences arise. The prediction comparison shows the factorization approach performs slightly better than the original expert Q-matrix, giving supporting evidence to the belief that the factorization mapping is valid. Implications for the use of the factorization to design better item to skills mapping are discussed.","2013-07-09","2019-09-17 21:46:19","2019-09-17 21:46:19","2016-09-03 20:44:11","441-450","","","","","","","Lecture Notes in Computer Science","7926","","","Springer Berlin Heidelberg","","en","©2013 Springer-Verlag Berlin Heidelberg","","","","link.springer.com","","DOI: 10.1007/978-3-642-39112-5_45","","","https://link.springer.com/chapter/10.1007/978-3-642-39112-5_45","","User Interfaces and Human Computer Interaction; Artificial Intelligence (incl. Robotics); Computers and Education; Information Systems Applications (incl. Internet); alternating least squares matrix factorization; Cognitive modeling; Educational Technology; latent skills; Pedagogic Psychology; skills assessment; Student models","Lane, H. Chad; Yacef, Kalina; Mostow, Jack; Pavlik, Philip","","","","","","","","","","","","","","","","","","","","","","","","","","","","","","","","","","","","","","","","","","","","",""
"BQ2AT4IU","book","2015","Matsuda, Noboru; Furukawa, Tadanobu; Bier, Norman; Faloutsos, Christos","Machine Beats Experts: Automatic Discovery of Skill Models for Data-Driven Online Course Refinement","","","","","http://eric.ed.gov/?id=ED560513","How can we automatically determine which skills must be mastered for the successful completion of an online course? Large-scale online courses (e.g., MOOCs) often contain a broad range of contents frequently intended to be a semester's worth of materials; this breadth often makes it difficult to articulate an accurate set of skills and knowledge (i.e., a skill model, or the QMatrix). We have developed an innovative method to discover skill models from the data of online courses. Our method assumes that online courses have a pre-defined skill map for which skills are associated with formative assessment items embedded throughout the online course. Our method carefully exploits correlations between various parts of student performance, as well as in the text of assessment items, to build a superior statistical model that even outperforms human experts. To evaluate our method, we compare our method with existing methods (LFA) and human engineered skill models on three Open Learning Initiative (OLI) courses at Carnegie Mellon University. The results show that (1) our method outperforms human-engineered skill models, (2) skill models discovered by our method are interpretable, and (3) our method is remarkably faster than existing methods. These results suggest that our method provides a significant contribution to the evidence-based, iterative refinement of online courses with a promising scalability. [For complete proceedings, see ED560503.]","2015-06","2019-09-17 21:46:20","2019-09-17 21:46:20","2016-09-03 20:48:57","","","","","","","Machine Beats Experts","","","","","International Educational Data Mining Society","","en","","","","","ERIC","","","<p>eEPIPHANY: a collection of data-mining techniques to automatically refine a human-crafted set of skills, it is efficient, practical and scalable method. Its goal is provide constructive feedback to online course designers and developers for iterative course improvement.</p> <p>Contributions: 1. new problem formulation 2. new algorithm 3. evaluation</p> <p>Skill-item association: mapping between a single skill and multiple assessment items in the skill map.</p> <p>steps for eEPIPHANY: 1. clustering assessment item 2. proposing a new skill model 3. searching for the best skill model</p> <p>two latent-feature extraction strategies: 1. the Matrix Factorization(MF): transformed A-matrix into the D-matrix 2. the Bag-of-Words(BoW): creates the F-matrix directly from a collection of item stems</p> <p>Feature extraction is to generate a two-dimensional matrix, showing a mapping betwen assessment items and skill candidates.</p> <p>three strategies to refine the ""default"" skill model: 1. replace strategy 2. append strategy 3. split strategy</p> <p> </p>","","http://eric.ed.gov/?id=ED560513","","data; Automation; Comparative Analysis; Correlation; Formative Evaluation; models; Online Courses; Skills","","","","","","","","","","","","","","","","","","","","","","","","","","","","","","","","","","","","","","","","","","","","","",""
"KU92L2CU","conferencePaper","2008","Cortez, Paulo; Silva, Alice Maria Gonçalves","Using data mining to predict secondary school student performance","Proceedings of 5th Annual Future Business Technology Conference","978-90-77381-39-7","","","http://repositorium.sdum.uminho.pt/handle/1822/8024","Although the educational level of the Portuguese population has improved in the last decades, the statistics keep Portugal at Europe’s tail end due to its high student failure rates. In particular, lack of success in the core classes of Mathematics and the Portuguese language is extremely serious. On the other hand, the fields of Business Intelligence (BI)/Data Mining (DM), which aim at extracting high-level knowledge from raw data, offer interesting automated tools that can aid the education domain. The present work intends to approach student achievement in secondary education using BI/DM techniques. Recent real-world data (e.g. student grades, demographic, social and school related features) was collected by using school reports and questionnaires. The two core classes (i.e. Mathematics and Portuguese) were modeled under binary/five-level classification and regression tasks. Also, four DM models (i.e. Decision Trees, Random Forest, Neural Networks and Support Vector Machines) and three input selections (e.g. with and without previous grades) were tested. The results show that a good predictive accuracy can be achieved, provided that the first and/or second school period grades are available. Although student achievement is highly influenced by past evaluations, an explanatory analysis has shown that there are also other relevant features (e.g. number of absences, parent’s job and education, alcohol consumption). As a direct outcome of this research, more efficient student prediction tools can be be developed, improving the quality of education and enhancing school resource management.","2008-04","2019-09-17 21:46:20","2019-09-17 21:46:20","2016-09-04 01:23:19","","","","","","","","","","","","EUROSIS","Porto, Spain","eng","openAccess","","","","repositorium.sdum.uminho.pt","","","","","http://repositorium.sdum.uminho.pt/handle/1822/8024","","","","","","","","","","","","","","","","","","","","","","","","","","","","","","","","","5th Annual Future Business Technology Conference","","","","","","","","","","","","","","",""
"SGGNXC8Q","journalArticle","2008","Baker, Ryan S. J. d; Corbett, Albert T.; Roll, Ido; Koedinger, Kenneth R.","Developing a generalizable detector of when students game the system","User Modeling and User-Adapted Interaction","","0924-1868, 1573-1391","10.1007/s11257-007-9045-6","http://link.springer.com/article/10.1007/s11257-007-9045-6","Some students, when working in interactive learning environments, attempt to “game the system”, attempting to succeed in the environment by exploiting properties of the system rather than by learning the material and trying to use that knowledge to answer correctly. In this paper, we present a system that can accurately detect whether a student is gaming the system, within a Cognitive Tutor mathematics curricula. Our detector also distinguishes between two distinct types of gaming which are associated with different learning outcomes. We explore this detector’s generalizability, and find that it transfers successfully to both new students and new tutor lessons.","2008-01-23","2019-09-17 21:46:20","2019-09-17 21:46:20","2016-09-04 01:34:49","287-314","","3","18","","User Model User-Adap Inter","","","","","","","","en","","","","","link.springer.com","","","","","https://link.springer.com/article/10.1007/s11257-007-9045-6","","","","","","","","","","","","","","","","","","","","","","","","","","","","","","","","","","","","","","","","","","","","","","","",""
"QBGUKXHJ","book","2014","Baker, R","Big Data in Education","","","","","","","2014","2019-09-17 21:46:20","2019-09-17 21:46:20","","","","","","","","","","","","","","New York, NY","","","","","","","","","<p>Video 1 chapter 7</p> <p>Clustering: a type of structure discovery algorithm<br />1. you have a large number of data points<br />2. you want to find what structure there is among the data points<br />3. you do not know anything a priori about the structure<br />4. clustering tries to find data points that""group together""</p> <p>k-means steps:<br />how many clustering we want:orange, green, red, purple, black(different color point)<br />centroids: usually chosen randomly<br />classify every point <br />re-fit the centroids as the center of the points in the each cluster<br />convergence<br />some outliers are exist</p> <p>Video 2 chapter 7</p> <p>clustering: validation and selection of k</p> <p>distortion: mean squared deviation, can not choose size of k<br />1. take each point p<br />2. find the centroidof P's cluster C<br />3. find the distance D from C to P<br />4. square D to get D'<br />5. sum all D' to get distortion<br />Distance: euclidean  distance can be computed an arbitrary number of dimension</p> <p>information criterion:<br />1. assess how much fit would be expected from a random N centroids<br />2. assess how much fit you actually had<br />3. find the difference</p> <p>how many clusters:<br />1. try several values of k<br />2. find “best-fitting” set of clusters for each value of k<br />3. choose k with best value of BIC/AIC</p> <p>Video 6 chapter 7</p> <p>Q-matrix: a table where rows are items and columns are skills. It is also called knowledge component (KC) model or skill-item mapping.<br />Every item must include at least one skill.</p> <p>How do we get a skill-item mappting:<br />1. automatic model discovery: learn the mapping between items and skills solely from data.<br />Barnes et al.'s: better model property: 1. given a skill-item mapping, you can predict for each combination of skills whether a student should get each item correct or not. 2. fit a model like PFA or BKT, and see how well it fits data, given the skill-item mapping. <br />2. hand-development and refinement: original way that Q-matrices were created actually. strategies for Q-matrix refinement: 1). try to smooth learning curves(shows relationship between amount of practice and performance) 2). look for skills with no apparent learning 3). look for problems with unexpected error rates:DataShop<br />3. hybrid approaches</p> <p>Video 1 Chapter 1</p> <p>joint goal of exploring and promote<br />types of EDM/LA method: 1. prediction: develop a model infer a single aspect data 2. structure discovery: find structure and patterns in the data, no specific target 3. relationship mining: find relationship between variables in a data set with many variables 4. distillation of data for human judgement 5. discovery with models</p> <p>why data mining did not start more earlier: no enough data and hard to scale</p> <p>Video 3 Chapter 1</p> <p>classification: the thing you want to predict is categorical, to determine which features in which combination can predict the label. <br />labels come from: in-software performance/school records/test data/survey data/field observation or video coding/text replays.<br />step regression: fit linear regression function, all value below 0.5 are treated as 0 and all value &gt;=0.5 are treated as 1. <br />logistic regression: fits logistic function to data to find out the frequency, closer to 1. <br />decision trees</p> <p>Video 4 Chapter 1</p> <p>decision rule: sets of if-then rules which you check in order<br />K*: predicts a data point from neighboring data points, good when data is very divergent. advantage is works when nothing else works. Drawback is need to have the whole data set. <br />Bagged Stumps: related to decision trees, relatively conservative.<br />support vector machine/genetic algorithms/neural networks(complicated model) good for some problem but not for most type of educational data.</p> <p>Video 2 Chapter 2</p> <p>Diagnostic matrics: different methods, different matrics.</p> <p>accuracy: easiest measures of model goodness, # of agreements/total number of codes/assessments.</p> <p>Kappa: (agreement-expected agreement)/(1-expected agreement)<br />Kappa = 0, agreement is at chance<br />Kappa = 1, agreement is perfect<br />Kappa = -1, agreement is perfectly inverse<br />Kappa &gt;1, you messed up somewhere<br />Kappa &lt;0, model is worse than chance, very rare unless using cross-validation.<br />0&lt;Kappa &lt;1, typically 0.3-0.5 is good.<br />Kappa is scaled by the proportion of each category, so there is no standard.</p> <p>Video 3 Chapter 2</p> <p>ROC: receiver-operating characteristic curve, predicting something which has two values. outputs a probability or real value. <br />Four possibilities: true positive/false positive/true negative/ false negative<br />X axis = percent false positives<br />Y axis = percent true positives<br />A‘ closely approximates the area under the ROC curve, called AUC. A' only work for two categories. it's always higher than Kappa values. <br />precision = TP/(TP+FP); the probability that a data point classified as true is actually true.<br />recall = tp/(tp+fn); the probability that a data point that is actually true is classifies as true. </p> <p>Video 4 Chapter 2</p> <p>metrics for regressors: <br />linear correlation: Pearson's correlation. 1 is perfect, 0 none; -1 is perfectly negatively correlated. in between depends on the field. in physics correlation of 0.8 is weak. in education correlation of 0.3 is good. R^2 a measure of what percentage of variance in dependent measures. <br />MAD/RMSE: mean absolute deviation/root mean squared error. MAS tells the average amount to which the predictions deviate from the actual values. RMSE penalizes large deviation more than small deviation. Lower MAD/RMSE and high correlation is good model. High MAD/RMSE and low correlation(model values are in the right range, but model does not capture relative change) is bad model. <br />information criteria: 1. BIC value over 0 worse than expected given number of vairables. under 0, better than expected given number of variables. it's statistically equivalent to k-fold cross-validation for optimal k. 2. AIC an information critiera, make slightly different trade-off between goodness of fit and flexibility of fit. Equivalent to leave-out-one-cross-validation.</p> <p>Video 5 Chapter 2</p> <p>cross-validation and over-fitting<br />over-fitting: fitting to the noise as well as the signal. reducing over-fitting: fewer variable and less complex functions. No way to eliminating over-fitting.  groups: k-fold, pick a number K, split into this number of groups, quicker. Leave-out-one, every data point is a fold, more stable. <br />Flat cross-validation: each point has equal chance of being placed into each fold. <br />stratified cross-validation:biases fold selection so that some variable is equally represented in each fold. <br />Student-level cross-validation: no student's data is represent in two folds.seen as minimum cross-validation.</p> <p>Video 1 Chapter 4</p> <p>Bayersian knowledge tracing(BKT): classic approach for measuring tightly defined skill in online learning. goal is to measuring how well a student knows a specific skill/knowledge component at a specific time. Use: assess a student knowledge of skill. where each item corresponds to a single skill. <br />Assumption: each item must involve a single latent skill, each skill has four parameter, able to compute latent knowledge P(Ln)/the probability P(CORR) that the learner will get the item correct. Two-state learning model. <br />Classical BKT: two learning parameters:P(L0),P(T); two performance parameters: P(G), P(S).<br />predicting current student correctness formular<br />Parameter constraints:to avoid model degeneracy<br />conceptual idea behind knowledge tracing: by looking at whether a student's performance is correct, we can infer whether they know the skill. <br />three public tools: 1. BNT-SM: Bayes Net Toolkit-Student Modeling 2. Fitting BKT at scale 3. BKT-BF:BKT-Brute Force(Grid Search)</p> <p> </p>","","","","","","","","","","","","","","","","","","","","","","","","1","","","","","","","","","","","","","","","","","","","","","","","","","",""
"TA4DJ6PS","videoRecording","2016","Georgia Tech","Cross Validation","","","","","https://www.youtube.com/watch?v=sFO2ff-gTh0","","2016-09-09","2019-09-17 21:46:21","2019-09-17 21:46:21","2016-09-09 19:37:11","","","","","","","","","","","","Youtube","","","","","","","","","","<p>cross validation</p> <p>higher order polynomial if the line does not good fit the all point.  <br />test set is how the system id ultimately going to be used. <br />The data being independent and identically distributed, the data all come from the same source. <br /> we want to do use a model that is complex enough to fit the data without causing problem on the test set. <br />pretend train data to test set.  For training data, split the data called folds then average all error together.</p>","","https://www.youtube.com/watch?v=sFO2ff-gTh0","","","","","","","","","","","","","","","","","","","","","","","","","","","","","","","","","","","","","","","","","","","","","","","",""
"NAI2E38S","book","2019","Grolemund, Garrett","Hands-On Programming with R","","","","","https://rstudio-education.github.io/hopr/","This book will teach you how to program in R, with hands-on examples. I wrote it for non-programmers to provide a friendly introduction to the R language. You’ll learn how to load data, assemble and disassemble data objects, navigate R’s environment system, write your own functions, and use all of R’s programming tools. Throughout the book, you’ll use your newfound skills to solve practical data science problems.","2019-09-12","2019-09-17 21:46:21","2019-09-17 21:46:21","2019-09-12 17:12:28","","","","","","","","","","","","","","","","","","","rstudio-education.github.io","","","<p>Chapter 1</p> <p>operation: + - * /</p> <p>stored data: die &lt;- 1:4 ## die 1 2 3 4</p> <p>%*% inner multiplication  %o% outer multiplication</p> <p>Functions: 1. round(x, digits = #) 2. factorial() 3. mean() 4. sample(x, size, replace = TRUE / FALSE) #sample takes two arguments: a vector named x and a number named size. sample will return size elements from the vector. Replace = TRUE causes sample to sample with replacement. 5. sum() 6. roll()</p> <p>function constructor: function() {}</p> <p>Chapter 2</p> <p>packages: install.packages(""ggplot2"") ## qplot makes ""quick plots""</p> <p>library: library(""ggplot2"")</p> <p>replicate(10, roll())  ## 3 7 5 3 6 2 3 8 11 7  ### first replicate the number of times you wish to repeat and R command, and then give it the command you wish to repeat.</p> <p>Chapter 3</p> <p>die &lt;- c(1,2,3,4,5,6) ## die 1 2 3 4 5 6</p> <p>is. vector(die) ## TRUE  ### is. vector tests whether an object is an atomic vector.</p> <p>1. length() 2. sqrt() 3. class() ##character/numeric 4. Sys.time()</p> <p>typeof() ##know what type of object you are working with, some R functions refer to doubles as ""numerics"".</p> <p>int &lt;- c(-1L, 2L. 4L) ## int -1 2 4</p> <p>typeof(int)  ## ""integer""</p> <p>logicals: 3&gt;4 ## FALSE</p> <p>dimensions attribute: dim(die) &lt;- c(2,3) ## die<br />##          [,1]    [,2]    [,3] <br />## [1,]       1       3       5                          ###matrices<br />## [2,]       2       4       6                          ### matrix(die, nrow =2)</p> <p>coercion: logical &lt; number &lt; character<br />TRUE = 1, FALSE = 0<br />as. character(1) ##""1""<br />as. logical(1) ## TRUE<br />as. numeric(FALSE) ##0</p> <p> </p> <p> </p> <p> </p> <p> </p> <p> </p>","","https://rstudio-education.github.io/hopr/","","","","","","","","","","","","","","","","","","","","","","","","","","","","","","","","","","","","","","","","","","","","","","","",""
"CV4QVCJ6","webpage","2019","Powell, V; Lehe, L","Principal Component Analysis explained visually","Explained Visually","","","","http://setosa.io/ev/principal-component-analysis/","","2019-09-12","2019-09-17 21:46:21","2019-09-17 21:46:21","2019-09-12 17:17:07","","","","","","","","","","","","","","","","","","","","","","<p>PCA: principal component analysis is a technique used to emphasize variation and bring out strong pattern in a dataset. Find the 2 principal components.</p> <p>2D example: PCA finds a new coordinate system in which every point has a new (x,y) value.</p> <p>3D example: drop one dimension, project the data into 2D and it is more clear.</p> <p>Eating in the UK( a 17D example): try to eliminate dimension and project the data into 2D.</p> <p> </p>","","http://setosa.io/ev/principal-component-analysis/","","","","","","","","","","","","","","","","","","","","","","","","","","","","","","","","","","","","","","","","","","","","","","","",""