"5MWCPL2G","journalArticle","1994","Corbett, Albert T.; Anderson, John R.","Knowledge tracing: Modeling the acquisition of procedural knowledge","User Modeling and User-Adapted Interaction","","0924-1868, 1573-1391","10.1007/BF01099821","http://link.springer.com.ezp-prod1.hul.harvard.edu/article/10.1007/BF01099821","This paper describes an effort to model students' changing knowledge state during skill acquisition. Students in this research are learning to write short programs with the ACT Programming Tutor (APT). APT is constructed around a production rule cognitive model of programming knowledge, called theideal student model. This model allows the tutor to solve exercises along with the student and provide assistance as necessary. As the student works, the tutor also maintains an estimate of the probability that the student has learned each of the rules in the ideal model, in a process calledknowledge tracing. The tutor presents an individualized sequence of exercises to the student based on these probability estimates until the student has ‘mastered’ each rule. The programming tutor, cognitive model and learning and performance assumptions are described. A series of studies is reviewed that examine the empirical validity of knowledge tracing and has led to modifications in the process. Currently the model is quite successful in predicting test performance. Further modifications in the modeling process are discussed that may improve performance levels.","1994-12-01","2019-09-17 21:46:17","2019-09-17 21:46:17","2013-04-21 21:21:19","253-278","","4","4","","User Model User-Adap Inter","Knowledge tracing","","","","","","","en","","","","","link.springer.com.ezp-prod1.hul.harvard.edu","","","<p>ACT programming tutor: practice envrionment in which student write short programs in Lisp, Prolog or Pascal. These three used by different school. <br />Three angle-bracket symbols in template:&lt;name&gt;/&lt;parameter&gt;/&lt;exprl&gt;</p> <p>Lisp: constructed around hundred rules for writing programs called the ideal student model. student's action is compared to applicable rules in the ideal model and immediate feedback is conventionally provided.</p> <p>The Cognitive Model: ACT-R theory: assumes a fundamental distinction between declarative knowledge(factual or experiential) and procedural knowledge(goal-oriented and mediated problem-solving behavior).</p> <p>Evaluating ACT-R procedural knowledge assumptions: three types to support:1. production rule model provides a regular analysis of learning trends. 2. production rule analyses have proven successful in predicting transfer among programming languages and across text editors. 3. a variety of results support the assumption that procedural knowledge is goal-specific. </p> <p>knowledge tracing: monitor the student's changing knowledge state during practice and ensure with a high probability that each rule is in the learned state. </p> <p>empirical evaluation of knowledge tracing: 1. general experimental procedure 2. internal validity: predicting tutor performance 3. external validity: predicting test performance 4. individual differences in learning and performance</p>","","","","Education (general); empirical validity; individual differences; intelligent tutoring systems; Learning; Management of Computing and Information Systems; mastery learning; Multimedia Information Systems; procedural knowledge; Psychology, general; student modeling; User Interfaces and Human Computer Interaction","","","","","","","","","","","","","","","","","","","","","","","","","","","","","","","","","","","","","","","","","","","","","",""
"8QN9H436","conferencePaper","2012","Siemens, George; Baker, Ryan S. J. d.","Learning Analytics and Educational Data Mining: Towards Communication and Collaboration","Proceedings of the 2Nd International Conference on Learning Analytics and Knowledge","978-1-4503-1111-3","","10.1145/2330601.2330661","http://doi.acm.org/10.1145/2330601.2330661","Growing interest in data and analytics in education, teaching, and learning raises the priority for increased, high-quality research into the models, methods, technologies, and impact of analytics. Two research communities -- Educational Data Mining (EDM) and Learning Analytics and Knowledge (LAK) have developed separately to address this need. This paper argues for increased and formal communication and collaboration between these communities in order to share research, methods, and tools for data mining and analysis in the service of developing both LAK and EDM fields.","2012","2019-09-17 21:46:17","2019-09-17 21:46:17","2015-01-16 03:15:55","252–254","","","","","","Learning Analytics and Educational Data Mining","LAK '12","","","","ACM","New York, NY, USA","","","","","","ACM Digital Library","","","<p>Two distinct research communities: Educational Data Mining (EDM) and Learning Analytics and Knowledge (LAK).</p> <p>The first international conference: EDM - 2008; LAK -2010.</p> <p>Similarities between EDM and LAK: 1. he similar definition. 2. both reflect the emergence of data-intensive approaches to education. 3. both have the goal of improve the quality of analysis of data, to support research.</p> <p>Distinctions between EDM and LAK: 1. discovery 2. reduction&amp;holism 3. origins 4. adapation&amp;personalization 5. techniques&amp;methods</p>","","","","Collaboration; educational data mining; learning analytics and knowledge","","","","","","","","","","","","","","","","","","","","","","","","","","","","","","","","","","","","","","","","","","","","","",""
"MNNN3BXW","book","2015","Zheng, Alice","Evaluating Machine Learning Models","","","","","http://www.oreilly.com/data/free/evaluating-machine-learning-models.csp?intcmp=il-data-free-lp-lgen_free_reports_page","Data science today is a lot like the Wild West: there’s endless opportunity and excitement, but also a lot of chaos and confusion. If you’re new to data science and applied machine learning, evaluating a machine-learning model can seem pretty overwhelming...","2015-09","2019-09-17 21:46:17","2019-09-17 21:46:17","2015-12-15 18:26:39","","","","","","","","","","","","O'Reily Media","Sebastopol, CA","","","","","","","","","<p>classification is about predicting class labels given input data.</p> <p>accuracy = # correct predictions / # total data points<br />a variation of accuracy is the average per-class accuracy- the average of the accuracy for each class. </p> <p>AUC stands for area under the curve. AUC is one way to summarized the ROC curve into a single number. ROC curve shows the sensitivity of the classifier by plotting the rate of true positives to the rate of false positives.</p> <p>Precision-recall: two metrics, but used together.They answer the different questions. precision: #happy correct answers/#total items returned by ranker. recall: #happy correct answers/#total relevant items.<br />F1 = 2(precision*recall/(precision+recall))</p> <p>NDCG: normalized discounted cumulative gain. cumulative gain(CG); discounted cumulative gain(DCG).<br />regression metrics: learn to predict numeric scores. most commonly used metric is RMSE(root-mean-square-error).Since RMSE is an average, its sentitive to large ourliers. Quantiles are much more robust. MAPE(median absolute percentage).</p> <p>The difference between training metrics and evaluation metrics: training model always better to directly optimize for the metric it will be evaluated on.</p> <p>skewed datasets- imbalanced classes, outliers, and rare data: always be on the look out for data skew. Good classifier should have accuracy much high than 99%. Metric that gives equal weight to each instance of a class has a hard time handling imbalanced classes. The resulting model may not know how to predict the rare classes if class imbalance is not properly dealt with. Another problem is outliers. large outliers can be mitigated during evaluation but not for the training phase. The solution for it is doing careful data cleaning and reformulating the task.</p>","","http://www.oreilly.com/data/free/evaluating-machine-learning-models.csp?intcmp=il-data-free-lp-lgen_free_reports_page","","","","","","","","","","","","","","","","","","","","","","","","","","","","","","","","","","","","","","","","","","","","","","","",""
"Z4B5RWP9","blogPost","2015","Leong, B; Polonetsky, J","Why Opting Out of Student Data Collection Isn’t the Solution","EdSurge","","","","https://www.edsurge.com/news/2015-03-16-why-opting-out-of-student-data-collection-isn-t-the-solution","In every privacy debate across every industry, the same questions arise about the rights of individuals to “opt-out” of their data being collected or used. So it should come as no surprise that the “when” and “how” of parent and student opt-outs of education data collection or use has become a robust","2015-03-16","2019-09-17 21:46:17","2019-09-17 21:46:17","2016-01-16 16:31:25","","","","","","","","","","","","","","","","","","","","","","","","https://www.edsurge.com/news/2015-03-16-why-opting-out-of-student-data-collection-isn-t-the-solution","","","","","","","","","","","","","","","","","","","","","","","","","","","","","","","","","","","","","","","","","","","","","","","",""
"3KK32DIR","videoRecording","2015","Educause","Why Is Measuring Learning So Difficult?","","","","","https://www.youtube.com/watch?v=_iv8A1pHNYA","Several higher education learning and assessment professionals discuss the difficulties of measuring learning.","2015-08-17","2019-09-17 21:46:17","2019-09-17 21:46:17","2016-01-17 18:50:57","","","","","","","","","","","","","","","","","","","YouTube","","","","","","","Learning; Assessment; Education; educational assessment; EDUCAUSE; Higher Education; learners; Teaching and learning","","","","","","","","","","","","","","","","","","","","","470 seconds","","","","","","","","","","","","","","","","","","","","","","","","",""
"SZG9UNAW","webpage","2016","Weinersmith, Zach","Saturday Morning Breakfast Cereal","","","","","http://www.smbc-comics.com/index.php?id=3978","","2016-01-05","2019-09-17 21:46:17","2019-09-17 21:46:17","2016-01-18 18:17:09","","","","","","","","","","","","","","","","","","","","","","<p>90% of elite engineers were interested to reassemble clocks as children, but it does not mean all children who start reassemble clocks will be elite engineers. In the education, interests are the most important. If children like doing something, they will accept those knowledge faster. Otherwise, even though school has the course to force children to learn, they still refused to learn and have a hard time to get the achievement in the field.</p> <p>Thus, interests will promote children to be elite in the specific field. “we clocked so much clock that we're off the clock"". Children like clock, when forcing them to do, they will refuse to work and even stop doing relative thing at the end.</p>","","http://www.smbc-comics.com/index.php?id=3978","","","","","","","","","","","","","","","","","","","","","","","","","","","","","","","","","","","","","","","","","","","","","","","",""
"WZNB2THR","conferencePaper","2014","Clow, Doug","Data wranglers: human interpreters to help close the feedback loop","Proceedings of the Fourth International Conference on Learning Analytics And Knowledge","","","","","","2014","2019-09-17 21:46:18","2019-09-17 21:46:18","","49–53","","","","","","","","","","","ACM","","","","","","","","","","<p>Data Wranglers: group of academics who analyse data about student learning and prepare reports with actionable recommendations based on that data. The role is not only to anaylse the data, but  to increase the familiarity of academics with the data sources, to building learning analytics capacity.</p> <p>Role: 1. act as human sense-makers 2. facilitating action on feedback from learners 3. making better sense of what that feedback means and how the data can be improved 4. helping to develop the Community of Practice around the use of learning analytics.</p> <p>Results: Tools using like SAS data warehouse to aggregated data sources and Tableau to export. Data wranglers use workbooks as their primary data to generate some charts and visualisations. Also use the data directly to produce their own charts in Excel.</p> <p>Macfadyen &amp; Dawson's analysis of LMS - technical discussions    <br />Data Wrangler - analytic processes</p> <p> </p>","","","","","","","","","","","","","","","","","","","","","","","","","","","","","","","","","","","","","","","","","","","","","","","","","",""
"IM96H89Z","magazineArticle","2015","Kucirkova, Natalia; FitzGerald, Elizabeth","Zuckerberg is ploughing billions into 'personalised learning' – why?","The Conversation","","","","http://theconversation.com/zuckerberg-is-ploughing-billions-into-personalised-learning-why-51940","Zuckerburg wants to plough billions into personalised learning, but his way may not be the right way.","2015-12-09","2019-09-17 21:46:18","2019-09-17 21:46:18","2016-01-18 19:14:05","","","","","","","","","","","","","","","","","","","","","","<p>There is no clear definition for personalised learning now but I agree with the definition from Zuckerberg,""working with students to customise instruction to meet the student's individual needs and interests"". In my opinions, since every student has different level, they need special material for them, like some students are good at math rather than verbal, they might need high level of math material and middle level of verbal.</p> <p>Dangers of personalised learning: 1. we will get many specialists and few generalists. 2. learners will lost their ability of compensations. 3. students, teachers and parents will lose social contact between each other. 4. data is easy to lose and misused. </p> <p>nobody can guarantee personalised learning will be success. And even though you are rich enough, doing personalised learning is still hard, since it not only related with the technology problem, but also related the conversation and collaboration, how to balance the technology and teachers.</p>","","https://theconversation.com/zuckerberg-is-ploughing-billions-into-personalised-learning-why-51940","","","","","","","","","","","","","","","","","","","","","","","","","","","","","","","","","","","","","","","","","","","","","","","",""
"6AWUV8E9","videoRecording","2015","Georgia Tech","Feature Selection","","","","","https://www.youtube.com/watch?v=8CpRLplmdqE","","2015-02-23","2019-09-17 21:46:18","2019-09-17 21:46:18","2016-01-18 19:18:06","","","","","","","","","","","","Youtube","","","","","","","","","","<p>Feature Selection<br />1. knowledge discovery interpretabicity &amp; insight (humanbeing)<br />    useful when thinking about a set of data in a problem, to be able to interpret the features. <br />2. curse of dimensionality(machine learning): the amount of data that you need grows exponentially in the number of features that you have.</p> <p>selection: from whole bunch of features to a few features. use algorithm to get just important features. help to understand data better and have easier learning problem.</p>","","https://www.youtube.com/watch?v=8CpRLplmdqE","","","","","","","","","","","","","","","","","","","","","","","3:13","","","","","","","","","","","","","","","","","","","","","","","","",""
"PTUQK2QM","bookSection","2016","Hanneman, R.A.; Riddle, M.","Chapter 1: Social Network Data","Introduction to Social Network Methods","","","","http://faculty.ucr.edu/~hanneman/nettext/C1_Social_Network_Data.html","","2016-01-18","2019-09-17 21:46:18","2019-09-17 21:46:18","2016-01-18 20:17:24","","","","","","","","","","","","","","","","","","","","","","<p>difference between conventional and network data: conventional data focuses on actors and attributes; network data focus on actors and relations</p> <p>network analysis: 1. seeing how actors are located in the overall network<br />2. seeing how the whole pattern of individual choices gives rise to more holistic patterns</p> <p>boundaries of the populations: 1. boundaries are created by the actors themselves. 2. more demographic or ecological approach</p> <p>strategies for deciding how to collecting  measurements on the realations among them: 1. full network methods: yields the maximum of informaiton 2. snowball methods: giving some thought to how to select the initial nodes. weakness: 1. actors who are not connected are not located 2. no guaranteed way of finding all of the connected individuals.</p> <p>ego-centric networks with alter connections: the network as a whole<br />ego-centric networks ego only: focus on the individual</p> <p>multiple relations: 1.scales of measurement 2. binary measures of relations 3. multiple-category nominal measures of relations 4. grouped ordinal measures of relations 5. full-rank ordinal measures of relations 6. interval measures of relations</p> <p>mathematical approach: treat the data as ""deterministic""<br />statistical analysts: regard the scores on relationship as probabilistic realizations</p>","","http://faculty.ucr.edu/~hanneman/nettext/C1_Social_Network_Data.html","","","","","","","","","","","","","","","","","","","","","","","","","","","","","","","","","","","","","","","","","","","","","","","",""
"G4ET6NDH","webpage","2014","Groelmund, Garrett","RStudio Cheat Sheets","RStudio","","","","https://www.rstudio.com/resources/cheatsheets/","","2014-08-01","2019-09-17 21:46:18","2019-09-17 21:46:18","2016-01-19 21:17:28","","","","","","","","","","","","","","","","","","","","","","<p>Data Wrangling<br />1.%&gt;% passed object on left hand side as first argument of function on righthand side.<br />2. gather(cases, ""year"", ""n"", 2:4): gather columns into rows.<br />3. spread(pollution, size, amount): spread rows into columns.<br />4. separate(storms, date, c(""y"", ""m"", ""d"")): separate one column into several<br />5. unite(data, col, ..., sep): unite several columns into one.<br />6. data_frame(a = 1:3, b = 4:6)<br />7. arrange(mtcars, mpg): order rows by values of a column(low to high)<br />8. arrange(mtcars, desc(mpg)): order rows by values of a column (high to low)<br />9. rename(tb, y = year): rename the columns of a data frame.<br />10. filter(iris, Sepal.Length &gt;7): extract rows that meet logical criteria<br />11. distinct(iris): remove duplicate rows.<br />12. slice(iris, 10:15): select rows by position<br />13. select(iris, Sepal.Width, Petal.Length, Species): select columns by name or helper function(contains(), ends_with(), everything(),matches(), starts_with()).<br />14. summarise(iris, avg = mean(Sepal. Length)): summarise data into single row of values<br />15. summarise_each(iris, funs(mean)): apply summary function to each column.<br />16. group_by(iris, Species): group data into rows with the same value of Species.<br />17. mutate(iris, sepal = Sepal.Length + Sepal. Width): compute and append one or more new columns<br />18. left_join(a,b,by = ""x1"")//right_join, inner_join, full_join, semi_join, anti_join.<br />19. intersect(y,z): rows that appear in both y and z<br />20. union(y,z): rows that appear in either or both y and z<br />21. setdiff(y,z): rows that appear in y but not z<br />22. bind_rows(y,z)///bind_cols(y,z)</p> <p> </p> <p> </p>","","http://shiny.rstudio.com/articles/rm-cheatsheet.html","","","","","","","","","","","","","","","","","","","","","","","","","","","","","","","","","","","","","","","","","","","","","","","",""
"4R7WXK79","conferencePaper","2013","san Pedro, Maria Ofelia; Baker, Ryan; Bowers, Alex; Heffernan, Neil","Predicting college enrollment from student interaction with an intelligent tutoring system in middle school","Educational Data Mining 2013","","","","","","2013","2019-09-17 21:46:18","2019-09-17 21:46:18","","","","","","","","","","","","","","","","","","","","","","","","","","","","","","","","","","","","","","","","","","","","","","","","","","","","","","","","","","","","","","","","","","","","","","","","",""
"9AX5APR9","journalArticle","2012","Greller, Wolfgang; Drachsler, Hendrik","Translating Learning into Numbers: A Generic Framework for Learning Analytics","Journal of Educational Technology & Society","","1176-3647","","http://www.jstor.org/stable/jeductechsoci.15.3.42","ABSTRACT With the increase in available educational data, it is expected that Learning Analytics will become a powerful means to inform and support learners, teachers and their institutions in better understanding and predicting personal learning needs and performance. However, the processes and requirements behind the beneficial application of Learning and Knowledge Analytics as well as the consequences for learning and teaching are still far from being understood. In this paper, we explore the key dimensions of Learning Analytics (LA), the critical problem zones, and some potential dangers to the beneficial exploitation of educational data. We propose and discuss a generic design framework that can act as a useful guide for setting up Learning Analytics services in support of educational practice and learner guidance, in quality assurance, curriculum development, and in improving teacher effectiveness and efficiency. Furthermore, the presented article intends to inform about soft barriers and limitations of Learning Analytics. We identify the required skills and competences that make meaningful use of Learning Analytics data possible to overcome gaps in interpretation literacy among educational stakeholders. We also discuss privacy and ethical issues and suggest ways in which these issues can be addressed through policy guidelines and best practice examples.","2012","2019-09-17 21:46:19","2019-09-17 21:46:19","2016-09-03 18:55:41","42-57","","3","15","","Journal of Educational Technology & Society","Translating Learning into Numbers","","","","","","","","","","","","JSTOR","","","<p>critical dimensions:<br />1. hard issues: challenges of the fact-based world of data and algorithms. example: compatibility of educational datasets, the comparability and adequacy of algorithmic and technological approaches.<br />2. soft issues: challenges that depend on assumptions being made about humans or the society in general. example: questions of data ownership and oppenness, ethical use and dangers of abuse, ad the demand for new key competences to interpret and act.</p> <p>design framework: framework intends to be a guide as much as a descriptor of the problem zones.</p> <p>dimension of LA framework: <br />(1)stakeholders: data clients: terachers; data subjects (learners)<br />(2)objectives: reflection:self-evaluation; prediction: predicting and modelling learner activities.<br />(3)data:protected dataset; relevant indicators; time scale<br />(4instruments: pedagogic theory; technology; presentation<br />(5)external constraints: conventions: privacy, ethics; time scale; norms<br />(6)internal limitations: competences and acceptance</p> <p>six dimensions are mandatory to be present in LA design. The interests of the learners is important for the development of LA. Development should not happen without a guiding framework(use of educational data and protection of individuals)</p> <p>question in LA: the relation with theories of learning, teaching, cognition and knowledge.</p>","","","","","","","","","","","","","","","","","","","","","","","","","","","","","","","","","","","","","","","","","","","","","","","","","",""
"VZFN3RCI","bookSection","2006","Kay, Judy; Maisonneuve, Nicolas; Yacef, Kalina; Reimann, Peter","The Big Five and Visualisations of Team Work Activity","Intelligent Tutoring Systems","978-3-540-35159-7 978-3-540-35160-3","","","http://link.springer.com/chapter/10.1007/11774303_20","We have created a set of novel visualisations of group activity: they mirror activity of individuals and their interactions, based upon readily available authentic data. We evaluated these visualisations in the context of a semester long software development project course. We give a theoretical analysis of the design of our visualizations using the framework from the “Big 5” theory of team work as well as a qualitative study of the visualisations and the students’ reflective reports. We conclude that these visualisations provide a powerful and valuable mirroring role with potential, when well used, to help groups learn to improve their effectiveness.","2006-06-26","2019-09-17 21:46:19","2019-09-17 21:46:19","2016-09-03 19:10:12","197-206","","","","","","","Lecture Notes in Computer Science","4053","","","Springer Berlin Heidelberg","","en","©2006 Springer-Verlag Berlin Heidelberg","","","","link.springer.com","","DOI: 10.1007/11774303_20","","","https://link.springer.com/chapter/10.1007/11774303_20","","Multimedia Information Systems; User Interfaces and Human Computer Interaction; Artificial Intelligence (incl. Robotics); Computers and Education; Information Systems Applications (incl. Internet)","Ikeda, Mitsuru; Ashley, Kevin D.; Chan, Tak-Wai","","","","","","","","","","","","","","","","","","","","","","","","","","","","","","","","","","","","","","","","","","","","",""
