"Key","Item Type","Publication Year","Author","Title","Publication Title","ISBN","ISSN","DOI","Url","Abstract Note","Date","Date Added","Date Modified","Access Date","Pages","Num Pages","Issue","Volume","Number Of Volumes","Journal Abbreviation","Short Title","Series","Series Number","Series Text","Series Title","Publisher","Place","Language","Rights","Type","Archive","Archive Location","Library Catalog","Call Number","Extra","Notes","File Attachments","Link Attachments","Manual Tags","Automatic Tags","Editor","Series Editor","Translator","Contributor","Attorney Agent","Book Author","Cast Member","Commenter","Composer","Cosponsor","Counsel","Interviewer","Producer","Recipient","Reviewed Author","Scriptwriter","Words By","Guest","Number","Edition","Running Time","Scale","Medium","Artwork Size","Filing Date","Application Number","Assignee","Issuing Authority","Country","Meeting Name","Conference Name","Court","References","Reporter","Legal Status","Priority Numbers","Programming Language","Version","System","Code","Code Number","Section","Session","Committee","History","Legislative Body"
"HCDIXIWN","journalArticle","2010","Bowers, Alex J.","Analyzing the Longitudinal K-12 Grading Histories of Entire Cohorts of Students: Grades, Data Driven Decision Making, Dropping out and Hierarchical Cluster Analysis","Practical Assessment, Research & Evaluation","","1531-7714","","","School personnel currently lack an effective method to pattern and visually interpret disaggregated achievement data collected on students as a means to help inform decision making. This study, through the examination of longitudinal K-12 teacher assigned grading histories for entire cohorts of students from a school district (n=188), demonstrates a novel application of hierarchical cluster analysis and pattern visualization in which all data points collected on every student in a cohort can be patterned, visualized and interpreted to aid in data driven decision making by teachers and administrators. Additionally, as a proof-of-concept study, overall schooling outcomes, such as student dropout or taking a college entrance exam, are identified from the data patterns and compared to past methods of dropout identification as one example of the usefulness of the method. Hierarchical cluster analysis correctly identified over 80% of the students who dropped out using the entire student grade history patterns from either K-12 or K-8. (Contains 5 figures.)","2010-05","2019-12-21 22:38:05","2019-12-21 22:38:05","2014-09-24 19:31:29","","","7","15","","","Analyzing the Longitudinal K-12 Grading Histories of Entire Cohorts of Students","","","","","","","en","","","","","ERIC","","","<p>Data itself is crucial, so is Data visualization. Sometimes, we don’t think the importance of data in education. Students are the future of the world, and education is the only tool leading them to become an elite. I think it is also useful to include average when comparing with other schools, and also the its own average when comparing with previous records.</p>","","http://eric.ed.gov/?id=EJ933686","","data; data analysis; Decision Making; Dropouts; Elementary School Students; Grades (Scholastic); Identification; MULTIVARIATE analysis; School Districts; Secondary School Students","","","","","","","","","","","","","","","","","","","","","","","","","","","","","","","","","","","","","","","","","","","","","",""
"6X887T6S","journalArticle","2014","Grunspan, Daniel Z.; Wiggins, Benjamin L.; Goodreau, Steven M.","Understanding Classrooms through Social Network Analysis: A Primer for Social Network Analysis in Education Research","CBE-Life Sciences Education","",", 1931-7913","10.1187/cbe.13-08-0162","http://www.lifescied.org/content/13/2/167","Social interactions between students are a major and underexplored part of undergraduate education. Understanding how learning relationships form in undergraduate classrooms, as well as the impacts these relationships have on learning outcomes, can inform educators in unique ways and improve educational reform. Social network analysis (SNA) provides the necessary tool kit for investigating questions involving relational data. We introduce basic concepts in SNA, along with methods for data collection, data processing, and data analysis, using a previously collected example study on an undergraduate biology classroom as a tutorial. We conduct descriptive analyses of the structure of the network of costudying relationships. We explore generative processes that create observed study networks between students and also test for an association between network position and success on exams. We also cover practical issues, such as the unique aspects of human subjects review for network studies. Our aims are to convince readers that using SNA in classroom environments allows rich and informative analyses to take place and to provide some initial tools for doing so, in the process inspiring future educational studies incorporating relational data.","2014-06-20","2019-12-21 22:38:05","2019-12-21 22:38:05","2014-08-20 20:21:46","167-178","","2","13","","CBE Life Sci Educ","Understanding Classrooms through Social Network Analysis","","","","","","","en","","","","","www.lifescied.org","","","<p>good article</p>","","http://www.lifescied.org/content/13/2/167","Week 2","","","","","","","","","","","","","","","","","","","","","","","","","","","","","","","","","","","","","","","","","","","","","","",""
"LTM98WQY","blogPost","2014","Young, Jeffrey R.","Why Students Should Own Their Educational Data","The Chronicle of Higher Education Blogs: Wired Campus","","","","http://chronicle.com/blogs/wiredcampus/why-students-should-own-their-educational-data/54329","","2014-08-21","2019-12-21 22:38:06","2019-12-21 22:38:06","2014-08-23 21:32:22","","","","","","","","","","","","","","","","","","","","","","<p>Cause they can analyze how they learning a new course.</p>","","http://chronicle.com/blogs/wiredcampus/why-students-should-own-their-educational-data/54329","","","","","","","","","","","","","","","","","","","","","","","","","","","","","","","","","","","","","","","","","","","","","","","",""
"992W3LEC","journalArticle","1994","Corbett, Albert T.; Anderson, John R.","Knowledge tracing: Modeling the acquisition of procedural knowledge","User Modeling and User-Adapted Interaction","","0924-1868, 1573-1391","10.1007/BF01099821","http://link.springer.com.ezp-prod1.hul.harvard.edu/article/10.1007/BF01099821","This paper describes an effort to model students' changing knowledge state during skill acquisition. Students in this research are learning to write short programs with the ACT Programming Tutor (APT). APT is constructed around a production rule cognitive model of programming knowledge, called theideal student model. This model allows the tutor to solve exercises along with the student and provide assistance as necessary. As the student works, the tutor also maintains an estimate of the probability that the student has learned each of the rules in the ideal model, in a process calledknowledge tracing. The tutor presents an individualized sequence of exercises to the student based on these probability estimates until the student has ‘mastered’ each rule. The programming tutor, cognitive model and learning and performance assumptions are described. A series of studies is reviewed that examine the empirical validity of knowledge tracing and has led to modifications in the process. Currently the model is quite successful in predicting test performance. Further modifications in the modeling process are discussed that may improve performance levels.","1994-12-01","2019-12-21 22:38:06","2019-12-21 22:38:06","2013-04-21 21:21:19","253-278","","4","4","","User Model User-Adap Inter","Knowledge tracing","","","","","","","en","","","","","link.springer.com.ezp-prod1.hul.harvard.edu","","","","","","","Education (general); empirical validity; individual differences; intelligent tutoring systems; Learning; Management of Computing and Information Systems; mastery learning; Multimedia Information Systems; procedural knowledge; Psychology, general; student modeling; User Interfaces and Human Computer Interaction","","","","","","","","","","","","","","","","","","","","","","","","","","","","","","","","","","","","","","","","","","","","","",""
"W5BYQ29X","conferencePaper","2012","Siemens, George; Baker, Ryan S. J. d.","Learning Analytics and Educational Data Mining: Towards Communication and Collaboration","Proceedings of the 2Nd International Conference on Learning Analytics and Knowledge","978-1-4503-1111-3","","10.1145/2330601.2330661","http://doi.acm.org/10.1145/2330601.2330661","Growing interest in data and analytics in education, teaching, and learning raises the priority for increased, high-quality research into the models, methods, technologies, and impact of analytics. Two research communities -- Educational Data Mining (EDM) and Learning Analytics and Knowledge (LAK) have developed separately to address this need. This paper argues for increased and formal communication and collaboration between these communities in order to share research, methods, and tools for data mining and analysis in the service of developing both LAK and EDM fields.","2012","2019-12-21 22:38:06","2019-12-21 22:38:06","2015-01-16 03:15:55","252–254","","","","","","Learning Analytics and Educational Data Mining","LAK '12","","","","ACM","New York, NY, USA","","","","","","ACM Digital Library","","","<p>As I mentioned before, we never think the importance of data in educational fields. I think it is great that two organizations are aiming the best for quality and equality in education. And I think it is the best to bring awareness to let the world know that education matters through data, and also to encourage more scholars to devote themselves in creating a better environment in education.</p>","","","","Collaboration; educational data mining; learning analytics and knowledge","","","","","","","","","","","","","","","","","","","","","","","","","","","","","","","","","","","","","","","","","","","","","",""
"I3TQH3EJ","book","2015","Zheng, Alice","Evaluating Machine Learning Models","","","","","http://www.oreilly.com/data/free/evaluating-machine-learning-models.csp?intcmp=il-data-free-lp-lgen_free_reports_page","Data science today is a lot like the Wild West: there’s endless opportunity and excitement, but also a lot of chaos and confusion. If you’re new to data science and applied machine learning, evaluating a machine-learning model can seem pretty overwhelming...","2015-09","2019-12-21 22:38:07","2019-12-21 22:38:07","2015-12-15 18:26:39","","","","","","","","","","","","O'Reily Media","Sebastopol, CA","","","","","","","","","<p>How I think about a data scientist is somewhat differ than the author. I believe data scientists are experts in coding and machine learning, but what’s more important in a data scientist is that the ability to corporate the data itself, with visualizing, and tightly combined with industry. The overall goal for data scientists is to deliver a relevant message with data for the certain industry with languages that could be understand by people with no prior coding knowledge.</p>","","http://www.oreilly.com/data/free/evaluating-machine-learning-models.csp?intcmp=il-data-free-lp-lgen_free_reports_page","","","","","","","","","","","","","","","","","","","","","","","","","","","","","","","","","","","","","","","","","","","","","","","",""
"9428F9YD","videoRecording","2015","Educause","Why Is Measuring Learning So Difficult?","","","","","https://www.youtube.com/watch?v=_iv8A1pHNYA","Several higher education learning and assessment professionals discuss the difficulties of measuring learning.","2015-08-17","2019-12-21 22:38:07","2019-12-21 22:38:07","2016-01-17 18:50:57","","","","","","","","","","","","","","","","","","","YouTube","","","<p>Interesting video</p>","","","","Learning; Assessment; Education; educational assessment; EDUCAUSE; Higher Education; learners; Teaching and learning","","","","","","","","","","","","","","","","","","","","","470 seconds","","","","","","","","","","","","","","","","","","","","","","","","",""
"5BKSUHZT","webpage","2016","Weinersmith, Zach","Saturday Morning Breakfast Cereal","","","","","http://www.smbc-comics.com/index.php?id=3978","","2016-01-05","2019-12-21 22:38:07","2019-12-21 22:38:07","2016-01-18 18:17:09","","","","","","","","","","","","","","","","","","","","","","<p>From the comics, it is sad that we are trying to turn the children into something that they are not. People who work in educational fields should really take children’s interest into account.</p>","","http://www.smbc-comics.com/index.php?id=3978","","","","","","","","","","","","","","","","","","","","","","","","","","","","","","","","","","","","","","","","","","","","","","","",""
"5H37LTFH","webpage","2015","RStudio","The Data Wrangling Cheatsheet","","","","","http://www.rstudio.com/wp-content/uploads/2015/02/data-wrangling-cheatsheet.pdf","","2015-01","2019-12-21 22:38:07","2019-12-21 22:38:07","2016-01-18 18:42:27","","","","","","","","","","","","","","","","","","","","","","<p>What I like the most of R is that it has lots of useful packages and cheat sheets we can find online. The dplyr package is especially useful when we try to select the data partly. Because in real life, not every data we gathered are relevant to conduct our research.</p>","","http://www.rstudio.com/wp-content/uploads/2015/02/data-wrangling-cheatsheet.pdf","","","","","","","","","","","","","","","","","","","","","","","","","","","","","","","","","","","","","","","","","","","","","","","",""
"74RTAAGR","conferencePaper","2014","Clow, Doug","Data wranglers: human interpreters to help close the feedback loop","Proceedings of the Fourth International Conference on Learning Analytics And Knowledge","","","","","","2014","2019-12-21 22:38:08","2019-12-21 22:38:08","","49–53","","","","","","","","","","","ACM","","","","","","","","","","","","","","","","","","","","","","","","","","","","","","","","","","","","","","","","","","","","","","","","","","","","","","","","","","","",""
"2AJCVZ8B","magazineArticle","2015","Kucirkova, Natalia; FitzGerald, Elizabeth","Zuckerberg is ploughing billions into 'personalised learning' – why?","The Conversation","","","","http://theconversation.com/zuckerberg-is-ploughing-billions-into-personalised-learning-why-51940","Zuckerburg wants to plough billions into personalised learning, but his way may not be the right way.","2015-12-09","2019-12-21 22:38:08","2019-12-21 22:38:08","2016-01-18 19:14:05","","","","","","","","","","","","","","","","","","","","","","<p>I agree with personal learning is an important way to success.</p>","","https://theconversation.com/zuckerberg-is-ploughing-billions-into-personalised-learning-why-51940","","","","","","","","","","","","","","","","","","","","","","","","","","","","","","","","","","","","","","","","","","","","","","","",""
"RY3I8L49","videoRecording","2015","Georgia Tech","Feature Selection","","","","","https://www.youtube.com/watch?v=8CpRLplmdqE","","2015-02-23","2019-12-21 22:38:08","2019-12-21 22:38:08","2016-01-18 19:18:06","","","","","","","","","","","","Youtube","","","","","","","","","","<p>From the video, it is clear that catching the key words will be useful for any business, and we can achieve that by word cloud or other machine learning. Not only in data world, we also key words and main idea are the most useful content in daily life.</p>","","https://www.youtube.com/watch?v=8CpRLplmdqE","","","","","","","","","","","","","","","","","","","","","","","3:13","","","","","","","","","","","","","","","","","","","","","","","","",""
"XP7WHRXQ","webpage","2014","Groelmund, Garrett","RStudio Cheat Sheets","RStudio","","","","https://www.rstudio.com/resources/cheatsheets/","","2014-08-01","2019-12-21 22:38:08","2019-12-21 22:38:08","2016-01-19 21:17:28","","","","","","","","","","","","","","","","","","","","","","<p>I always think of R as the most important and useful coding language. Not only because of the abundance packages in r to provide us with beautiful graphs, but also, we are able to code python in r. And also, we can find so many useful information online for FREE.</p>","","http://shiny.rstudio.com/articles/rm-cheatsheet.html","","","","","","","","","","","","","","","","","","","","","","","","","","","","","","","","","","","","","","","","","","","","","","","",""
"INZA74GS","journalArticle","2012","Greller, Wolfgang; Drachsler, Hendrik","Translating Learning into Numbers: A Generic Framework for Learning Analytics","Journal of Educational Technology & Society","","1176-3647","","http://www.jstor.org/stable/jeductechsoci.15.3.42","ABSTRACT With the increase in available educational data, it is expected that Learning Analytics will become a powerful means to inform and support learners, teachers and their institutions in better understanding and predicting personal learning needs and performance. However, the processes and requirements behind the beneficial application of Learning and Knowledge Analytics as well as the consequences for learning and teaching are still far from being understood. In this paper, we explore the key dimensions of Learning Analytics (LA), the critical problem zones, and some potential dangers to the beneficial exploitation of educational data. We propose and discuss a generic design framework that can act as a useful guide for setting up Learning Analytics services in support of educational practice and learner guidance, in quality assurance, curriculum development, and in improving teacher effectiveness and efficiency. Furthermore, the presented article intends to inform about soft barriers and limitations of Learning Analytics. We identify the required skills and competences that make meaningful use of Learning Analytics data possible to overcome gaps in interpretation literacy among educational stakeholders. We also discuss privacy and ethical issues and suggest ways in which these issues can be addressed through policy guidelines and best practice examples.","2012","2019-12-21 22:38:09","2019-12-21 22:38:09","2016-09-03 18:55:41","42-57","","3","15","","Journal of Educational Technology & Society","Translating Learning into Numbers","","","","","","","","","","","","JSTOR","","","<p>agree</p>","","","","","","","","","","","","","","","","","","","","","","","","","","","","","","","","","","","","","","","","","","","","","","","","","",""
"EDRPMZIE","journalArticle","2015","Konstan, Joseph A.; Walker, J. D.; Brooks, D. Christopher; Brown, Keith; Ekstrand, Michael D.","Teaching Recommender Systems at Large Scale: Evaluation and Lessons Learned from a Hybrid MOOC","ACM Trans. Comput.-Hum. Interact.","","1073-0516","10.1145/2728171","http://doi.acm.org/10.1145/2728171","","2015-04","2019-12-21 22:38:09","2019-12-21 22:38:09","2016-09-03 20:38:02","10:1–10:23","","2","22","","","Teaching Recommender Systems at Large Scale","","","","","","","","","","","","ACM Digital Library","","","<p>I think it is great that people are making effort to achieve a successful online platform. I believe the platform will benefit lots of students world-wide. The only thing is that we should keep track of the data, and potential keep track the students after they done online platform.</p>","","","","learning assessment; Massively Online Open Course (MOOC)","","","","","","","","","","","","","","","","","","","","","","","","","","","","","","","","","","","","","","","","","","","","","",""
"3WGDZW6E","book","2015","Matsuda, Noboru; Furukawa, Tadanobu; Bier, Norman; Faloutsos, Christos","Machine Beats Experts: Automatic Discovery of Skill Models for Data-Driven Online Course Refinement","","","","","http://eric.ed.gov/?id=ED560513","How can we automatically determine which skills must be mastered for the successful completion of an online course? Large-scale online courses (e.g., MOOCs) often contain a broad range of contents frequently intended to be a semester's worth of materials; this breadth often makes it difficult to articulate an accurate set of skills and knowledge (i.e., a skill model, or the QMatrix). We have developed an innovative method to discover skill models from the data of online courses. Our method assumes that online courses have a pre-defined skill map for which skills are associated with formative assessment items embedded throughout the online course. Our method carefully exploits correlations between various parts of student performance, as well as in the text of assessment items, to build a superior statistical model that even outperforms human experts. To evaluate our method, we compare our method with existing methods (LFA) and human engineered skill models on three Open Learning Initiative (OLI) courses at Carnegie Mellon University. The results show that (1) our method outperforms human-engineered skill models, (2) skill models discovered by our method are interpretable, and (3) our method is remarkably faster than existing methods. These results suggest that our method provides a significant contribution to the evidence-based, iterative refinement of online courses with a promising scalability. [For complete proceedings, see ED560503.]","2015-06","2019-12-21 22:38:09","2019-12-21 22:38:09","2016-09-03 20:48:57","","","","","","","Machine Beats Experts","","","","","International Educational Data Mining Society","","en","","","","","ERIC","","","<p>I admire the outcome of the study, but we still need to think about other ways to make online course more effective. My suggestion is that to find out when people exist the online platform, and potential reasons behind it. Just as business owners care about bounce rate and etc.</p>","","http://eric.ed.gov/?id=ED560513","","data; Automation; Comparative Analysis; Correlation; Formative Evaluation; models; Online Courses; Skills","","","","","","","","","","","","","","","","","","","","","","","","","","","","","","","","","","","","","","","","","","","","","",""
"IT45CZ5Y","bookSection","2016","Hanneman, R.A.; Riddle, M.","Chapter 1: Social Network Data","Introduction to Social Network Methods","","","","http://faculty.ucr.edu/~hanneman/nettext/C1_Social_Network_Data.html","","2016-01-18","2019-12-21 22:38:09","2019-12-21 22:38:09","2016-01-18 20:17:24","","","","","","","","","","","","","","","","","","","","","","<p>Nowadays, we are immersed in the world of internet with numerous social media platform. I don’t think the different social platforms hinders data analysis, but the core thing we need to do is to match the same user on different platforms to create a complete user profile.</p>","","http://faculty.ucr.edu/~hanneman/nettext/C1_Social_Network_Data.html","","","","","","","","","","","","","","","","","","","","","","","","","","","","","","","","","","","","","","","","","","","","","","","",""
"7PTBUW4P","bookSection","2017","Klerkx, Joris; Verbert, Katrien; Duval, Erik","Learning Analytics Dashboards","The Handbook of Learning Analytics","978-0-9952408-0-3","","","www.solaresearch.org","","2017","2019-12-21 22:38:09","2019-12-21 22:38:09","","","","","","","","","","","","","","Vancouver, BC, Canada","EN","","","","","","","","<p>Reading the article really makes me happy that the progress we achieved in the past ten years in educational learning. And I am proud of myself in the field that is able to make the world in a better place especially for education. Looking forward to the conference!</p>","","","","","","","","","","","","","","","","","","","","","","","","1","","","","","","","","","","","","","","","","","","","","","","","","","",""
"ICFDBA2E","bookSection","2017","Bergner, Yoav","Measurement and its Uses in Learning Analytics","The Handbook of Learning Analytics","978-0-9952408-0-3","","","http://solaresearch.org/hla-17/hla17-chapter1","Psychological measurement is a process for making warranted claims about states of mind. As such, it typically comprises the following: de ning a construct; specifying a measurement model and (developing) a reliable instrument; analyzing and accounting for various sources of error (including operator error); and framing a valid argument for particular uses of the outcome. Measurement of latent variables is, after all, a noisy endeavor that can neverthe- less have high-stakes consequences for individuals and groups. This chapter is intended to serve as an introduction to educational and psychological measurement for practitioners in learning analytics and educational data mining. It is organized thematically rather than historically, from more conceptual material about constructs, instruments, and sources of measurement error toward increasing technical detail about particular measurement models and their uses. Some of the philosophical differences between explanatory and predictive modelling are explored toward the end.","2017","2019-12-21 22:38:10","2019-12-21 22:38:10","","34-48","","","","","","","","","","","Society for Learning Analytics Research (SoLAR)","Alberta, Canada","","","","","","","","","<p>From the reading, I totally agree with the author’s point on “claims analysis”. Because at the end of the day, data modeling and data visualizing are meant to tell the audience what we learned from the data in a meaningful way – that is to tell the audience what they really want to get from the data.</p>","","","","","Lang, Charles; Siemens, George; Wise, Alyssa Friend; Gaševic, Dragan","","","","","","","","","","","","","","","","","","","1","","","","","","","","","","","","","","","","","","","","","","","","","",""
