"UHLBSV2U","bookSection","2017","Brooks, Christopher; Thompson, Craig","Predictive Modelling in Teaching and Learning","The Handbook of Learning Analytics","978-0-9952408-0-3","","","http://solaresearch.org/hla-17/hla17-chapter1","This article describes the process, practice, and challenges of using predictive modelling in teaching and learning. In both the  elds of educational data mining (EDM) and learning analytics (LA) predictive modelling has become a core practice of researchers, largely with a focus on predicting student success as operationalized by academic achievement. In this chapter, we provide a general overview of considerations when using predictive modelling, the steps that an educational data scientist must consider when engaging in the process, and a brief overview of the most popular techniques in the  eld.","2017","2019-12-21 22:38:10","2019-12-21 22:38:10","","61-68","","","","","","","","","","","Society for Learning Analytics Research (SoLAR)","Alberta, Canada","","","","","","","","","<p>From the reading, I totally agree with the author’s point on “claims analysis”. Because at the end of the day, data modeling and data visualizing are meant to tell the audience what we learned from the data in a meaningful way – that is to tell the audience what they really want to get from the data.</p>","","","","","Lang, Charles; Siemens, George; Wise, Alyssa Friend; Gaševic, Dragan","","","","","","","","","","","","","","","","","","","1","","","","","","","","","","","","","","","","","","","","","","","","","",""
"6QP3SFS6","bookSection","2017","Prinsloo, P; Slade, S","Ethics and Learning Analytics: Charting the (Un)Charted","The Handbook of Learning Analytics","978-0-9952408-0-3","","","https://solaresearch.org/hla-17/hla17-chapter4/","","2017-03","2019-12-21 22:38:10","2019-12-21 22:38:10","","49-57","","","","","","","","","","","Society for Learning Analytics Research","Vancouver, BC","EN","","","","","","","","<p>From the reading, I agree that we don’t have much privacy in browsing internet world. But from a data analyst perspective, we need users data to create useful content. I always think this as we always have to give up something in order to gain the access to the other. As long as there is regulation to ensure the legit use for those data, I think it is normal to share our privacy.</p>","","","","","","","","","","","","","","","","","","","","","","","","1","","","","","","","","","","","","","","","","","","","","","","","","","",""
"S7GAY7TL","bookSection","2017","Liu, R; Koedinger, K","Going Beyond Better Data Prediction to Create Explanatory Models of Educational Data","The Handbook of Learning Analytics","978-0-9952408-0-3","","","https://solaresearch.org/hla-17/hla17-chapter6/","","2017-03","2019-12-21 22:38:10","2019-12-21 22:38:10","","69-76","","","","","","","","","","","Society for Learning Analytics Research","Vancouver, BC","EN","","","","","","","","<p>I agree that the first step in any model rebuilding process is to make sure what is the outcome that we want to study. But why limit ourselves? In educational research, every detail matter, and I believe it is the best that we explore the data under different concepts and using different methods to fully understand the data for students.</p>","","","","","","","","","","","","","","","","","","","","","","","","1","","","","","","","","","","","","","","","","","","","","","","","","","",""
"DSVYR95U","journalArticle","2011","Gelman, A; Niemi, J","Statistical graphics: making information clear – and beautiful","Significance","","","","","","2011-09","2019-12-21 22:38:10","2019-12-21 22:38:10","","134-136","","","","","","","","","","","","","","","","","","","","","","","","","","","","","","","","","","","","","","","","","","","","","","","","","","","","","","","","","","","","","","","","","","","","","","",""
"HJDG93GK","journalArticle","1984","Wainer, H","How to display data badly","The American Statistician","","","","","","1984","2019-12-21 22:38:10","2019-12-21 22:38:10","","137-147","","2","38","","","","","","","","","","","","","","","","","","","","","","","","","","","","","","","","","","","","","","","","","","","","","","","","","","","","","","","","","","","","","","","","","","","",""
"74LWJVMT","journalArticle","2012","Gelman, A; Unwin, A","Infovis and Statistical Graphics: Different Goals, Different Looks (with discussion)","","","","","","","2012","2019-12-21 22:38:10","2019-12-21 22:38:10","","","","","","","","","","","","","","","","","","","","","","","","","","","","","","","","","","","","","","","","","","","","","","","","","","","","","","","","","","","","","","","","","","","","","","","","",""
"ZDBQ3EIQ","blogPost","2014","Fung, K","Junkcharts Trifecta Checkup: The Definitive Guide","Junkcharts","","","","http://junkcharts.typepad.com/junk_charts/junk-charts-trifecta-checkup-the-definitive-guide.html","","2014","2019-12-21 22:38:10","2019-12-21 22:38:10","","","","","","","","","","","","","","","","","Blog","","","","","","<p>I totally agree with the author’s point. Regardless what we create, the important thing is to make our audience understand our model and research question. To think from an audience perspective, it is easier to achieve the goal this way.</p>","","","","","","","","","","","","","","","","","","","","","","","","","","","","","","","","","","","","","","","","","","","","","","","","","",""