"IKVJ6CQM","book","2015","Zheng, Alice","Evaluating Machine Learning Models","","","","","http://www.oreilly.com/data/free/evaluating-machine-learning-models.csp?intcmp=il-data-free-lp-lgen_free_reports_page","Data science today is a lot like the Wild West: there’s endless opportunity and excitement, but also a lot of chaos and confusion. If you’re new to data science and applied machine learning, evaluating a machine-learning model can seem pretty overwhelming...","2015-09","2019-09-17 21:41:59","2019-09-17 21:41:59","2015-12-15 18:26:39","","","","","","","","","","","","O'Reily Media","Sebastopol, CA","","","","","","","","","<p>Evaluation Metrics</p> <ul> <li>Classification Metrics</li> <li>Accuracy - (correct predictions) / (total data points)</li> </ul> <p>Confusion Matrix</p> <ul> <li>How many examples failed for class 0 versus class 1, because the cost of mis-classification might differ for the two classes.</li> </ul> <p>Unpacking the prototyping phase: Training, validation, model selection</p> <ul> <li>Historical data <ul> <li>Training data ; model training; training evaluation results</li> <li>Validation data; model ; validation evaluation results; hyperprameter tuner</li> </ul> </li> </ul> <p>A/B testing</p> <ul> <li> This machinery is know as statistical hypothesis testing. It decides between a null hypothesis and an alternate hypothesis. <br /> <ul> <li>split into randomized control/ experimentation groups</li> <li>Observe behavior of both groups on the proposed methods</li> <li>compute test statistics</li> <li>compute p-value</li> <li>output decision</li> </ul> </li> </ul>","","http://www.oreilly.com/data/free/evaluating-machine-learning-models.csp?intcmp=il-data-free-lp-lgen_free_reports_page","","","","","","","","","","","","","","","","","","","","","","","","","","","","","","","","","","","","","","","","","","","","","","","",""
"JELTTSUA","blogPost","2015","Leong, B; Polonetsky, J","Why Opting Out of Student Data Collection Isn’t the Solution","EdSurge","","","","https://www.edsurge.com/news/2015-03-16-why-opting-out-of-student-data-collection-isn-t-the-solution","In every privacy debate across every industry, the same questions arise about the rights of individuals to “opt-out” of their data being collected or used. So it should come as no surprise that the “when” and “how” of parent and student opt-outs of education data collection or use has become a robust","2015-03-16","2019-09-17 21:41:59","2019-09-17 21:41:59","2016-01-16 16:31:25","","","","","","","","","","","","","","","","","","","","","","<p>This articles uses data to understand how students progress through time, how school systems serve different populations, and how different education strategies succeed.</p> <p>Although sometimes the meeting argues the accuracy or validity of the data, assessing performance through data analysis is often an essential step to improving education and addressing areas of concern. And the parents' expectations that teachers and administrators have access to the data they need to make informed decisions to manage our education system.</p>","","https://www.edsurge.com/news/2015-03-16-why-opting-out-of-student-data-collection-isn-t-the-solution","","","","","","","","","","","","","","","","","","","","","","","","","","","","","","","","","","","","","","","","","","","","","","","",""
"UN8FKRUE","videoRecording","2015","Educause","Why Is Measuring Learning So Difficult?","","","","","https://www.youtube.com/watch?v=_iv8A1pHNYA","Several higher education learning and assessment professionals discuss the difficulties of measuring learning.","2015-08-17","2019-09-17 21:42:00","2019-09-17 21:42:00","2016-01-17 18:50:57","","","","","","","","","","","","","","","","","","","YouTube","","","<p>Why is measuring learning so difficult?</p> <ol> <li>Learning is a very multi-dimensional thing - we have to simplify data so much to capture</li> <li>Learning is so board</li> <li>What people know and what people learn</li> <li>Depend to the definition of learning</li> <li>Culture, social, individual psychology we have to consider</li> <li>Wild range of the students</li> <li>Measurement of competence is different from scores in the class</li> <li>What kinds of connection of failing or drop out the school</li> <li>Learning is magic, it is a collaborate thing</li> </ol> <p> </p>","","","","Learning; Assessment; Education; educational assessment; EDUCAUSE; Higher Education; learners; Teaching and learning","","","","","","","","","","","","","","","","","","","","","470 seconds","","","","","","","","","","","","","","","","","","","","","","","","",""
"Y776YU3Q","webpage","2016","Weinersmith, Zach","Saturday Morning Breakfast Cereal","","","","","http://www.smbc-comics.com/index.php?id=3978","","2016-01-05","2019-09-17 21:42:00","2019-09-17 21:42:00","2016-01-18 18:17:09","","","","","","","","","","","","","","","","","","","","","","<p>When we adopt education reform, we should fully realize that the cause and effect is not an inversion of cause and effect, or it will bring very serious negative effects.</p> <p>As the comic said, scholars have researched and found that 90% of the elites have the act of disassembling alarm clocks when they were young. Causality should not be imposed at this time. T</p> <p>his phenomenon does not mean that the act of disassembling alarm clocks has become elite Necessary, so it should not be taken blindly to have all students disassemble the alarm clock.</p> <p>In general, if the investigation finds two variables that have a high correlation, it should be distinguished whether there is a causal relationship between them and then take action on the actual problem.</p>","","http://www.smbc-comics.com/index.php?id=3978","","","","","","","","","","","","","","","","","","","","","","","","","","","","","","","","","","","","","","","","","","","","","","","",""
"MA6GQ2B9","conferencePaper","2014","Clow, Doug","Data wranglers: human interpreters to help close the feedback loop","Proceedings of the Fourth International Conference on Learning Analytics And Knowledge","","","","","","2014","2019-09-17 21:42:00","2019-09-17 21:42:00","","49–53","","","","","","","","","","","ACM","","","","","","","","","","<p>The amount of data and the range of different data sources can make it difficult to take systematic action on this data.</p> <p>The plan to introduce human data personnel are deployed at the Open University. The United Kingdom is responsible for understanding and studying various relevant data sources, analyzing data to understand personal practice capabilities and production reports, summarizing the main points, and putting forward operational recommendations.</p> <p>The evaluation and experience of this work plan strongly support the meaning of humans - the value analysis process of maker learning and show that obstacles to organizational transformation in this area can be substituted by working within the strategic environment of embedded analysis, learning and working at an appropriate level Granularity analysis.</p>","","","","","","","","","","","","","","","","","","","","","","","","","","","","","","","","","","","","","","","","","","","","","","","","","",""
"5CGRDTQN","magazineArticle","2015","Kucirkova, Natalia; FitzGerald, Elizabeth","Zuckerberg is ploughing billions into 'personalised learning' – why?","The Conversation","","","","http://theconversation.com/zuckerberg-is-ploughing-billions-into-personalised-learning-why-51940","Zuckerburg wants to plough billions into personalised learning, but his way may not be the right way.","2015-12-09","2019-09-17 21:42:00","2019-09-17 21:42:00","2016-01-18 19:14:05","","","","","","","","","","","","","","","","","","","","","","<p>Personalized learning is defined as all outstanding teachers modify learning materials and teaching styles to suit students' different learning styles. Zuckerberg has a clear definition. Human work is replaced by technology, and algorithms provide content based on analysis of users' past behaviors and interests. This is similar to how Facebook news feeds and other business personalization models based on text and behavioral analysis work.<br />There is hype about the potential of new technologies or methods to undermine education, and there is a legitimate concern that investments in personalized learning may power Silicon Valley and teachers.</p> <p>There are three main flaws in Zuckerberg's personalized learning philosophy. First, education has always been about acquiring professional-related knowledge and skills, but also about acquiring common sense. By providing children only with what they are interested in, we may get many experts and few generalists. Second, although learners may cope with learning in ways that are not suitable for them, in the real world, life is not always so adaptive. Their lack of compensation may mean that they have suffered losses. Finally, children's preferences are not fixed-in fact, they often change in their direct response to the environment.</p>","","https://theconversation.com/zuckerberg-is-ploughing-billions-into-personalised-learning-why-51940","","","","","","","","","","","","","","","","","","","","","","","","","","","","","","","","","","","","","","","","","","","","","","","",""
"5L2T6IT9","videoRecording","2015","Georgia Tech","Feature Selection","","","","","https://www.youtube.com/watch?v=8CpRLplmdqE","","2015-02-23","2019-09-17 21:42:01","2019-09-17 21:42:01","2016-01-18 19:18:06","","","","","","","","","","","","Youtube","","","","","","","","","","<ul> <li>Feature Selection <ul> <li>Why? <ul> <li>Knowledge Discovery</li> <li>Interpretability</li> <li>Insight</li> </ul> </li> <li>Curse of dimensionality <ul> <li>Among the data, if we want more features of the data, we should obtain more dimensions of the data.</li> </ul> </li> </ul> </li> </ul>","","https://www.youtube.com/watch?v=8CpRLplmdqE","","","","","","","","","","","","","","","","","","","","","","","3:13","","","","","","","","","","","","","","","","","","","","","","","","",""
"BYCMM8M5","bookSection","2016","Hanneman, R.A.; Riddle, M.","Chapter 1: Social Network Data","Introduction to Social Network Methods","","","","http://faculty.ucr.edu/~hanneman/nettext/C1_Social_Network_Data.html","","2016-01-18","2019-09-17 21:42:01","2019-09-17 21:42:01","2016-01-18 20:17:24","","","","","","","","","","","","","","","","","","","","","","<ul> <li>Conventional social science data consist of a rectangular array of measurements.</li> <li>Nodes: <ul> <li>Network data are defined by actors and by relations (or nodes and edges)</li> <li>The nodes or actors included in non-network studies tend to be the result of independent probability</li> </ul> </li> <li>Population. sample and boundaries <ul> <li>social network analysts rarely draw samples in their work.</li> <li>The population that network analysts study are remarkably diverse</li> <li>The boundaries of the populations studies by network analysts are of two main types.</li> <li>Naturally predisposes that analyst to focus on multiple levels of analysis simultaneously.</li> <li>How the individual is embedded within a structure and how the structure emerges from the micro-relations between individual parts.</li> </ul> </li> <li>Sampling ties <ul> <li>full-network : maximum of information but costly and difficult to execute.</li> <li>Spectrum: less information; less costly and allow easier generalization from the observations in the sample to some larger population.</li> </ul> </li> <li>Snowball <ul> <li>Business contact networks, community elites, deviant sub-cultures, avid stamp collectors, kinship networks, and many other structures can be pretty effectively located and described by snowball methods.</li> </ul> </li> <li>Ego-centric networks (with alter connections) <ul> <li>collecting a form of relational data from very large populations</li> <li>Alter connections as a whole, as much as snowball of census approaches.</li> <li>focus on individual, rather than on the network as a whole.</li> </ul> </li> <li>Ordinal scales of measurement contain more information than nominal.</li> </ul>","","http://faculty.ucr.edu/~hanneman/nettext/C1_Social_Network_Data.html","","","","","","","","","","","","","","","","","","","","","","","","","","","","","","","","","","","","","","","","","","","","","","","",""
"HVGVTD7K","webpage","2014","Groelmund, Garrett","RStudio Cheat Sheets","RStudio","","","","https://www.rstudio.com/resources/cheatsheets/","","2014-08-01","2019-09-17 21:42:02","2019-09-17 21:42:02","2016-01-19 21:17:28","","","","","","","","","","","","","","","","","","","","","","<ul> <li>Data Transformation with dplyr <ul> <li>Summarise Case <ul> <li>Summarise (data)</li> <li>count (x)</li> <li>summarise_all()</li> <li>summarise_at()</li> <li>summarise_if()</li> </ul> </li> <li>Group Case <ul> <li>mtcars %&gt;%  group_by(cyl) %&gt;% summarise(avg = mean(mpg))</li> </ul> </li> <li>Manipulate Cases <ul> <li>filter(data)</li> <li>distinct(data)</li> <li>sample_n()</li> <li>slice(data)</li> <li>top_n()</li> </ul> </li> <li>Arrange / Add cases <ul> <li>arrange(data)</li> <li>desc()</li> </ul> </li> <li>Mutating join <ul> <li>left_join()</li> <li>right_join()</li> <li>inner_join()</li> <li>full_join()</li> </ul> </li> </ul> </li> </ul>","","http://shiny.rstudio.com/articles/rm-cheatsheet.html","","","","","","","","","","","","","","","","","","","","","","","","","","","","","","","","","","","","","","","","","","","","","","","",""
"MTNR2CZM","conferencePaper","2013","san Pedro, Maria Ofelia; Baker, Ryan; Bowers, Alex; Heffernan, Neil","Predicting college enrollment from student interaction with an intelligent tutoring system in middle school","Educational Data Mining 2013","","","","","","2013","2019-09-17 21:42:02","2019-09-17 21:42:02","","","","","","","","","","","","","","","","","","","","","","","<p>Many factors influence a student's decision to enroll in college. A lot of the external or social factors: financial reasons, parental support, and school support.</p> <p>Another major factor, however, is one's ability and engagement, which develops over the early years and begin to manifest strongly during the middle school years. In this paper, we apply fine-grained models of student knowledge, student effect and behavior to data from 3747 students using educational software over the course of a year of middle school to understand how the development of student learning an engagement during this phase of learning, can predict college enrollment.</p> <p>This paper support existing theories about indicators of college enrollment. More importantly, it further sheds light on behavioral factors the student experiences in classrooms. As the results here suggest, affect and disengagement are associated with college enrollment, suggesting that in the moment interventions.</p>","","","","","","","","","","","","","","","","","","","","","","","","","","","","","","","","","","","","","","","","","","","","","","","","","",""
"38LCAB5J","journalArticle","2012","Greller, Wolfgang; Drachsler, Hendrik","Translating Learning into Numbers: A Generic Framework for Learning Analytics","Journal of Educational Technology & Society","","1176-3647","","http://www.jstor.org/stable/jeductechsoci.15.3.42","ABSTRACT With the increase in available educational data, it is expected that Learning Analytics will become a powerful means to inform and support learners, teachers and their institutions in better understanding and predicting personal learning needs and performance. However, the processes and requirements behind the beneficial application of Learning and Knowledge Analytics as well as the consequences for learning and teaching are still far from being understood. In this paper, we explore the key dimensions of Learning Analytics (LA), the critical problem zones, and some potential dangers to the beneficial exploitation of educational data. We propose and discuss a generic design framework that can act as a useful guide for setting up Learning Analytics services in support of educational practice and learner guidance, in quality assurance, curriculum development, and in improving teacher effectiveness and efficiency. Furthermore, the presented article intends to inform about soft barriers and limitations of Learning Analytics. We identify the required skills and competences that make meaningful use of Learning Analytics data possible to overcome gaps in interpretation literacy among educational stakeholders. We also discuss privacy and ethical issues and suggest ways in which these issues can be addressed through policy guidelines and best practice examples.","2012","2019-09-17 13:04:24","2019-12-12 03:00:43","2016-09-03 18:55:41","42-57","","3","15","","Journal of Educational Technology & Society","Translating Learning into Numbers","","","","","","","","","","","","JSTOR","","","<p># From HUDK405019-L6-Wrangling2.pdf</p> <h2>Exercise 2</h2> <ul> <li>Consider the fake data you generated and the diagram on page 44 of Greller &amp; Draschler</li> <li>Work your way through each of the boxes</li> <li>Which would pose problems for you to actually acquire the data you want？</li> <li>Write a note summarizing the article in Zotero, include thoughts based on your answers to the above.</li> </ul> <p>#Can everyone understand the meaning</p> <p>#Are they going to accept the meaning</p> <p>#The norms -- some class do not provide grade</p> <p>#Very completed process to grade</p> <p>#When we apply this, we are sort people</p> <p>#different institutions and teachers can have different way to get the data.</p> <p> </p>; <ul> <li>It is already evident that data in combination with information retrieval technologies are not only the basis for the emergent data economy, but also hold substantial promises for use in education</li> <li>The new data economy has made data collection very much an affordable activity.</li> <li>The renewed interest in data science and information retrieval technologies such as educational data mining, machine learning, or latent semantic analysis in Technology-Enhanced Learning(TEL) reveals itself through an increasing number of scientific conferences, workshops and projects combined under the new research term Learning Analytics.</li> <li>Proposed design framework for learning analytics <ul> <li>Stakeholders <ul> <li>Institution</li> <li>Teachers</li> <li>Learners</li> <li>Other</li> </ul> </li> <li>Internal Limitations <ul> <li>Competences</li> <li>Acceptance</li> </ul> </li> <li>External Constraints <ul> <li>Conventions</li> <li>Norms</li> </ul> </li> <li>Instruments <ul> <li>Technology</li> <li>Algorithm</li> <li>Theories</li> </ul> </li> <li>Data <ul> <li>Open</li> <li>Protected</li> </ul> </li> <li>Objectives <ul> <li>Reflection</li> <li>Prediction</li> </ul> </li> </ul> </li> </ul>","C:\Users\superme\Zotero\storage\JTD85YA7\Greller 和 Drachsler - Translating Learning into Numbers A Generic Frame.pdf","","","","","","","","","","","","","","","","","","","","","","","","","","","","","","","","","","","","","","","","","","","","","","","","",""
"EJ2KAXQW","bookSection","2006","Kay, Judy; Maisonneuve, Nicolas; Yacef, Kalina; Reimann, Peter","The Big Five and Visualisations of Team Work Activity","Intelligent Tutoring Systems","978-3-540-35159-7 978-3-540-35160-3","","","http://link.springer.com/chapter/10.1007/11774303_20","We have created a set of novel visualisations of group activity: they mirror activity of individuals and their interactions, based upon readily available authentic data. We evaluated these visualisations in the context of a semester long software development project course. We give a theoretical analysis of the design of our visualizations using the framework from the “Big 5” theory of team work as well as a qualitative study of the visualisations and the students’ reflective reports. We conclude that these visualisations provide a powerful and valuable mirroring role with potential, when well used, to help groups learn to improve their effectiveness.","2006-06-26","2019-09-17 21:42:03","2019-09-17 21:42:03","2016-09-03 19:10:12","197-206","","","","","","","Lecture Notes in Computer Science","4053","","","Springer Berlin Heidelberg","","en","©2006 Springer-Verlag Berlin Heidelberg","","","","link.springer.com","","DOI: 10.1007/11774303_20","<ul> <li>Two questions answered in this paper <ul> <li>How well do the visualizations capture information relevant in the context of the Big Five framework?</li> <li>Is there a relation between patterns indentifiable through these visualizations and group performance outcomes?</li> </ul> </li> <li>Big 5 theory <ul> <li>Team Leadership - Ticket Action <ul> <li>Facilitate problem solving: Wattle Tree</li> <li>Provide performance expectations and acceptable interaction patterns</li> <li>Synchronise and combine individual team member contributions see and evaluate information ht affects team functioning</li> </ul> </li> <li>Mutual performance monitoring - Interaction Networks <ul> <li>Identifying mistakes and lapses in other team members' actions</li> </ul> </li> <li>Backup behavior -IN/T <ul> <li>Recognition of a workload distribution problem n the team</li> <li>Shifting work to underutilised members</li> </ul> </li> <li>Adaptability - Wattle Tree <ul> <li>Identify cues of change, assign meaning to it , develop new plan to deal with it.</li> </ul> </li> <li>Team Orientation <ul> <li>Increase task involvement, information, sharing , strategies and goal settings.</li> </ul> </li> </ul> </li> <li>Computer-supported collaborative learning (CSCL)</li> <li>Three coordinating mechanisms: <ul> <li>Shared mental models</li> <li>Mutual trust</li> <li>Closed-loop communication</li> </ul> </li> <li>Overview of Visualization <ul> <li>Activity Rader</li> <li>Interaction Network</li> <li>Wattle Tree</li> </ul> </li> </ul>","","https://link.springer.com/chapter/10.1007/11774303_20","","Multimedia Information Systems; User Interfaces and Human Computer Interaction; Artificial Intelligence (incl. Robotics); Computers and Education; Information Systems Applications (incl. Internet)","Ikeda, Mitsuru; Ashley, Kevin D.; Chan, Tak-Wai","","","","","","","","","","","","","","","","","","","","","","","","","","","","","","","","","","","","","","","","","","","","",""
"HRYXXKDY","journalArticle","2015","Konstan, Joseph A.; Walker, J. D.; Brooks, D. Christopher; Brown, Keith; Ekstrand, Michael D.","Teaching Recommender Systems at Large Scale: Evaluation and Lessons Learned from a Hybrid MOOC","ACM Trans. Comput.-Hum. Interact.","","1073-0516","10.1145/2728171","http://doi.acm.org/10.1145/2728171","","2015-04","2019-09-17 21:42:03","2019-09-17 21:42:03","2016-09-03 20:38:02","10:1–10:23","","2","22","","","Teaching Recommender Systems at Large Scale","","","","","","","","","","","","ACM Digital Library","","","<ul> <li>Measures and Data <ul> <li>Pre-post student surveys (demographics, motivations)</li> <li>Pre-post knowledge test (recommender systems concepts)</li> <li>Process and result metrics from Coursera</li> </ul> </li> <li>Lessons Learned <ul> <li>Good teaching at scale, more time and effort</li> <li>Student leave Moocs</li> <li>Students claim they want short courses and videos</li> <li>Students really serious about ""grades""</li> <li>Students hate peer grading</li> <li>Multiple choice reverses the effort function</li> <li>Demands not proportional to tuition paid</li> <li>Long format actually does work and many students preferred it</li> <li>The two-track approach worked</li> </ul> </li> </ul>","","","","learning assessment; Massively Online Open Course (MOOC)","","","","","","","","","","","","","","","","","","","","","","","","","","","","","","","","","","","","","","","","","","","","","",""
