"P4AX9RP6","book","2015","Matsuda, Noboru; Furukawa, Tadanobu; Bier, Norman; Faloutsos, Christos","Machine Beats Experts: Automatic Discovery of Skill Models for Data-Driven Online Course Refinement","","","","","http://eric.ed.gov/?id=ED560513","How can we automatically determine which skills must be mastered for the successful completion of an online course? Large-scale online courses (e.g., MOOCs) often contain a broad range of contents frequently intended to be a semester's worth of materials; this breadth often makes it difficult to articulate an accurate set of skills and knowledge (i.e., a skill model, or the QMatrix). We have developed an innovative method to discover skill models from the data of online courses. Our method assumes that online courses have a pre-defined skill map for which skills are associated with formative assessment items embedded throughout the online course. Our method carefully exploits correlations between various parts of student performance, as well as in the text of assessment items, to build a superior statistical model that even outperforms human experts. To evaluate our method, we compare our method with existing methods (LFA) and human engineered skill models on three Open Learning Initiative (OLI) courses at Carnegie Mellon University. The results show that (1) our method outperforms human-engineered skill models, (2) skill models discovered by our method are interpretable, and (3) our method is remarkably faster than existing methods. These results suggest that our method provides a significant contribution to the evidence-based, iterative refinement of online courses with a promising scalability. [For complete proceedings, see ED560503.]","2015-06","2019-09-19 18:55:49","2019-09-19 18:55:49","2016-09-03 20:48:57","","","","","","","Machine Beats Experts","","","","","International Educational Data Mining Society","","en","","","","","ERIC","","","<p>This article's main method focuses on correlations between various parts of student performance, as well as in the text of assessment items, and builds a superior statistical model that outperforms human experts. The results show that (1) their method outperforms human-engineered skill models, (2) skill models discovered by their method are interpretable, and (3) their method is remarkably faster than existing methods. 'These results suggest that our method provides a significant contribution to the evidence-based, iterative refinement of online courses with a promising scalability. "" However, I don't think these methods and results are enough to reach to the above conclusion, because more factors need to be taken in to considerations</p>","","http://eric.ed.gov/?id=ED560513","","data; Automation; Comparative Analysis; Correlation; Formative Evaluation; models; Online Courses; Skills","","","","","","","","","","","","","","","","","","","","","","","","","","","","","","","","","","","","","","","","","","","","","",""
"2F2IZ4C7","bookSection","2016","Hanneman, R.A.; Riddle, M.","Chapter 1: Social Network Data","Introduction to Social Network Methods","","","","http://faculty.ucr.edu/~hanneman/nettext/C1_Social_Network_Data.html","","2016-01-18","2019-09-19 18:55:49","2019-09-19 18:55:49","2016-01-18 20:17:24","","","","","","","","","","","","","","","","","","","","","","<p><span style=""caret-color: #000000; color: #000000; font-family: Arial; font-style: normal; font-variant-caps: normal; font-weight: normal; letter-spacing: normal; orphans: auto; text-align: start; text-indent: 0px; text-transform: none; white-space: normal; widows: auto; word-spacing: 0px; -webkit-text-size-adjust: auto; -webkit-text-stroke-width: 0px; text-decoration: none;"">After reading this article, I'm more interested in the application of statistics to social network data. This text focuses on more basic and commonplace uses of network analysis,  the dealing with the ""descriptive"" side of statistics. They include developing index numbers to describe certain aspects of the distribution of relational ties among actors in networks. On the other side, the second half of the text is helpful for people who are interested in the inferential side,<br /></span></p>","","http://faculty.ucr.edu/~hanneman/nettext/C1_Social_Network_Data.html","","","","","","","","","","","","","","","","","","","","","","","","","","","","","","","","","","","","","","","","","","","","","","","",""
"HC4TWKJ6","bookSection","2017","Klerkx, Joris; Verbert, Katrien; Duval, Erik","Learning Analytics Dashboards","The Handbook of Learning Analytics","978-0-9952408-0-3","","","www.solaresearch.org","","2017","2019-09-19 18:55:49","2019-09-19 18:55:49","","","","","","","","","","","","","","Vancouver, BC, Canada","EN","","","","","","","","<p>This website serves as the society for learning analytics research and post a large number of related articles, essay and researches. For example, 2020 Call for Executive Committee Nominations is a very recent research that was posted on November 19, 2019. There are a lot of interesting topics and data to learn from by using the resources on the society for learning analytics research.</p>","","","","","","","","","","","","","","","","","","","","","","","","1","","","","","","","","","","","","","","","","","","","","","","","","","",""
"PKTVFIG6","bookSection","2017","Bergner, Yoav","Measurement and its Uses in Learning Analytics","The Handbook of Learning Analytics","978-0-9952408-0-3","","","http://solaresearch.org/hla-17/hla17-chapter1","Psychological measurement is a process for making warranted claims about states of mind. As such, it typically comprises the following: de ning a construct; specifying a measurement model and (developing) a reliable instrument; analyzing and accounting for various sources of error (including operator error); and framing a valid argument for particular uses of the outcome. Measurement of latent variables is, after all, a noisy endeavor that can neverthe- less have high-stakes consequences for individuals and groups. This chapter is intended to serve as an introduction to educational and psychological measurement for practitioners in learning analytics and educational data mining. It is organized thematically rather than historically, from more conceptual material about constructs, instruments, and sources of measurement error toward increasing technical detail about particular measurement models and their uses. Some of the philosophical differences between explanatory and predictive modelling are explored toward the end.","2017","2019-09-19 18:55:49","2019-09-19 18:55:49","","34-48","","","","","","","","","","","Society for Learning Analytics Research (SoLAR)","Alberta, Canada","","","","","","","","","<p>This article talks about the Psychological measurement, a process for making warranted claims about states of mind. The method of measuring latent variables is interesting. The focus of this paper is also worth praising, because it focuses on thematical rather than historical aspects, from more conceptual material about constructs, instruments, and sources of measurement error toward increasing technical detail about particular measurement models and their uses.</p>","","","","","Lang, Charles; Siemens, George; Wise, Alyssa Friend; Gaševic, Dragan","","","","","","","","","","","","","","","","","","","1","","","","","","","","","","","","","","","","","","","","","","","","","",""
"5A8FJKMI","bookSection","2017","Brooks, Christopher; Thompson, Craig","Predictive Modelling in Teaching and Learning","The Handbook of Learning Analytics","978-0-9952408-0-3","","","http://solaresearch.org/hla-17/hla17-chapter1","This article describes the process, practice, and challenges of using predictive modelling in teaching and learning. In both the  elds of educational data mining (EDM) and learning analytics (LA) predictive modelling has become a core practice of researchers, largely with a focus on predicting student success as operationalized by academic achievement. In this chapter, we provide a general overview of considerations when using predictive modelling, the steps that an educational data scientist must consider when engaging in the process, and a brief overview of the most popular techniques in the  eld.","2017","2019-09-19 18:55:50","2019-09-19 18:55:50","","61-68","","","","","","","","","","","Society for Learning Analytics Research (SoLAR)","Alberta, Canada","","","","","","","","","<p>This article describes the process, practice, and challenges of using predictive modelling in teaching and learning. In both the elds of educational data mining (EDM) and learning analytics (LA) predictive modelling has become a core practice of researchers, largely with a focus on predicting student success as operationalized by academic achievement. This essay is very useful for people who are interested in studying predictive models for practice uses.</p>","","","","","Lang, Charles; Siemens, George; Wise, Alyssa Friend; Gaševic, Dragan","","","","","","","","","","","","","","","","","","","1","","","","","","","","","","","","","","","","","","","","","","","","","",""
"Z8USKR4N","bookSection","2017","Prinsloo, P; Slade, S","Ethics and Learning Analytics: Charting the (Un)Charted","The Handbook of Learning Analytics","978-0-9952408-0-3","","","https://solaresearch.org/hla-17/hla17-chapter4/","","2017-03","2019-09-19 18:55:50","2019-09-19 18:55:50","","49-57","","","","","","","","","","","Society for Learning Analytics Research","Vancouver, BC","EN","","","","","","","","<p><span style=""caret-color: #333333; color: #333333; font-family: 'Open Sans', Arial, sans-serif; font-size: 14px; font-style: normal; font-variant-caps: normal; font-weight: normal; letter-spacing: normal; orphans: auto; text-align: start; text-indent: 0px; text-transform: none; white-space: normal; widows: auto; word-spacing: 0px; -webkit-text-size-adjust: auto; -webkit-text-stroke-width: 0px; background-color: #ffffff; text-decoration: none; display: inline !important; float: none;"">This chapter provides an overview of how our own thinking has developed and maps our journey against broader developments in the field. It should be noticed and  emphasized that ethics and privacy are crucial enablers n learning analytics. It briefly locates ethics in learning analytics in the broader context of the forces shaping higher education and the roles of data and evidence. I think its argument is crucial in the future development of learning analytics.<br /></span></p>","","","","","","","","","","","","","","","","","","","","","","","","1","","","","","","","","","","","","","","","","","","","","","","","","","",""
"RADC7Z8T","bookSection","2017","Liu, R; Koedinger, K","Going Beyond Better Data Prediction to Create Explanatory Models of Educational Data","The Handbook of Learning Analytics","978-0-9952408-0-3","","","https://solaresearch.org/hla-17/hla17-chapter6/","","2017-03","2019-09-19 18:55:50","2019-09-19 18:55:50","","69-76","","","","","","","","","","","Society for Learning Analytics Research","Vancouver, BC","EN","","","","","","","","<p><span style=""caret-color: #333333; color: #333333; font-family: 'Open Sans', Arial, sans-serif; font-size: 14px; font-style: normal; font-variant-caps: normal; font-weight: normal; letter-spacing: normal; orphans: auto; text-align: start; text-indent: 0px; text-transform: none; white-space: normal; widows: auto; word-spacing: 0px; -webkit-text-size-adjust: auto; -webkit-text-stroke-width: 0px; background-color: #ffffff; text-decoration: none; display: inline !important; float: none;"">The vast majority of educational data mining research has focused on achieving predictive accuracy, but this study argues that the field could benefit from more focus on developing explanatory models. By reviewing examples of educational data mining efforts that have produced explanatory models, we reach improvements to learning outcomes and/or learning theory. This study is comprehensive and interesting in terms of the educational uses of data mining.<br /></span></p>","","","","","","","","","","","","","","","","","","","","","","","","1","","","","","","","","","","","","","","","","","","","","","","","","","",""
"TVY3D3XE","journalArticle","2011","Gelman, A; Niemi, J","Statistical graphics: making information clear – and beautiful","Significance","","","","","","2011-09","2019-09-19 18:55:50","2019-09-19 18:55:50","","134-136","","","","","","","","","","","","","","","","","","","","","<p>The take-away message here is that he obvious way to present information is in a graph. But not all graphs are created equal. A well-designed graph can make clear what an ill-thought-out one conceals. Jarad Niemi and Andrew Gelman present visualisations of a measles epidemic. To me, plotting and making beautiful and efficient graphs are really important in presenting information in statistics, economics, and other related subjects. </p>","","","","","","","","","","","","","","","","","","","","","","","","","","","","","","","","","","","","","","","","","","","","","","","","","",""
"TBQ4N5C9","journalArticle","1984","Wainer, H","How to display data badly","The American Statistician","","","","","","1984","2019-09-19 18:55:50","2019-09-19 18:55:50","","137-147","","2","38","","","","","","","","","","","","","","","","","","<p>This article talks about methods for displaying data and gives examples of a wide variety of interesting and inventive schemes. Three parts: showing data, showing data accurately, and showing data clearly are the key elements in creating good graphs.</p>","","","","","","","","","","","","","","","","","","","","","","","","","","","","","","","","","","","","","","","","","","","","","","","","","",""
"WL2E8VRJ","journalArticle","2012","Gelman, A; Unwin, A","Infovis and Statistical Graphics: Different Goals, Different Looks (with discussion)","","","","","","","2012","2019-09-19 18:55:50","2019-09-19 18:55:50","","","","","","","","","","","","","","","","","","","","","","","<p>This article emphasizes the importance of graphical displays in statistical practice. Tukey’s Exploratory Data Analysis (1977) and Tufte’s books are two main contributors. However, exploratory and graphical methods represent a minor subfield and are not wellintegrated with larger themes of modeling and inference. Infographics is used widely, but their purveyors and enthusiasts appear to be uninterested in statistical principles.</p>","","","","","","","","","","","","","","","","","","","","","","","","","","","","","","","","","","","","","","","","","","","","","","","","","",""
"HH3A7I83","blogPost","2014","Fung, K","Junkcharts Trifecta Checkup: The Definitive Guide","Junkcharts","","","","http://junkcharts.typepad.com/junk_charts/junk-charts-trifecta-checkup-the-definitive-guide.html","","2014","2019-09-19 18:55:50","2019-09-19 18:55:50","","","","","","","","","","","","","","","","","Blog","","","","","","<p>This web page talks about eh junkcharts. They give several examples of junk charts that have one or more kinds of errors. Some graphs have unnecessary labeling or decorations. Others may contain distorted scaling or dimensions. This webpage serves well in creating future more useful plots.</p>","","","","","","","","","","","","","","","","","","","","","","","","","","","","","","","","","","","","","","","","","","","","","","","","","",""