"Key","Item Type","Publication Year","Author","Title","Publication Title","ISBN","ISSN","DOI","Url","Abstract Note","Date","Date Added","Date Modified","Access Date","Pages","Num Pages","Issue","Volume","Number Of Volumes","Journal Abbreviation","Short Title","Series","Series Number","Series Text","Series Title","Publisher","Place","Language","Rights","Type","Archive","Archive Location","Library Catalog","Call Number","Extra","Notes","File Attachments","Link Attachments","Manual Tags","Automatic Tags","Editor","Series Editor","Translator","Contributor","Attorney Agent","Book Author","Cast Member","Commenter","Composer","Cosponsor","Counsel","Interviewer","Producer","Recipient","Reviewed Author","Scriptwriter","Words By","Guest","Number","Edition","Running Time","Scale","Medium","Artwork Size","Filing Date","Application Number","Assignee","Issuing Authority","Country","Meeting Name","Conference Name","Court","References","Reporter","Legal Status","Priority Numbers","Programming Language","Version","System","Code","Code Number","Section","Session","Committee","History","Legislative Body"
"GAG2HDBU","journalArticle","2010","Bowers, Alex J.","Analyzing the Longitudinal K-12 Grading Histories of Entire Cohorts of Students: Grades, Data Driven Decision Making, Dropping out and Hierarchical Cluster Analysis","Practical Assessment, Research & Evaluation","","1531-7714","","","School personnel currently lack an effective method to pattern and visually interpret disaggregated achievement data collected on students as a means to help inform decision making. This study, through the examination of longitudinal K-12 teacher assigned grading histories for entire cohorts of students from a school district (n=188), demonstrates a novel application of hierarchical cluster analysis and pattern visualization in which all data points collected on every student in a cohort can be patterned, visualized and interpreted to aid in data driven decision making by teachers and administrators. Additionally, as a proof-of-concept study, overall schooling outcomes, such as student dropout or taking a college entrance exam, are identified from the data patterns and compared to past methods of dropout identification as one example of the usefulness of the method. Hierarchical cluster analysis correctly identified over 80% of the students who dropped out using the entire student grade history patterns from either K-12 or K-8. (Contains 5 figures.)","2010-05","2019-09-19 18:55:45","2019-09-19 18:55:45","2014-09-24 19:31:29","","","7","15","","","Analyzing the Longitudinal K-12 Grading Histories of Entire Cohorts of Students","","","","","","","en","","","","","ERIC","","","<p>This article talks about that the school personnel currently lack an effective method to pattern and visually interpret disaggregated achievement data collected on students as a means to help inform decision making. This study mainly relies on the data of the longitudinal K-12 teacher assigned grading histories for entire cohorts of students from a school district.  The main method used is the Hierarchical cluster analysis.</p>","","http://eric.ed.gov/?id=EJ933686","","data; data analysis; Decision Making; Dropouts; Elementary School Students; Grades (Scholastic); Identification; MULTIVARIATE analysis; School Districts; Secondary School Students","","","","","","","","","","","","","","","","","","","","","","","","","","","","","","","","","","","","","","","","","","","","","",""
"L4AJ3T93","journalArticle","2014","Grunspan, Daniel Z.; Wiggins, Benjamin L.; Goodreau, Steven M.","Understanding Classrooms through Social Network Analysis: A Primer for Social Network Analysis in Education Research","CBE-Life Sciences Education","",", 1931-7913","10.1187/cbe.13-08-0162","http://www.lifescied.org/content/13/2/167","Social interactions between students are a major and underexplored part of undergraduate education. Understanding how learning relationships form in undergraduate classrooms, as well as the impacts these relationships have on learning outcomes, can inform educators in unique ways and improve educational reform. Social network analysis (SNA) provides the necessary tool kit for investigating questions involving relational data. We introduce basic concepts in SNA, along with methods for data collection, data processing, and data analysis, using a previously collected example study on an undergraduate biology classroom as a tutorial. We conduct descriptive analyses of the structure of the network of costudying relationships. We explore generative processes that create observed study networks between students and also test for an association between network position and success on exams. We also cover practical issues, such as the unique aspects of human subjects review for network studies. Our aims are to convince readers that using SNA in classroom environments allows rich and informative analyses to take place and to provide some initial tools for doing so, in the process inspiring future educational studies incorporating relational data.","2014-06-20","2019-09-19 18:55:46","2019-09-19 18:55:46","2014-08-20 20:21:46","167-178","","2","13","","CBE Life Sci Educ","Understanding Classrooms through Social Network Analysis","","","","","","","en","","","","","www.lifescied.org","","","<p>This article demonstrates the study of social interactions between students. It argues that learning relationships form in undergraduate classrooms can inform educators in unique ways and improve educational reform. It introduce basic concepts in SNA, along with methods for data collection, data processing, and data analysis, using a previously collected example study on an undergraduate biology classroom as a tutorial. I really like this text, because it contains the unique aspects of humanities. </p>","","http://www.lifescied.org/content/13/2/167","Week 2","","","","","","","","","","","","","","","","","","","","","","","","","","","","","","","","","","","","","","","","","","","","","","",""
"QZB4NGFL","blogPost","2014","Young, Jeffrey R.","Why Students Should Own Their Educational Data","The Chronicle of Higher Education Blogs: Wired Campus","","","","http://chronicle.com/blogs/wiredcampus/why-students-should-own-their-educational-data/54329","","2014-08-21","2019-09-19 18:55:46","2019-09-19 18:55:46","2014-08-23 21:32:22","","","","","","","","","","","","","","","","","","","","","","<p><span style=""caret-color: #2a2e2e; color: #2a2e2e; font-family: 'Helvetica Neue', arial, sans-serif; font-size: 15px; font-style: normal; font-variant-caps: normal; font-weight: normal; letter-spacing: normal; orphans: auto; text-align: left; text-indent: 0px; text-transform: none; white-space: normal; widows: auto; word-spacing: 0px; -webkit-text-size-adjust: auto; -webkit-text-stroke-width: 0px; text-decoration: none; display: inline !important; float: none;"">I believe the most effective learning approach, based on extensive research, remains the self-paced, individually guided strategy (ie, the apprentice or tutoring model). However, that model is too expensive and impractical for all but the 1%. Maybe with enough data and design, the model can be replicated through technology.</span></p>","","http://chronicle.com/blogs/wiredcampus/why-students-should-own-their-educational-data/54329","","","","","","","","","","","","","","","","","","","","","","","","","","","","","","","","","","","","","","","","","","","","","","","",""
"HWSK6MZ5","journalArticle","1994","Corbett, Albert T.; Anderson, John R.","Knowledge tracing: Modeling the acquisition of procedural knowledge","User Modeling and User-Adapted Interaction","","0924-1868, 1573-1391","10.1007/BF01099821","http://link.springer.com.ezp-prod1.hul.harvard.edu/article/10.1007/BF01099821","This paper describes an effort to model students' changing knowledge state during skill acquisition. Students in this research are learning to write short programs with the ACT Programming Tutor (APT). APT is constructed around a production rule cognitive model of programming knowledge, called theideal student model. This model allows the tutor to solve exercises along with the student and provide assistance as necessary. As the student works, the tutor also maintains an estimate of the probability that the student has learned each of the rules in the ideal model, in a process calledknowledge tracing. The tutor presents an individualized sequence of exercises to the student based on these probability estimates until the student has ‘mastered’ each rule. The programming tutor, cognitive model and learning and performance assumptions are described. A series of studies is reviewed that examine the empirical validity of knowledge tracing and has led to modifications in the process. Currently the model is quite successful in predicting test performance. Further modifications in the modeling process are discussed that may improve performance levels.","1994-12-01","2019-09-19 18:55:46","2019-09-19 18:55:46","2013-04-21 21:21:19","253-278","","4","4","","User Model User-Adap Inter","Knowledge tracing","","","","","","","en","","","","","link.springer.com.ezp-prod1.hul.harvard.edu","","","<p>This paper describes an effort to model students' changing knowledge state during skill acquisition. Students in this research are learning to write short programs with the ACT Programming Tutor (APT). APT is constructed around a production rule cognitive model of programming knowledge, called the ideal student model. This model allows the tutor to solve exercises along with the student and provide assistance as necessary. </p>","","","","Education (general); empirical validity; individual differences; intelligent tutoring systems; Learning; Management of Computing and Information Systems; mastery learning; Multimedia Information Systems; procedural knowledge; Psychology, general; student modeling; User Interfaces and Human Computer Interaction","","","","","","","","","","","","","","","","","","","","","","","","","","","","","","","","","","","","","","","","","","","","","",""
"45DI9VVZ","conferencePaper","2012","Siemens, George; Baker, Ryan S. J. d.","Learning Analytics and Educational Data Mining: Towards Communication and Collaboration","Proceedings of the 2Nd International Conference on Learning Analytics and Knowledge","978-1-4503-1111-3","","10.1145/2330601.2330661","http://doi.acm.org/10.1145/2330601.2330661","Growing interest in data and analytics in education, teaching, and learning raises the priority for increased, high-quality research into the models, methods, technologies, and impact of analytics. Two research communities -- Educational Data Mining (EDM) and Learning Analytics and Knowledge (LAK) have developed separately to address this need. This paper argues for increased and formal communication and collaboration between these communities in order to share research, methods, and tools for data mining and analysis in the service of developing both LAK and EDM fields.","2012","2019-09-19 18:55:46","2019-09-19 18:55:46","2015-01-16 03:15:55","252–254","","","","","","Learning Analytics and Educational Data Mining","LAK '12","","","","ACM","New York, NY, USA","","","","","","ACM Digital Library","","","<p>Educational Data Mining (EDM) and Learning Analytics and Knowledge (LAK) are heavily discussed in this article and are the two main approaches. It argues for increased and formal communication and collaboration between these communities in order to share research, methods, and tools for data mining and analysis in the service of developing both LAK and EDM fields.</p>","","","","Collaboration; educational data mining; learning analytics and knowledge","","","","","","","","","","","","","","","","","","","","","","","","","","","","","","","","","","","","","","","","","","","","","",""
"WXUUSV6N","book","2015","Zheng, Alice","Evaluating Machine Learning Models","","","","","http://www.oreilly.com/data/free/evaluating-machine-learning-models.csp?intcmp=il-data-free-lp-lgen_free_reports_page","Data science today is a lot like the Wild West: there’s endless opportunity and excitement, but also a lot of chaos and confusion. If you’re new to data science and applied machine learning, evaluating a machine-learning model can seem pretty overwhelming...","2015-09","2019-09-19 18:55:47","2019-09-19 18:55:47","2015-12-15 18:26:39","","","","","","","","","","","","O'Reily Media","Sebastopol, CA","","","","","","","","","<p>Data science is very useful in a lot of fields and relied heavily on statistics. Some of the commonly used machine learning techniques or methods contain bootstrapping, cross-validation, random tree, forests, best subset selection, clustering. In all, the field of learning analytics and machine learning are closed related and discussed together.</p>","","http://www.oreilly.com/data/free/evaluating-machine-learning-models.csp?intcmp=il-data-free-lp-lgen_free_reports_page","","","","","","","","","","","","","","","","","","","","","","","","","","","","","","","","","","","","","","","","","","","","","","","",""
"94BSSKBH","videoRecording","2015","Educause","Why Is Measuring Learning So Difficult?","","","","","https://www.youtube.com/watch?v=_iv8A1pHNYA","Several higher education learning and assessment professionals discuss the difficulties of measuring learning.","2015-08-17","2019-09-19 18:55:47","2019-09-19 18:55:47","2016-01-17 18:50:57","","","","","","","","","","","","","","","","","","","YouTube","","","<p><span style=""caret-color: #111111; color: #111111; font-family: Roboto, Arial, sans-serif; font-size: 14px; font-style: normal; font-variant-caps: normal; font-weight: normal; letter-spacing: normal; orphans: auto; text-align: start; text-indent: 0px; text-transform: none; white-space: pre-wrap; widows: auto; word-spacing: 0px; -webkit-text-size-adjust: auto; -webkit-text-stroke-width: 0px; background-color: #f9f9f9; text-decoration: none; display: inline !important; float: none;"">I wonder what this means for Ryan Baker and his students at EdX (not to pick on any one group of interested scholars in particular), but also the OLI at Carnegie Mellon and the recent exciting winning of crucial funding for Acrobatiq</span>. Overall, this video is interesting and inspiring.</p>","","","","Learning; Assessment; Education; educational assessment; EDUCAUSE; Higher Education; learners; Teaching and learning","","","","","","","","","","","","","","","","","","","","","470 seconds","","","","","","","","","","","","","","","","","","","","","","","","",""
"3ZR2EWMS","webpage","2016","Weinersmith, Zach","Saturday Morning Breakfast Cereal","","","","","http://www.smbc-comics.com/index.php?id=3978","","2016-01-05","2019-09-19 18:55:47","2019-09-19 18:55:47","2016-01-18 18:17:09","","","","","","","","","","","","","","","","","","","","","","<p>To be honest, I didn't get the point of this comic series. All I notice is that the author is making fun of engineering and data science. I mean, it did make sense on certain degree. But the culture difference might be a hinder.</p>","","http://www.smbc-comics.com/index.php?id=3978","","","","","","","","","","","","","","","","","","","","","","","","","","","","","","","","","","","","","","","","","","","","","","","",""
"9TZALMB9","webpage","2015","RStudio","The Data Wrangling Cheatsheet","","","","","http://www.rstudio.com/wp-content/uploads/2015/02/data-wrangling-cheatsheet.pdf","","2015-01","2019-09-19 18:55:47","2019-09-19 18:55:47","2016-01-18 18:42:27","","","","","","","","","","","","","","","","","","","","","","<p>The data wrangling cheat sheet is a comprehensive summary of commonly used functions in succinct forms that are ready for us to use. It is really convenient and helpful to people who work in the field of data science and analytics to deal with huge data sets. </p>","","http://www.rstudio.com/wp-content/uploads/2015/02/data-wrangling-cheatsheet.pdf","","","","","","","","","","","","","","","","","","","","","","","","","","","","","","","","","","","","","","","","","","","","","","","",""
"NDEXJRTH","conferencePaper","2014","Clow, Doug","Data wranglers: human interpreters to help close the feedback loop","Proceedings of the Fourth International Conference on Learning Analytics And Knowledge","","","","","","2014","2019-09-19 18:55:48","2019-12-20 17:57:07","","49–53","","","","","","","","","","","ACM","","","","","","","","","","<p><span style=""color: #000000; font-family: Verdana, Arial, sans-serif; font-size: 11.7px; font-style: normal; font-variant-ligatures: normal; font-variant-caps: normal; font-weight: 400; letter-spacing: normal; orphans: 2; text-align: left; text-indent: 0px; text-transform: none; white-space: normal; widows: 2; word-spacing: 0px; -webkit-text-stroke-width: 0px; background-color: #ffffff; text-decoration-style: initial; text-decoration-color: initial; display: inline !important; float: none;"">This paper describes a programme of human Data Wranglers deployed at the Open University, UK, charged with making sense of a range of data sources related to learning, analysing that data in the light of their understanding of practice in individual faculties/departments, and producing reports that summarise the key points and make actionable recommendations.</span></p>","","","","","","","","","","","","","","","","","","","","","","","","","","","","","","","","","","","","","","","","","","","","","","","","","",""
"CTBJFE2Z","magazineArticle","2015","Kucirkova, Natalia; FitzGerald, Elizabeth","Zuckerberg is ploughing billions into 'personalised learning' – why?","The Conversation","","","","http://theconversation.com/zuckerberg-is-ploughing-billions-into-personalised-learning-why-51940","Zuckerburg wants to plough billions into personalised learning, but his way may not be the right way.","2015-12-09","2019-09-19 18:55:48","2019-09-19 18:55:48","2016-01-18 19:14:05","","","","","","","","","","","","","","","","","","","","","","<p>This article talks about Zuckerburg's story and conveys that his's way ay not be the right way. Zuckerburg wants to plough billions into personalised learning, but from a technical perspective, more factors need to be taken into account. </p>","","https://theconversation.com/zuckerberg-is-ploughing-billions-into-personalised-learning-why-51940","","","","","","","","","","","","","","","","","","","","","","","","","","","","","","","","","","","","","","","","","","","","","","","",""
"KHAEWD48","videoRecording","2015","Georgia Tech","Feature Selection","","","","","https://www.youtube.com/watch?v=8CpRLplmdqE","","2015-02-23","2019-09-19 18:55:48","2019-09-19 18:55:48","2016-01-18 19:18:06","","","","","","","","","","","","Youtube","","","","","","","","","","<p>This video talks about the feature selection in machine learning from two perspectives. One is the knowledge discovery that explains the interpretability and insight. The other is called the curse of dimensionality. These two tools are extremely useful in solving problems that involve data datasets.</p>","","https://www.youtube.com/watch?v=8CpRLplmdqE","","","","","","","","","","","","","","","","","","","","","","","3:13","","","","","","","","","","","","","","","","","","","","","","","","",""
"2L9HLY5K","webpage","2014","Groelmund, Garrett","RStudio Cheat Sheets","RStudio","","","","https://www.rstudio.com/resources/cheatsheets/","","2014-08-01","2019-09-19 18:55:48","2019-09-19 18:55:48","2016-01-19 21:17:28","","","","","","","","","","","","","","","","","","","","","","<p>Shiny and the r markdown cheat sheet is a comprehensive summary of commonly used functions in succinct forms that are ready for us to use. It is really convenient.</p>","","http://shiny.rstudio.com/articles/rm-cheatsheet.html","","","","","","","","","","","","","","","","","","","","","","","","","","","","","","","","","","","","","","","","","","","","","","","",""
"UMX93FJ5","journalArticle","2012","Greller, Wolfgang; Drachsler, Hendrik","Translating Learning into Numbers: A Generic Framework for Learning Analytics","Journal of Educational Technology & Society","","1176-3647","","http://www.jstor.org/stable/jeductechsoci.15.3.42","ABSTRACT With the increase in available educational data, it is expected that Learning Analytics will become a powerful means to inform and support learners, teachers and their institutions in better understanding and predicting personal learning needs and performance. However, the processes and requirements behind the beneficial application of Learning and Knowledge Analytics as well as the consequences for learning and teaching are still far from being understood. In this paper, we explore the key dimensions of Learning Analytics (LA), the critical problem zones, and some potential dangers to the beneficial exploitation of educational data. We propose and discuss a generic design framework that can act as a useful guide for setting up Learning Analytics services in support of educational practice and learner guidance, in quality assurance, curriculum development, and in improving teacher effectiveness and efficiency. Furthermore, the presented article intends to inform about soft barriers and limitations of Learning Analytics. We identify the required skills and competences that make meaningful use of Learning Analytics data possible to overcome gaps in interpretation literacy among educational stakeholders. We also discuss privacy and ethical issues and suggest ways in which these issues can be addressed through policy guidelines and best practice examples.","2012","2019-09-19 18:55:48","2019-09-19 18:55:48","2016-09-03 18:55:41","42-57","","3","15","","Journal of Educational Technology & Society","Translating Learning into Numbers","","","","","","","","","","","","JSTOR","","","<p>This paper examines the key dimensions of Learning Analytics (LA), the critical problem zones, and some potential dangers to the beneficial exploitation of educational data. It discusses a generic design framework that can act as a useful guide for setting up Learning Analytics services in support of educational practice and learner guidance, in quality assurance, curriculum development, and in improving teacher effectiveness and efficiency. It's interesting how it talks about policy guidelines and best practice examples.</p>","","","","","","","","","","","","","","","","","","","","","","","","","","","","","","","","","","","","","","","","","","","","","","","","","",""
"RA3ZFBNA","journalArticle","2015","Konstan, Joseph A.; Walker, J. D.; Brooks, D. Christopher; Brown, Keith; Ekstrand, Michael D.","Teaching Recommender Systems at Large Scale: Evaluation and Lessons Learned from a Hybrid MOOC","ACM Trans. Comput.-Hum. Interact.","","1073-0516","10.1145/2728171","http://doi.acm.org/10.1145/2728171","","2015-04","2019-09-19 18:55:49","2019-09-19 18:55:49","2016-09-03 20:38:02","10:1–10:23","","2","22","","","Teaching Recommender Systems at Large Scale","","","","","","","","","","","","ACM Digital Library","","","<p><span style=""caret-color: #000000; color: #000000; font-family: Verdana, Arial, Helvetica, sans-serif; font-size: 12px; font-style: normal; font-variant-caps: normal; font-weight: normal; letter-spacing: normal; orphans: auto; text-align: left; text-indent: 0px; text-transform: none; white-space: normal; widows: auto; word-spacing: 0px; -webkit-text-size-adjust: auto; -webkit-text-stroke-width: 0px; background-color: #ffffff; text-decoration: none; display: inline !important; float: none;"">This study performed extensive evaluation including surveys of demographics, self-assessed skills, and learning intent.Based on the limited data, face-to-face students performed as well as the online-only students or better. They preferred this format to traditional lecture for reasons ranging from pure convenience to the desire to watch videos at a different pace.</span></p>","","","","learning assessment; Massively Online Open Course (MOOC)","","","","","","","","","","","","","","","","","","","","","","","","","","","","","","","","","","","","","","","","","","","","","",""
