"GYP757U5","journalArticle","2012","Greller, Wolfgang; Drachsler, Hendrik","Translating Learning into Numbers: A Generic Framework for Learning Analytics","Journal of Educational Technology & Society","","1176-3647","","http://www.jstor.org/stable/jeductechsoci.15.3.42","ABSTRACT With the increase in available educational data, it is expected that Learning Analytics will become a powerful means to inform and support learners, teachers and their institutions in better understanding and predicting personal learning needs and performance. However, the processes and requirements behind the beneficial application of Learning and Knowledge Analytics as well as the consequences for learning and teaching are still far from being understood. In this paper, we explore the key dimensions of Learning Analytics (LA), the critical problem zones, and some potential dangers to the beneficial exploitation of educational data. We propose and discuss a generic design framework that can act as a useful guide for setting up Learning Analytics services in support of educational practice and learner guidance, in quality assurance, curriculum development, and in improving teacher effectiveness and efficiency. Furthermore, the presented article intends to inform about soft barriers and limitations of Learning Analytics. We identify the required skills and competences that make meaningful use of Learning Analytics data possible to overcome gaps in interpretation literacy among educational stakeholders. We also discuss privacy and ethical issues and suggest ways in which these issues can be addressed through policy guidelines and best practice examples.","2012","2019-09-17 21:41:54","2019-09-17 21:41:54","2016-09-03 18:55:41","42-57","","3","15","","Journal of Educational Technology & Society","Translating Learning into Numbers","","","","","","","","","","","","JSTOR","","","<p><span style=""text-decoration: underline;""><strong>Translating Learning into Numbers: A Generic Framework for Learning Analytics</strong></span></p> <p>The paper is interesting in its presentation of the new design framework for learning analytics. Of the six dimensions mentioned, I find the internal limitations to be a critical, but often overlooked, part of the learning analytics process. The <em>competencies </em>involved in interpretation of the data, both immediate and its far-reaching implications, are pivotal, as is the open mind for the policymakers to <em>accept </em>the outcome of the studies. The six dimensions are inherently connected and so it is important to realize that they work in conjunction and not in isolation.</p>","","","","","","","","","","","","","","","","","","","","","","","","","","","","","","","","","","","","","","","","","","","","","","","","","",""
"CM4JFYLD","bookSection","2006","Kay, Judy; Maisonneuve, Nicolas; Yacef, Kalina; Reimann, Peter","The Big Five and Visualisations of Team Work Activity","Intelligent Tutoring Systems","978-3-540-35159-7 978-3-540-35160-3","","","http://link.springer.com/chapter/10.1007/11774303_20","We have created a set of novel visualisations of group activity: they mirror activity of individuals and their interactions, based upon readily available authentic data. We evaluated these visualisations in the context of a semester long software development project course. We give a theoretical analysis of the design of our visualizations using the framework from the “Big 5” theory of team work as well as a qualitative study of the visualisations and the students’ reflective reports. We conclude that these visualisations provide a powerful and valuable mirroring role with potential, when well used, to help groups learn to improve their effectiveness.","2006-06-26","2019-09-17 21:41:54","2019-09-17 21:41:54","2016-09-03 19:10:12","197-206","","","","","","","Lecture Notes in Computer Science","4053","","","Springer Berlin Heidelberg","","en","©2006 Springer-Verlag Berlin Heidelberg","","","","link.springer.com","","DOI: 10.1007/11774303_20","<p><span style=""text-decoration: underline;""><strong>The Big Five and Visualisations of Team Work Activity</strong></span></p> <p><strong>Visualizations of group activity - mirroring activity of individuals and their interactions</strong><strong></strong></p> <p><strong>Computer-supported collaborative learning (CSCL)</strong></p> <ul> <li>expected beneficial outcomes of teamwork - high motivation, deep involvement in learning, and substantial knowledge gain - often do not materialize</li> </ul> <p><strong>Evaluation of the visualizations in context of a semester long software development project course </strong></p> <p><strong>Theoretical analysis of design of visualizations using the framework from the ""Big 5"" theory of team work as well as quantitative study of the visualizations and students' reflective reports</strong></p> <ul> <li><strong>Big 5 component of teamwork</strong> <ul> <li><strong>team leadership</strong><br /> <ul> <li>facilitate team problem solving</li> <li>provide performance expectations and acceptable interaction patterns</li> <li>synchronize and combine individual team member contributions see and evaluate information that affects team functioning</li> </ul> </li> <li><strong>mutual performance monitoring</strong> <ul> <li>identifying mistakes and lapses in other team member's actions</li> </ul> </li> <li><strong>backup behavior</strong> <ul> <li>recognition of workload distribution problem in the team</li> <li>shifting work to underutilized members</li> </ul> </li> <li><strong>adaptability</strong> <ul> <li>identify cues of change, assign meaning to it, develop new plan to deal with it</li> </ul> </li> <li><strong>team orientation</strong> <ul> <li>increased task involvement, information sharing, strategising and goal setting</li> </ul> </li> </ul> </li> <li><strong>3 coordinating mechanisms</strong> <ul> <li>shared mental models</li> <li>mutual trust</li> <li>closed-loop communication</li> </ul> </li> </ul> <p><strong>Overview of Visualizations</strong></p> <ul> <li><strong>Activity Radar</strong></li> <li><strong>Interaction Network </strong> <ul> <li>based on Social Network Analysis</li> <li>capturing relationships and flows between entities</li> <li>nodes (users) and edges(interaction)</li> </ul> </li> <li><strong>Wattle Tree</strong> <br /> <ul> <li>each user's activity shown in climbing vertical tree <ul> <li>tree start: when user performs an action</li> <li>size = size of contribution<strong></strong><strong></strong></li> </ul> </li> </ul> </li> </ul> <p><strong>Conclusion: </strong></p> <ul> <li>Visualizations provide powerful and valuable mirroring role with potential to help groups learn to improve their effectiveness</li> </ul>","","https://link.springer.com/chapter/10.1007/11774303_20","","Multimedia Information Systems; User Interfaces and Human Computer Interaction; Artificial Intelligence (incl. Robotics); Computers and Education; Information Systems Applications (incl. Internet)","Ikeda, Mitsuru; Ashley, Kevin D.; Chan, Tak-Wai","","","","","","","","","","","","","","","","","","","","","","","","","","","","","","","","","","","","","","","","","","","","",""
"S59YPLKQ","journalArticle","2015","Konstan, Joseph A.; Walker, J. D.; Brooks, D. Christopher; Brown, Keith; Ekstrand, Michael D.","Teaching Recommender Systems at Large Scale: Evaluation and Lessons Learned from a Hybrid MOOC","ACM Trans. Comput.-Hum. Interact.","","1073-0516","10.1145/2728171","http://doi.acm.org/10.1145/2728171","","2015-04","2019-09-17 21:41:55","2019-09-17 21:41:55","2016-09-03 20:38:02","10:1–10:23","","2","22","","","Teaching Recommender Systems at Large Scale","","","","","","","","","","","","ACM Digital Library","","","<div title=""Page 1""> <div> <div> <p><span style=""text-decoration: underline;""><strong>Teaching Recommender Systems at Large Scale: Evaluation and Lessons Learned from a Hybrid MOOC</strong> </span></p> <div title=""Page 1""> <div> <div> <ul> <li>Open online Introduction to Recommender Systems through Coursera</li> <li>For-credit version of the course on-campus using the Coursera platform</li> <li>Flipped classroom instruction model.</li> </ul> <p><strong>Methods:</strong></p> <ul> <li>surveys of demographics</li> <li>self-assessed skills</li> <li>learning intent</li> <li>knowledge-assessment tool specifically for the subject matter in this course, administering it before and after the course to measure learning, and again 5 months later to measure retention</li> <li>tracked students through the course, including separating out students enrolled for credit from those enrolled only for the free, open course</li> </ul> <p><strong>Result:</strong></p> <ul> <li>Students had significant knowledge gains across all levels of prior knowledge and across all demographic categories.</li> <li>The main predictor of knowledge gain was effort expended in the course.</li> <li>Students also had significant knowledge retention after the course.</li> <li>Both of these results are limited to the sample of students who chose to complete our knowledge tests. <ul> <li>Student completion of the course was hard to predict, with few factors contributing predictive power; the main predictor of completion = intent to complete</li> <li>Students who chose a concepts-only track with hand exercises achieved the same level of knowledge of recommender systems concepts as those who chose a programming track and its added assignments, though the programming students gained additional programming knowledge.</li> </ul> </li> <li>Based on the limited data we were able to gather, face-to-face students performed as well as the online-only students or better; they preferred this format to traditional lecture for reasons ranging from pure convenience to the desire to watch videos at a different pace (slower for English language learners; faster for some native English speakers).</li> </ul> </div> </div> </div> </div> </div> </div>","","","","learning assessment; Massively Online Open Course (MOOC)","","","","","","","","","","","","","","","","","","","","","","","","","","","","","","","","","","","","","","","","","","","","","",""
"EPJKARSI","bookSection","2013","Desmarais, Michel C.; Naceur, Rhouma","A Matrix Factorization Method for Mapping Items to Skills and for Enhancing Expert-Based Q-Matrices","Artificial Intelligence in Education","978-3-642-39111-8 978-3-642-39112-5","","","http://link.springer.com/chapter/10.1007/978-3-642-39112-5_45","Uncovering the right skills behind question items is a difficult task. It requires a thorough understanding of the subject matter and of the cognitive factors that determine student performance. The skills definition, and the mapping of item to skills, require the involvement of experts. We investigate means to assist experts for this task by using a data driven, matrix factorization approach. The two mappings of items to skills, the expert on one side and the matrix factorization on the other, are compared in terms of discrepancies, and in terms of their performance when used in a linear model of skills assessment and item outcome prediction. Visual analysis shows a relatively similar pattern between the expert and the factorized mappings, although differences arise. The prediction comparison shows the factorization approach performs slightly better than the original expert Q-matrix, giving supporting evidence to the belief that the factorization mapping is valid. Implications for the use of the factorization to design better item to skills mapping are discussed.","2013-07-09","2019-09-17 21:41:55","2019-09-17 21:41:55","2016-09-03 20:44:11","441-450","","","","","","","Lecture Notes in Computer Science","7926","","","Springer Berlin Heidelberg","","en","©2013 Springer-Verlag Berlin Heidelberg","","","","link.springer.com","","DOI: 10.1007/978-3-642-39112-5_45","<p><strong>A Matrix Factorization Method for Mapping Items to Skills and for Enhancing Expert-Based Q-Matrices</strong></p> <p>data driven, matrix factorization approach</p> <p><strong>Intro</strong></p> <p>Mapping items to latent skills - difficult</p> <p><strong>Skills Modeling, Q-Matrices and Matrix Factorization</strong></p> <p>2 mappings of items to skills (1) expert and 2) matrix factorization) are compared in terms of discrepancies and in terms of their performance when used in a linear model of skills assessment and item outcome prediction</p> <ol> <li><strong>Linear Models</strong> <ul> <li>put to the task of assessing student skills mastery</li> <li>factorization methods</li> </ul> </li> <li><strong>Results Matrix, Q matrix, and skills matrix</strong></li> </ol> <p><strong>Comparing Q-matrix induced from data with an expert defined matrix</strong></p> <ol> <li>Comparison issues and principle of the proposed method</li> <li>Alternate Least-Square Factorization (ALS)</li> </ol> <p>Result</p> <ul> <li>relatively small pattern between expert and the factorized mapping (although differences arise)</li> <li>factorization approach performs slightly better than the original expert Q matrix <ul> <li>supporting evidence to the belief that the factorization mapping is valid</li> </ul> </li> </ul>","","https://link.springer.com/chapter/10.1007/978-3-642-39112-5_45","","User Interfaces and Human Computer Interaction; Artificial Intelligence (incl. Robotics); Computers and Education; Information Systems Applications (incl. Internet); alternating least squares matrix factorization; Cognitive modeling; Educational Technology; latent skills; Pedagogic Psychology; skills assessment; Student models","Lane, H. Chad; Yacef, Kalina; Mostow, Jack; Pavlik, Philip","","","","","","","","","","","","","","","","","","","","","","","","","","","","","","","","","","","","","","","","","","","","",""
"CHNI4D4G","book","2015","Matsuda, Noboru; Furukawa, Tadanobu; Bier, Norman; Faloutsos, Christos","Machine Beats Experts: Automatic Discovery of Skill Models for Data-Driven Online Course Refinement","","","","","http://eric.ed.gov/?id=ED560513","How can we automatically determine which skills must be mastered for the successful completion of an online course? Large-scale online courses (e.g., MOOCs) often contain a broad range of contents frequently intended to be a semester's worth of materials; this breadth often makes it difficult to articulate an accurate set of skills and knowledge (i.e., a skill model, or the QMatrix). We have developed an innovative method to discover skill models from the data of online courses. Our method assumes that online courses have a pre-defined skill map for which skills are associated with formative assessment items embedded throughout the online course. Our method carefully exploits correlations between various parts of student performance, as well as in the text of assessment items, to build a superior statistical model that even outperforms human experts. To evaluate our method, we compare our method with existing methods (LFA) and human engineered skill models on three Open Learning Initiative (OLI) courses at Carnegie Mellon University. The results show that (1) our method outperforms human-engineered skill models, (2) skill models discovered by our method are interpretable, and (3) our method is remarkably faster than existing methods. These results suggest that our method provides a significant contribution to the evidence-based, iterative refinement of online courses with a promising scalability. [For complete proceedings, see ED560503.]","2015-06","2019-09-17 21:41:55","2019-09-17 21:41:55","2016-09-03 20:48:57","","","","","","","Machine Beats Experts","","","","","International Educational Data Mining Society","","en","","","","","ERIC","","","<div title=""Page 1""> <div> <div> <p><span style=""text-decoration: underline;""><strong>Machine beats experts: Automatic discovery of skill models for data-driven online course refinement</strong> </span></p> <p><strong>Large-scale online courses<br /></strong></p> <ul> <li>contain a broad range of contents frequently intended to be semester's worth of materials <ul> <li>difficult to articulate accurate set of skills and knowledge <ul> <li>Q-matrix</li> </ul> </li> </ul> </li> </ul> <p><strong>So developed innovative method to discover skill models from data of online courses</strong></p> <ul> <li>assumption: <ul> <li>online courses have pre-defined skill map for which skills are associated with formative assessment items</li> </ul> </li> <li>Exploits correlations between parts of student performance</li> <li>Compared existing method (LFA) and human engineered skill models on Open Learning Initiative (OLI)</li> </ul> <p><strong>Result:</strong></p> <ul> <li>the method proposed better than human-engineered skill models</li> <li>skill models discovered by the model can be interpreted</li> <li>method is faster than existing methods</li> </ul> <p> </p> </div> </div> </div>","","http://eric.ed.gov/?id=ED560513","","data; Automation; Comparative Analysis; Correlation; Formative Evaluation; models; Online Courses; Skills","","","","","","","","","","","","","","","","","","","","","","","","","","","","","","","","","","","","","","","","","","","","","",""
"PC5834XM","conferencePaper","2008","Cortez, Paulo; Silva, Alice Maria Gonçalves","Using data mining to predict secondary school student performance","Proceedings of 5th Annual Future Business Technology Conference","978-90-77381-39-7","","","http://repositorium.sdum.uminho.pt/handle/1822/8024","Although the educational level of the Portuguese population has improved in the last decades, the statistics keep Portugal at Europe’s tail end due to its high student failure rates. In particular, lack of success in the core classes of Mathematics and the Portuguese language is extremely serious. On the other hand, the fields of Business Intelligence (BI)/Data Mining (DM), which aim at extracting high-level knowledge from raw data, offer interesting automated tools that can aid the education domain. The present work intends to approach student achievement in secondary education using BI/DM techniques. Recent real-world data (e.g. student grades, demographic, social and school related features) was collected by using school reports and questionnaires. The two core classes (i.e. Mathematics and Portuguese) were modeled under binary/five-level classification and regression tasks. Also, four DM models (i.e. Decision Trees, Random Forest, Neural Networks and Support Vector Machines) and three input selections (e.g. with and without previous grades) were tested. The results show that a good predictive accuracy can be achieved, provided that the first and/or second school period grades are available. Although student achievement is highly influenced by past evaluations, an explanatory analysis has shown that there are also other relevant features (e.g. number of absences, parent’s job and education, alcohol consumption). As a direct outcome of this research, more efficient student prediction tools can be be developed, improving the quality of education and enhancing school resource management.","2008-04","2019-09-17 21:41:55","2019-09-17 21:41:55","2016-09-04 01:23:19","","","","","","","","","","","","EUROSIS","Porto, Spain","eng","openAccess","","","","repositorium.sdum.uminho.pt","","","<p><span style=""text-decoration: underline;""><strong>Using data mining to predict secondary school student performance</strong></span></p> <p>Automated tools to analyze the raw data and extract interesting high-level information for decision maker</p> <p>Education good for Business Intelligence (BI)/Data Mining (DM) techniques - multiple sources of data (traditional data bases + online web pages) + diverse interest groups (students, teachers, administrators, alumni)</p> <p>Real-world data (student grades, demographic, social and school related features) from Portuguese secondary schools collected by using school reports and questionnaire</p> <p>Mathematics and Portuguese class (core classes) modeled under</p> <ul> <li>3 DM goals <ul> <li>binary classification (pass/fail)</li> <li>classification with 5 levels</li> <li>regression - numeric output ranging between 0 and 20</li> </ul> </li> </ul> <p>For each of these approaches:</p> <ul> <li>4 DM models - Decision Trees, Random Forest, Neural Networks and Support Vector Machines</li> <li>3 Input selections: with and without previous grades</li> </ul> <p>Result:</p> <ul> <li>student achievement highly influenced by past evaluations <ul> <li>other relevant features such as number of absences, parents' education and job, alcohol consumption affect the achievement as well</li> </ul> </li> </ul>","","http://repositorium.sdum.uminho.pt/handle/1822/8024","","","","","","","","","","","","","","","","","","","","","","","","","","","","","","","","","5th Annual Future Business Technology Conference","","","","","","","","","","","","","","",""
"GX4HQNBF","journalArticle","2008","Baker, Ryan S. J. d; Corbett, Albert T.; Roll, Ido; Koedinger, Kenneth R.","Developing a generalizable detector of when students game the system","User Modeling and User-Adapted Interaction","","0924-1868, 1573-1391","10.1007/s11257-007-9045-6","http://link.springer.com/article/10.1007/s11257-007-9045-6","Some students, when working in interactive learning environments, attempt to “game the system”, attempting to succeed in the environment by exploiting properties of the system rather than by learning the material and trying to use that knowledge to answer correctly. In this paper, we present a system that can accurately detect whether a student is gaming the system, within a Cognitive Tutor mathematics curricula. Our detector also distinguishes between two distinct types of gaming which are associated with different learning outcomes. We explore this detector’s generalizability, and find that it transfers successfully to both new students and new tutor lessons.","2008-01-23","2019-09-17 21:41:56","2019-09-17 21:41:56","2016-09-04 01:34:49","287-314","","3","18","","User Model User-Adap Inter","","","","","","","","en","","","","","link.springer.com","","","<p><span style=""text-decoration: underline;""><strong>Developing a generalizable detector of when students game the system</strong> </span></p> <p><strong>game the system</strong></p> <ul> <li>attempt to succeed in the environment by exploiting properties of the system rather than learning the material</li> <li>gaming behavior is associated with significantly poorer learning in Cognitive Tutor classes</li> <li>gaming is a fairly robust construct, present across many intelligent tutoring systems.</li> </ul> <p><strong>Developed a system that can </strong></p> <ul> <li>accurately detect whether a student is gaming the system within Cognitive Tutor mathematics curricula</li> <li>distinguish between two distinct types of gaming associated with different learning outcomes</li> <li>generalize to new tutor system</li> <li>examples: Baker et al.’s (2004) Gaming Detector, and Aleven et al.’s (2004) Help-Seeking Tutor Agent </li> </ul>","","https://link.springer.com/article/10.1007/s11257-007-9045-6","","","","","","","","","","","","","","","","","","","","","","","","","","","","","","","","","","","","","","","","","","","","","","","",""
