"BDXDTSCP","blogPost","2014","Young, Jeffrey R.","Why Students Should Own Their Educational Data","The Chronicle of Higher Education Blogs: Wired Campus","","","","http://chronicle.com/blogs/wiredcampus/why-students-should-own-their-educational-data/54329","","2014-08-21","2019-09-17 21:41:52","2019-09-17 21:41:52","2014-08-23 21:32:22","","","","","","","","","","","","","","","","","","","","","","<p><span style=""text-decoration: underline;""><strong>Why Students Should Own Their Educational Data</strong></span></p> <p>Personalized study materials sounds like every learning analyst's dream - as Todd Rose states, the ""average learner"" is but a myth, and tailored learning may solve for discrepancies such as students with high science aptitude but low reading skills. However, sadly as of right now such tailored learning process and its adaptive textbooks sounds cost-prohibitive and difficult to implement in a classroom setting (for a teacher won't be able to tailor to all these individual student skills). Work remains to be done in the area.</p>","","http://chronicle.com/blogs/wiredcampus/why-students-should-own-their-educational-data/54329","","","","","","","","","","","","","","","","","","","","","","","","","","","","","","","","","","","","","","","","","","","","","","","",""
"K4XNCRXP","journalArticle","1994","Corbett, Albert T.; Anderson, John R.","Knowledge tracing: Modeling the acquisition of procedural knowledge","User Modeling and User-Adapted Interaction","","0924-1868, 1573-1391","10.1007/BF01099821","http://link.springer.com.ezp-prod1.hul.harvard.edu/article/10.1007/BF01099821","This paper describes an effort to model students' changing knowledge state during skill acquisition. Students in this research are learning to write short programs with the ACT Programming Tutor (APT). APT is constructed around a production rule cognitive model of programming knowledge, called theideal student model. This model allows the tutor to solve exercises along with the student and provide assistance as necessary. As the student works, the tutor also maintains an estimate of the probability that the student has learned each of the rules in the ideal model, in a process calledknowledge tracing. The tutor presents an individualized sequence of exercises to the student based on these probability estimates until the student has ‘mastered’ each rule. The programming tutor, cognitive model and learning and performance assumptions are described. A series of studies is reviewed that examine the empirical validity of knowledge tracing and has led to modifications in the process. Currently the model is quite successful in predicting test performance. Further modifications in the modeling process are discussed that may improve performance levels.","1994-12-01","2019-09-17 21:41:52","2019-09-17 21:41:52","2013-04-21 21:21:19","253-278","","4","4","","User Model User-Adap Inter","Knowledge tracing","","","","","","","en","","","","","link.springer.com.ezp-prod1.hul.harvard.edu","","","<div title=""Page 1""> <div> <div> <p><span style=""text-decoration: underline;""><strong>Knowledge Tracing: Modeling the Acquisition of Procedural Knowledge</strong> </span></p> <p>Modeling students' changing knowledge state during skill acquisition - goals of mastery learning</p> <p><strong>1. ACT Programing Tutor (APT)</strong></p> <ul> <li>constructed around production rule cognitive model of programming knowledge = <em><strong>ideal student model</strong></em></li> <li>allows tutor to solve exercises along the student and provide assistance as necessary</li> <li>tutor maintains an estimate of prob that the student has learned each of the rules in the ideal model <em><strong>knowledge tracing</strong></em></li> <li>tutor presents individualized sequence of exercises to student based on prob estimates until students master each rule</li> </ul> <p><strong>2. Cognitive Model</strong></p> <ul> <li>ACT-R theory of skill knowledge <ul> <li>fundamental distinction between declarative and procedural knowledge <ul> <li>declarative: factual/ experiential/ goal-independent</li> <li>procedural: goal-oriented/ mediates problem solving</li> </ul> </li> <li>assumes  procedural knowledge can be represented as a set of independent production rules that associate problem states and problem solving goals with actions and consequent state changes</li> </ul> </li> </ul> <p><strong>3. Knowledge Tracing and Mastery Learning</strong></p> <ul> <li>Knowledge tracing <ul> <li>assumes 2-state learning model</li> <li>employed in tutor to implement mastery learning</li> </ul> </li> </ul> <p><strong>4. Empirical Evaluations of Knowledge Tracing</strong></p> <ul> <li>internal validity</li> <li>external validity</li> </ul> <p> </p> </div> </div> </div>","","","","Education (general); empirical validity; individual differences; intelligent tutoring systems; Learning; Management of Computing and Information Systems; mastery learning; Multimedia Information Systems; procedural knowledge; Psychology, general; student modeling; User Interfaces and Human Computer Interaction","","","","","","","","","","","","","","","","","","","","","","","","","","","","","","","","","","","","","","","","","","","","","",""
"XRBGMEUB","conferencePaper","2012","Siemens, George; Baker, Ryan S. J. d.","Learning Analytics and Educational Data Mining: Towards Communication and Collaboration","Proceedings of the 2Nd International Conference on Learning Analytics and Knowledge","978-1-4503-1111-3","","10.1145/2330601.2330661","http://doi.acm.org/10.1145/2330601.2330661","Growing interest in data and analytics in education, teaching, and learning raises the priority for increased, high-quality research into the models, methods, technologies, and impact of analytics. Two research communities -- Educational Data Mining (EDM) and Learning Analytics and Knowledge (LAK) have developed separately to address this need. This paper argues for increased and formal communication and collaboration between these communities in order to share research, methods, and tools for data mining and analysis in the service of developing both LAK and EDM fields.","2012","2019-09-17 21:41:53","2019-09-17 21:41:53","2015-01-16 03:15:55","252–254","","","","","","Learning Analytics and Educational Data Mining","LAK '12","","","","ACM","New York, NY, USA","","","","","","ACM Digital Library","","","<p><span style=""font-family: 'Segoe UI',sans-serif; color: #24292e;"">Although Educational Data Mining (EDM) and Learning Analytics and Knowledge (LAK) overlap in numerous areas as they share the same goal of “improving education by improving assessments, how problems in education are understood, and how interventions are planned and selected”,  there is a clear distinction between Educational Data Mining (EDM) and Learning Analytics and Knowledge (LAK).</span></p>","","","","Collaboration; educational data mining; learning analytics and knowledge","","","","","","","","","","","","","","","","","","","","","","","","","","","","","","","","","","","","","","","","","","","","","",""
"BBKGBLXS","book","2015","Zheng, Alice","Evaluating Machine Learning Models","","","","","http://www.oreilly.com/data/free/evaluating-machine-learning-models.csp?intcmp=il-data-free-lp-lgen_free_reports_page","Data science today is a lot like the Wild West: there’s endless opportunity and excitement, but also a lot of chaos and confusion. If you’re new to data science and applied machine learning, evaluating a machine-learning model can seem pretty overwhelming...","2015-09","2019-09-17 21:41:53","2019-09-17 21:41:53","2015-12-15 18:26:39","","","","","","","","","","","","O'Reily Media","Sebastopol, CA","","","","","","","","","<p><span style=""text-decoration: underline;""><strong>Zheng, A. 2015. Evaluating Machine Learning Models. O’Reily Media. Chapter 2: Evaluation Metrics p.7-1</strong></span></p> <p>Evaluation metrics</p> <p>Classification metrics</p> <ul> <li>accuracy</li> <li>confusion matrix</li> <li>per-class accuracy</li> <li>log-loss</li> <li>AUC</li> </ul> <p>Ranking metrics</p> <ul> <li>precision-recall</li> <li>precision-recall curve and F1 score</li> <li>NDCG</li> </ul> <p>Regression metrics</p> <ul> <li>RMSE</li> <li>quantiles of errors</li> <li>""almost correct"" predictions</li> </ul>","","http://www.oreilly.com/data/free/evaluating-machine-learning-models.csp?intcmp=il-data-free-lp-lgen_free_reports_page","","","","","","","","","","","","","","","","","","","","","","","","","","","","","","","","","","","","","","","","","","","","","","","",""
"Y258NG9C","blogPost","2015","Leong, B; Polonetsky, J","Why Opting Out of Student Data Collection Isn’t the Solution","EdSurge","","","","https://www.edsurge.com/news/2015-03-16-why-opting-out-of-student-data-collection-isn-t-the-solution","In every privacy debate across every industry, the same questions arise about the rights of individuals to “opt-out” of their data being collected or used. So it should come as no surprise that the “when” and “how” of parent and student opt-outs of education data collection or use has become a robust","2015-03-16","2019-09-17 21:41:53","2019-09-17 21:41:53","2016-01-16 16:31:25","","","","","","","","","","","","","","","","","","","","","","<p><span style=""text-decoration: underline;""><strong>Why Opting Out of Student Data Collection Isn’t the Solution</strong></span></p> <p><strong>Rights of individuals to ""opt-out"" of their data being collected or used</strong></p> <p><strong>Fair Information Privacy Principles (FIPPS)</strong></p> <ul> <li>the basis for most privacy laws in the US and around the world</li> <li>requires data collectors to specify the purpose of data collection and get informed consent</li> </ul> <p><strong>How data collection helps students</strong></p> <ul> <li>""primary use"" categories <ul> <li>needed for school to function - data collection is necessary, expected</li> <li>parents have no choice but to provide them because not providing would have their children deprived of educational services</li> <li>basic info about students and parents <ul> <li>grades</li> <li>eligibility for subsidized lunch</li> </ul> </li> <li>Assessing performance through data analysis an essential step to improve education and address areas of concern</li> </ul> </li> </ul> <p><strong>Opt-out Policies</strong><strong></strong></p> <ul> <li>cons: <ul> <li>prevent schools from getting accurate picture of how good of provided education is</li> <li>lack of understanding about challenges and barriers faced by students of diverse backgrounds</li> <li>cannot address the comprehensive needs of all students</li> </ul> </li> </ul> <p><strong>Opting-out is not the solution</strong></p> <ul> <li>providing individual parents with options that disrupt the ability of data to be used for essential educational purposes isn’t the best option</li> <li>Legitimate education policy concerns need to be addressed by fixing these problems for all students, not just the minority who protest by opting out</li> <li>Opt-out rights should be an opportunity for parents to decline uses of data that truly are secondary to the functioning of our educational system – not an opportunity to avoid resolution of education policy issues that affect all students.</li> </ul> <p> </p>","","https://www.edsurge.com/news/2015-03-16-why-opting-out-of-student-data-collection-isn-t-the-solution","","","","","","","","","","","","","","","","","","","","","","","","","","","","","","","","","","","","","","","","","","","","","","","",""
"S8BSHZK4","videoRecording","2015","Educause","Why Is Measuring Learning So Difficult?","","","","","https://www.youtube.com/watch?v=_iv8A1pHNYA","Several higher education learning and assessment professionals discuss the difficulties of measuring learning.","2015-08-17","2019-09-17 21:41:53","2019-09-17 21:41:53","2016-01-17 18:50:57","","","","","","","","","","","","","","","","","","","YouTube","","","<p><span style=""text-decoration: underline;""><strong>Why Is Measuring Learning So Difficult?</strong></span></p> <p>Learning is multidimensional, but to capture data we have to simplify it</p> <p>Learning is too broad</p> <p>Learning is personal</p> <p>No reliable, simple indicator that can trust - understanding cannot be measured, but example of things that can be measured is to have students teach other students</p> <p>Social implications/ emotional aspects that is hard for LA platform to capture</p> <p>Measuring competencies is difficult - students taking MOOCs class with all different background levels</p> <p>Achievement and self-efficacy</p> <p>Analytics - devising a medium, reveal to learning what kinds of connections that they are making that they might not be aware of - doorway to suggest what there is possible</p> <p> </p> <p> </p>","","","","Learning; Assessment; Education; educational assessment; EDUCAUSE; Higher Education; learners; Teaching and learning","","","","","","","","","","","","","","","","","","","","","470 seconds","","","","","","","","","","","","","","","","","","","","","","","","",""
"TEE6CWKX","webpage","2016","Weinersmith, Zach","Saturday Morning Breakfast Cereal","","","","","http://www.smbc-comics.com/index.php?id=3978","","2016-01-05","2019-09-17 21:41:53","2019-09-17 21:41:53","2016-01-18 18:17:09","","","","","","","","","","","","","","","","","","","","","","<p>The comic, while hilarious on its own, also raises the society's increasing trend to conflate correlation with causation. ""Correlation is not causation"" is is one of the basic tenets of statistics and we, as practitioners, should always not let our excitement lead us awry as was the case here with the clocks and engineers.</p>","","http://www.smbc-comics.com/index.php?id=3978","","","","","","","","","","","","","","","","","","","","","","","","","","","","","","","","","","","","","","","","","","","","","","","",""
"LL4Z3IBZ","conferencePaper","2014","Clow, Doug","Data wranglers: human interpreters to help close the feedback loop","Proceedings of the Fourth International Conference on Learning Analytics And Knowledge","","","","","","2014","2019-09-17 21:41:53","2019-09-17 21:41:53","","49–53","","","","","","","","","","","ACM","","","","","","","","","","<div title=""Page 2""> <div> <div> <p>The paper shows how learning analytics can be used in creating real significant change as was the case of Open University. I found the wranglers' use of both single-loop and double-loop learning particularly interesting. What was ironic, however, was the fact that the overall evaluation of the learning experience - the key reason that the Wranglers were employed in the first place - actually declined slightly after the project (to no fault of the Wranglers, of course). It is a bit bittersweet, then, that learning analytics are fundamentally limited by the external circumstances that surround them, such as funding and other overall policy measures.</p> </div> </div> </div>","","","","","","","","","","","","","","","","","","","","","","","","","","","","","","","","","","","","","","","","","","","","","","","","","",""
"HXD8MCXH","magazineArticle","2015","Kucirkova, Natalia; FitzGerald, Elizabeth","Zuckerberg is ploughing billions into 'personalised learning' – why?","The Conversation","","","","http://theconversation.com/zuckerberg-is-ploughing-billions-into-personalised-learning-why-51940","Zuckerburg wants to plough billions into personalised learning, but his way may not be the right way.","2015-12-09","2019-09-17 21:41:53","2019-09-17 21:41:53","2016-01-18 19:14:05","","","","","","","","","","","","","","","","","","","","","","<p><span style=""text-decoration: underline;""><strong>Zuckerberg is ploughing billions into 'personalised learning' – why?</strong></span></p> <p>Zuckerberg's idea of personalized learning is working with students to customise instruction to meet the student’s individual needs and interests” which alludes to how ""human work is replaced by technology, algorithms provide users with content based on an analysis of their past behaviour and demonstrated interests.""</p> <p>Flaws of Zuckerberg's personalized learning</p> <ul> <li>Education is to acquire both general and specific knowledge and skills</li> <li>""while learners may cope poorly with trying to learn in a way that’s not suited to them, in the real world life will not always be so accommodating""</li> <li>Changing interests</li> </ul> <p>Misuse of children's data - privacy risks</p> <p>Benefits of Personalized Learning</p> <p>Increase in motivation - gives children sense of ""ownership and relevance""</p>","","https://theconversation.com/zuckerberg-is-ploughing-billions-into-personalised-learning-why-51940","","","","","","","","","","","","","","","","","","","","","","","","","","","","","","","","","","","","","","","","","","","","","","","",""
"662HJPCT","videoRecording","2015","Georgia Tech","Feature Selection","","","","","https://www.youtube.com/watch?v=8CpRLplmdqE","","2015-02-23","2019-09-17 21:41:54","2019-09-17 21:41:54","2016-01-18 19:18:06","","","","","","","","","","","","Youtube","","","","","","","","","","<p><span style=""text-decoration: underline;""><strong>Feature Selection - Georgia Tech - Machine Learning</strong></span></p> <p>Feature Selection</p> <ul> <li>Knowledge discovery <ul> <li>interpretability and insight</li> </ul> </li> <li>Curse of dimensionality <ul> <li>amount of data you need increase exponentially as you increase the number of features</li> </ul> </li> </ul>","","https://www.youtube.com/watch?v=8CpRLplmdqE","","","","","","","","","","","","","","","","","","","","","","","3:13","","","","","","","","","","","","","","","","","","","","","","","","",""
"UVTUTYYN","bookSection","2016","Hanneman, R.A.; Riddle, M.","Chapter 1: Social Network Data","Introduction to Social Network Methods","","","","http://faculty.ucr.edu/~hanneman/nettext/C1_Social_Network_Data.html","","2016-01-18","2019-09-17 21:41:54","2019-09-17 21:41:54","2016-01-18 20:17:24","","","","","","","","","","","","","","","","","","","","","","<p><span style=""text-decoration: underline;""><strong>Introduction to social network methods</strong></span></p> <p><strong>Social Network Data</strong></p> <p><strong>Nodes</strong></p> <ul> <li>actors</li> </ul> <p><strong>Edges</strong></p> <ul> <li>relations</li> </ul> <p><strong style=""caret-color: #000000; color: #000000; font-family: Arial; font-style: normal; font-variant-caps: normal; letter-spacing: normal; orphans: auto; text-align: start; text-indent: 0px; text-transform: none; white-space: normal; widows: auto; word-spacing: 0px; -webkit-text-size-adjust: auto; -webkit-text-stroke-width: 0px; text-decoration: none;"">Populations, samples, and boundaries</strong></p> <p><strong style=""caret-color: #000000; color: #000000; font-family: Arial; font-style: normal; font-variant-caps: normal; letter-spacing: normal; orphans: auto; text-align: start; text-indent: 0px; text-transform: none; white-space: normal; widows: auto; word-spacing: 0px; -webkit-text-size-adjust: auto; -webkit-text-stroke-width: 0px; text-decoration: none;"">Modality and levels of analysis</strong></p> <ul> <li>Most social network analysts think of individual persons as being embedded in networks that are embedded in networks that are embedded in networks. Network analysts describe such structures as ""multi-modal.""</li> <li>how the individual is embedded within a structure and how the structure emerges from the micro-relations between individual parts. The ability of network methods to map such multi-modal relations is, at least potentially, a step forward in rigor</li> </ul> <p><strong>Relations</strong><strong></strong></p> <ul> <li><strong>Problems</strong> <ul> <li><strong>sampling ties</strong> <ul> <li><strong>full network methods</strong> <ul> <li>we collect information about each actor's ties with all other actors. In essence, this approach is taking a census of ties in a population of actors -- rather than a sample</li> </ul> </li> <li><strong>Snowball methods </strong> <ul> <li>begin with a focal actor or set of actors. Each of these actors is asked to name some or all of their ties to other actors. Then, all the actors named (who were not part of the original list) are tracked down and asked for some or all of their ties. The process continues until no new actors are identified, or until we decide to stop</li> </ul> </li> <li><strong>Ego-centric networks (with alter connections)</strong></li> <li><strong>Ego-centric networks (ego only)<br /></strong></li> </ul> </li> </ul> </li> </ul> <p>Social network data tend to differ from more ""conventional"" survey data in some key ways: network data are often not probability samples, and the observations of individual nodes are not independent. These differences are quite consequential for both the questions of generalization of findings, and for the mechanics of hypothesis testing.</p> <p> </p>","","http://faculty.ucr.edu/~hanneman/nettext/C1_Social_Network_Data.html","","","","","","","","","","","","","","","","","","","","","","","","","","","","","","","","","","","","","","","","","","","","","","","",""
"GFC7MFAW","webpage","2014","Groelmund, Garrett","RStudio Cheat Sheets","RStudio","","","","https://www.rstudio.com/resources/cheatsheets/","","2014-08-01","2019-09-17 21:41:54","2019-09-17 21:41:54","2016-01-19 21:17:28","","","","","","","","","","","","","","","","","","","","","","<p><strong>The R Markdown sheet</strong></p> <p>The R Markdown sheet introduced me to the workings of R and R Studio. I am excited to see how the program functions as I work with it hands-on - the cheat sheet shows that the program is endlessly versatile, with integration to various other platforms (e.g. Latex).</p>","","http://shiny.rstudio.com/articles/rm-cheatsheet.html","","","","","","","","","","","","","","","","","","","","","","","","","","","","","","","","","","","","","","","","","","","","","","","",""
"WDIJCDAE","conferencePaper","2013","san Pedro, Maria Ofelia; Baker, Ryan; Bowers, Alex; Heffernan, Neil","Predicting college enrollment from student interaction with an intelligent tutoring system in middle school","Educational Data Mining 2013","","","","","","2013","2019-09-17 21:41:54","2019-09-17 21:41:54","","","","","","","","","","","","","","","","","","","","","","","<p><span style=""text-decoration: underline;""><strong>Predicting college enrollment from student interaction with an intelligent tutoring system in middle school</strong></span></p> <p>Indicative of student's choice to attend college:</p> <ul> <li>financial resources</li> <li>family background</li> <li>career aspirations</li> <li>academic ability</li> </ul> <p>Not necessarily give sufficient actionable info to intervene</p> <p><strong>educational software and detectors of specific aspects of student learning and engagement = ASSISTment System in NE</strong></p> <ul> <li>can be used to predict college attendance</li> <li>provide more actionable info</li> </ul>","","","","","","","","","","","","","","","","","","","","","","","","","","","","","","","","","","","","","","","","","","","","","","","","","",""
