"PV99FVA2","blogPost","2015","Leong, B; Polonetsky, J","Why Opting Out of Student Data Collection Isn’t the Solution","EdSurge","","","","https://www.edsurge.com/news/2015-03-16-why-opting-out-of-student-data-collection-isn-t-the-solution","In every privacy debate across every industry, the same questions arise about the rights of individuals to “opt-out” of their data being collected or used. So it should come as no surprise that the “when” and “how” of parent and student opt-outs of education data collection or use has become a robust","2015-03-16","2019-09-17 21:42:50","2019-09-17 21:42:50","2016-01-16 16:31:25","","","","","","","","","","","","","","","","","","","","","","","","https://www.edsurge.com/news/2015-03-16-why-opting-out-of-student-data-collection-isn-t-the-solution","","","","","","","","","","","","","","","","","","","","","","","","","","","","","","","","","","","","","","","","","","","","","","","",""
"RLUDNU8Z","videoRecording","2015","Educause","Why Is Measuring Learning So Difficult?","","","","","https://www.youtube.com/watch?v=_iv8A1pHNYA","Several higher education learning and assessment professionals discuss the difficulties of measuring learning.","2015-08-17","2019-09-17 21:42:50","2019-09-17 21:42:50","2016-01-17 18:50:57","","","","","","","","","","","","","","","","","","","YouTube","","","","","","","Learning; Assessment; Education; educational assessment; EDUCAUSE; Higher Education; learners; Teaching and learning","","","","","","","","","","","","","","","","","","","","","470 seconds","","","","","","","","","","","","","","","","","","","","","","","","",""
"VNIJIZ2K","webpage","2016","Weinersmith, Zach","Saturday Morning Breakfast Cereal","","","","","http://www.smbc-comics.com/index.php?id=3978","","2016-01-05","2019-09-17 21:42:51","2019-09-17 21:42:51","2016-01-18 18:17:09","","","","","","","","","","","","","","","","","","","","","","<p>Hmm ... that's ironic and so true...</p> <p>So ever since media misinterpreted research results, everything is out of control. I think it's trying to tell us that interest and creativity are the most important factors to begin a career instead of mandatory training. And the research results should be interpreted in a proper way.</p>","","http://www.smbc-comics.com/index.php?id=3978","","","","","","","","","","","","","","","","","","","","","","","","","","","","","","","","","","","","","","","","","","","","","","","",""
"U36J5URX","conferencePaper","2014","Clow, Doug","Data wranglers: human interpreters to help close the feedback loop","Proceedings of the Fourth International Conference on Learning Analytics And Knowledge","","","","","","2014","2019-09-17 21:42:51","2019-09-17 21:42:51","","49–53","","","","","","","","","","","ACM","","","","","","","","","","<p>I totally agree that ""The quantity of data, and the range of different data sources, can make it difficult to take systematic action on that data."" So data wrangling is an effective way to organize our data, and data wranglers are necessary for various researches.</p> <p>The paper introduced how data wrangling works and provided some examples with visualization. They claims that ""The aim of the Data Wranglers is to improve the learning experience"" which I also agree with.</p>","","","","","","","","","","","","","","","","","","","","","","","","","","","","","","","","","","","","","","","","","","","","","","","","","",""
"ZS2NFQ6T","magazineArticle","2015","Kucirkova, Natalia; FitzGerald, Elizabeth","Zuckerberg is ploughing billions into 'personalised learning' – why?","The Conversation","","","","http://theconversation.com/zuckerberg-is-ploughing-billions-into-personalised-learning-why-51940","Zuckerburg wants to plough billions into personalised learning, but his way may not be the right way.","2015-12-09","2019-09-17 21:42:51","2019-09-17 21:42:51","2016-01-18 19:14:05","","","","","","","","","","","","","","","","","","","","","","<p>Personality does play an important role in students' achievement. Discovering potential features represented by personalities can help us to find what fits us better, and it's also helpful for teachers to teaching by aptitude. So I think Zuckerberg's action is overall beneficial.</p> <p>As for the dangers of personalized learning, I also agree with the potential risks. After all people are very resilient and people have great potential. General education could help making versatile person.</p>","","https://theconversation.com/zuckerberg-is-ploughing-billions-into-personalised-learning-why-51940","","","","","","","","","","","","","","","","","","","","","","","","","","","","","","","","","","","","","","","","","","","","","","","",""
"TEFC4MDJ","videoRecording","2015","Georgia Tech","Feature Selection","","","","","https://www.youtube.com/watch?v=8CpRLplmdqE","","2015-02-23","2019-09-17 21:42:51","2019-09-17 21:42:51","2016-01-18 19:18:06","","","","","","","","","","","","Youtube","","","","","","","","","","<p>Feature Selection:</p> <p>Why:</p> <p>1) knowledge discovery, interpretability ≠ in sight.</p> <p>2) curse of dimensionality.</p> <p>easier learning problem.</p> <p> </p>","","https://www.youtube.com/watch?v=8CpRLplmdqE","","","","","","","","","","","","","","","","","","","","","","","3:13","","","","","","","","","","","","","","","","","","","","","","","","",""
"SR89BIF2","bookSection","2016","Hanneman, R.A.; Riddle, M.","Chapter 1: Social Network Data","Introduction to Social Network Methods","","","","http://faculty.ucr.edu/~hanneman/nettext/C1_Social_Network_Data.html","","2016-01-18","2019-09-17 21:42:52","2019-09-17 21:42:52","2016-01-18 20:17:24","","","","","","","","","","","","","","","","","","","","","","<p>An easy to understand introduction. Differences between conventional and network data. Basically learned in statistics class</p>","","http://faculty.ucr.edu/~hanneman/nettext/C1_Social_Network_Data.html","","","","","","","","","","","","","","","","","","","","","","","","","","","","","","","","","","","","","","","","","","","","","","","",""
"UUNA6SBB","webpage","2014","Groelmund, Garrett","RStudio Cheat Sheets","RStudio","","","","https://www.rstudio.com/resources/cheatsheets/","","2014-08-01","2019-09-17 21:42:52","2019-09-17 21:42:52","2016-01-19 21:17:28","","","","","","","","","","","","","","","","","","","","","","<p>Data wrangling: Functions used most frequently from this sheet: gather &amp; spread. Changing the structure of data, making them easier to be visualized or organized.</p>","","http://shiny.rstudio.com/articles/rm-cheatsheet.html","","","","","","","","","","","","","","","","","","","","","","","","","","","","","","","","","","","","","","","","","","","","","","","",""
"RZ25DFP6","conferencePaper","2013","san Pedro, Maria Ofelia; Baker, Ryan; Bowers, Alex; Heffernan, Neil","Predicting college enrollment from student interaction with an intelligent tutoring system in middle school","Educational Data Mining 2013","","","","","","2013","2019-09-17 21:42:52","2019-09-17 21:42:52","","","","","","","","","","","","","","","","","","","","","","","","","","","","","","","","","","","","","","","","","","","","","","","","","","","","","","","","","","","","","","","","","","","","","","","","",""
"DSC9MFY6","journalArticle","2012","Greller, Wolfgang; Drachsler, Hendrik","Translating Learning into Numbers: A Generic Framework for Learning Analytics","Journal of Educational Technology & Society","","1176-3647","","http://www.jstor.org/stable/jeductechsoci.15.3.42","ABSTRACT With the increase in available educational data, it is expected that Learning Analytics will become a powerful means to inform and support learners, teachers and their institutions in better understanding and predicting personal learning needs and performance. However, the processes and requirements behind the beneficial application of Learning and Knowledge Analytics as well as the consequences for learning and teaching are still far from being understood. In this paper, we explore the key dimensions of Learning Analytics (LA), the critical problem zones, and some potential dangers to the beneficial exploitation of educational data. We propose and discuss a generic design framework that can act as a useful guide for setting up Learning Analytics services in support of educational practice and learner guidance, in quality assurance, curriculum development, and in improving teacher effectiveness and efficiency. Furthermore, the presented article intends to inform about soft barriers and limitations of Learning Analytics. We identify the required skills and competences that make meaningful use of Learning Analytics data possible to overcome gaps in interpretation literacy among educational stakeholders. We also discuss privacy and ethical issues and suggest ways in which these issues can be addressed through policy guidelines and best practice examples.","2012","2019-09-17 21:42:52","2019-09-17 21:42:52","2016-09-03 18:55:41","42-57","","3","15","","Journal of Educational Technology & Society","Translating Learning into Numbers","","","","","","","","","","","","JSTOR","","","<p>This paper introduced the processes and requirements behind the beneficial application of Learning and Knowledge Analytics as well as the consequences for learning and teaching. More specifically, the key dimensions of Learning Analytics (LA), the critical problem zones, and some potential dangers to the beneficial exploitation of educational data.</p> <p>The framework they constructed makes everything clear to see, and it's helpful for comprehensively analysis. And the visualized data allows teachers to make conclusion or find out issues easier.</p>","","","","","","","","","","","","","","","","","","","","","","","","","","","","","","","","","","","","","","","","","","","","","","","","","",""
"FJ9W6WQJ","bookSection","2006","Kay, Judy; Maisonneuve, Nicolas; Yacef, Kalina; Reimann, Peter","The Big Five and Visualisations of Team Work Activity","Intelligent Tutoring Systems","978-3-540-35159-7 978-3-540-35160-3","","","http://link.springer.com/chapter/10.1007/11774303_20","We have created a set of novel visualisations of group activity: they mirror activity of individuals and their interactions, based upon readily available authentic data. We evaluated these visualisations in the context of a semester long software development project course. We give a theoretical analysis of the design of our visualizations using the framework from the “Big 5” theory of team work as well as a qualitative study of the visualisations and the students’ reflective reports. We conclude that these visualisations provide a powerful and valuable mirroring role with potential, when well used, to help groups learn to improve their effectiveness.","2006-06-26","2019-09-17 21:42:52","2019-09-17 21:42:52","2016-09-03 19:10:12","197-206","","","","","","","Lecture Notes in Computer Science","4053","","","Springer Berlin Heidelberg","","en","©2006 Springer-Verlag Berlin Heidelberg","","","","link.springer.com","","DOI: 10.1007/11774303_20","","","https://link.springer.com/chapter/10.1007/11774303_20","","Multimedia Information Systems; User Interfaces and Human Computer Interaction; Artificial Intelligence (incl. Robotics); Computers and Education; Information Systems Applications (incl. Internet)","Ikeda, Mitsuru; Ashley, Kevin D.; Chan, Tak-Wai","","","","","","","","","","","","","","","","","","","","","","","","","","","","","","","","","","","","","","","","","","","","",""
"WLFBDAB6","journalArticle","2015","Konstan, Joseph A.; Walker, J. D.; Brooks, D. Christopher; Brown, Keith; Ekstrand, Michael D.","Teaching Recommender Systems at Large Scale: Evaluation and Lessons Learned from a Hybrid MOOC","ACM Trans. Comput.-Hum. Interact.","","1073-0516","10.1145/2728171","http://doi.acm.org/10.1145/2728171","","2015-04","2019-09-17 21:42:53","2019-09-17 21:42:53","2016-09-03 20:38:02","10:1–10:23","","2","22","","","Teaching Recommender Systems at Large Scale","","","","","","","","","","","","ACM Digital Library","","","<p>Theoretical overviews of the field.</p>","","","","learning assessment; Massively Online Open Course (MOOC)","","","","","","","","","","","","","","","","","","","","","","","","","","","","","","","","","","","","","","","","","","","","","",""
"9K8D32AE","bookSection","2013","Desmarais, Michel C.; Naceur, Rhouma","A Matrix Factorization Method for Mapping Items to Skills and for Enhancing Expert-Based Q-Matrices","Artificial Intelligence in Education","978-3-642-39111-8 978-3-642-39112-5","","","http://link.springer.com/chapter/10.1007/978-3-642-39112-5_45","Uncovering the right skills behind question items is a difficult task. It requires a thorough understanding of the subject matter and of the cognitive factors that determine student performance. The skills definition, and the mapping of item to skills, require the involvement of experts. We investigate means to assist experts for this task by using a data driven, matrix factorization approach. The two mappings of items to skills, the expert on one side and the matrix factorization on the other, are compared in terms of discrepancies, and in terms of their performance when used in a linear model of skills assessment and item outcome prediction. Visual analysis shows a relatively similar pattern between the expert and the factorized mappings, although differences arise. The prediction comparison shows the factorization approach performs slightly better than the original expert Q-matrix, giving supporting evidence to the belief that the factorization mapping is valid. Implications for the use of the factorization to design better item to skills mapping are discussed.","2013-07-09","2019-09-17 21:42:53","2019-09-17 21:42:53","2016-09-03 20:44:11","441-450","","","","","","","Lecture Notes in Computer Science","7926","","","Springer Berlin Heidelberg","","en","©2013 Springer-Verlag Berlin Heidelberg","","","","link.springer.com","","DOI: 10.1007/978-3-642-39112-5_45","<p> </p> <p> </p>","","https://link.springer.com/chapter/10.1007/978-3-642-39112-5_45","","User Interfaces and Human Computer Interaction; Artificial Intelligence (incl. Robotics); Computers and Education; Information Systems Applications (incl. Internet); alternating least squares matrix factorization; Cognitive modeling; Educational Technology; latent skills; Pedagogic Psychology; skills assessment; Student models","Lane, H. Chad; Yacef, Kalina; Mostow, Jack; Pavlik, Philip","","","","","","","","","","","","","","","","","","","","","","","","","","","","","","","","","","","","","","","","","","","","",""
"I3AGW6CM","book","2015","Matsuda, Noboru; Furukawa, Tadanobu; Bier, Norman; Faloutsos, Christos","Machine Beats Experts: Automatic Discovery of Skill Models for Data-Driven Online Course Refinement","","","","","http://eric.ed.gov/?id=ED560513","How can we automatically determine which skills must be mastered for the successful completion of an online course? Large-scale online courses (e.g., MOOCs) often contain a broad range of contents frequently intended to be a semester's worth of materials; this breadth often makes it difficult to articulate an accurate set of skills and knowledge (i.e., a skill model, or the QMatrix). We have developed an innovative method to discover skill models from the data of online courses. Our method assumes that online courses have a pre-defined skill map for which skills are associated with formative assessment items embedded throughout the online course. Our method carefully exploits correlations between various parts of student performance, as well as in the text of assessment items, to build a superior statistical model that even outperforms human experts. To evaluate our method, we compare our method with existing methods (LFA) and human engineered skill models on three Open Learning Initiative (OLI) courses at Carnegie Mellon University. The results show that (1) our method outperforms human-engineered skill models, (2) skill models discovered by our method are interpretable, and (3) our method is remarkably faster than existing methods. These results suggest that our method provides a significant contribution to the evidence-based, iterative refinement of online courses with a promising scalability. [For complete proceedings, see ED560503.]","2015-06","2019-09-17 21:42:53","2019-09-17 21:42:53","2016-09-03 20:48:57","","","","","","","Machine Beats Experts","","","","","International Educational Data Mining Society","","en","","","","","ERIC","","","<p>This article describes the comparison of a model the authors' team developed that find the accurate set of skills and knowledge for specific course, and the existing methods (LFA) and human engineered skill models.</p> <p>The results shows that the authors' model are interpretable, outperforms human-engineered skill models, also remarkably faster than existing methods.</p> <p>The authors first describe some of their assumptions and how they handle the data. Then building the model and apply it to the example, evaluating and analyze the results after they obtained. </p> <p>After reading the paper, in general, the model's conclusions are still based on the information entered when the model was originally built. This kind of problem they have to solve is a bit subjective, so the evaluation criteria may not be unified, and I personally have some doubts about the efficiency of this model. However, it is undeniable that their research results will play a role in the education industry. I believe this will save some manpower.</p> <p> </p>","","http://eric.ed.gov/?id=ED560513","","data; Automation; Comparative Analysis; Correlation; Formative Evaluation; models; Online Courses; Skills","","","","","","","","","","","","","","","","","","","","","","","","","","","","","","","","","","","","","","","","","","","","","",""
"XCWLD7GA","conferencePaper","2008","Cortez, Paulo; Silva, Alice Maria Gonçalves","Using data mining to predict secondary school student performance","Proceedings of 5th Annual Future Business Technology Conference","978-90-77381-39-7","","","http://repositorium.sdum.uminho.pt/handle/1822/8024","Although the educational level of the Portuguese population has improved in the last decades, the statistics keep Portugal at Europe’s tail end due to its high student failure rates. In particular, lack of success in the core classes of Mathematics and the Portuguese language is extremely serious. On the other hand, the fields of Business Intelligence (BI)/Data Mining (DM), which aim at extracting high-level knowledge from raw data, offer interesting automated tools that can aid the education domain. The present work intends to approach student achievement in secondary education using BI/DM techniques. Recent real-world data (e.g. student grades, demographic, social and school related features) was collected by using school reports and questionnaires. The two core classes (i.e. Mathematics and Portuguese) were modeled under binary/five-level classification and regression tasks. Also, four DM models (i.e. Decision Trees, Random Forest, Neural Networks and Support Vector Machines) and three input selections (e.g. with and without previous grades) were tested. The results show that a good predictive accuracy can be achieved, provided that the first and/or second school period grades are available. Although student achievement is highly influenced by past evaluations, an explanatory analysis has shown that there are also other relevant features (e.g. number of absences, parent’s job and education, alcohol consumption). As a direct outcome of this research, more efficient student prediction tools can be be developed, improving the quality of education and enhancing school resource management.","2008-04","2019-09-17 21:42:54","2019-09-17 21:42:54","2016-09-04 01:23:19","","","","","","","","","","","","EUROSIS","Porto, Spain","eng","openAccess","","","","repositorium.sdum.uminho.pt","","","","","http://repositorium.sdum.uminho.pt/handle/1822/8024","","","","","","","","","","","","","","","","","","","","","","","","","","","","","","","","","5th Annual Future Business Technology Conference","","","","","","","","","","","","","","",""
"CPD8XZ8J","journalArticle","2008","Baker, Ryan S. J. d; Corbett, Albert T.; Roll, Ido; Koedinger, Kenneth R.","Developing a generalizable detector of when students game the system","User Modeling and User-Adapted Interaction","","0924-1868, 1573-1391","10.1007/s11257-007-9045-6","http://link.springer.com/article/10.1007/s11257-007-9045-6","Some students, when working in interactive learning environments, attempt to “game the system”, attempting to succeed in the environment by exploiting properties of the system rather than by learning the material and trying to use that knowledge to answer correctly. In this paper, we present a system that can accurately detect whether a student is gaming the system, within a Cognitive Tutor mathematics curricula. Our detector also distinguishes between two distinct types of gaming which are associated with different learning outcomes. We explore this detector’s generalizability, and find that it transfers successfully to both new students and new tutor lessons.","2008-01-23","2019-09-17 21:42:54","2019-09-17 21:42:54","2016-09-04 01:34:49","287-314","","3","18","","User Model User-Adap Inter","","","","","","","","en","","","","","link.springer.com","","","","","https://link.springer.com/article/10.1007/s11257-007-9045-6","","","","","","","","","","","","","","","","","","","","","","","","","","","","","","","","","","","","","","","","","","","","","","","",""
"YZR5EXH3","book","2014","Baker, R","Big Data in Education","","","","","","","2014","2019-09-17 21:42:55","2019-09-17 21:42:55","","","","","","","","","","","","","","New York, NY","","","","","","","","","<p>CHAPTER7, video1： clustering.</p> <p>Trying to find data points that ""group together"", and is effective in large feature spaces.</p> <p>First, decide how many clusters we wanted, 4 for example; pick the starting values for the ""centroids"" of the clusters(usually chosen randomly). We classify every point as to which centroid it's closest to the defined cluster.</p> <p>Then re-fit the centroids as the center of the points in each cluster. Repeat the process until the centroid stop moving.</p> <p>（basically could do in R with simple codes like 2~3 lines)</p> <p> </p> <p>Chapter7 video 2: Also clustering, validation and selection of K</p> <p>The value of k is which set of clusters to use, the more is not better. Try several values of k and chose the one with best value of AIC or BIC.</p> <p>Mean Squared Deviation/Distortion（A series of calculations）: will often be smaller with more clusters.</p> <p>Cross-validation can't solve this problem. Because it's a different problem than prediction modeling, instead, determining whether any center is close to a given point.</p> <p>More clusters cover the space more thoroughly.</p> <p> </p> <p>Chapter 7, video6: Q-Matrix(KC model: knowledge component model)</p> <p>A table where each row is an item and each column is a skill.</p> <p> </p> <p>chapter one video1: Introduction of the class.</p> <p>educational data mining or learning analytics. escalating the speed of research on many problems in education. Unique learning trajectories of individuals &amp; the sophistication of the models of learning foes ip enormously. Great.</p> <p>Promote: 1) New scientific discoveries &amp; to advance learning sciences. 2) Better assessment of learners along multiple dimensions. 3) Better real-time support for learners. Will be focusing on the methods of broadest usefulness, not coolest newestness.</p> <p>Types of EDM/LA method、 prediction、structure discovery、relationship mining、discovery with models.</p> <p> </p> <p>Chapter 1 video3：Classifiers. Part 1</p> <p>Prediction：Develop a model which can infer a single aspect of the data(predicted variable) from some combination of other aspects of the data. Sometimes used to predict the future. Sometimes used to make inferences about the present.</p> <p>Categories that you want to predict.</p> <p>Classifiers: RapidMiner, SAS Enterprise Miner, Weka, KEEL</p> <p>useful algorithms: step regression, logistic regression, J48/C4.5 Decision Trees, JRip Decision Rules, K* Instance-Based Classifiers.</p> <p> </p> <p>Chapter1 video4：Classifiers, Part2</p> <p>Explained remaining algorithms Part1 don' t have.</p> <p> </p> <p> </p> <p> </p>","","","","","","","","","","","","","","","","","","","","","","","","1","","","","","","","","","","","","","","","","","","","","","","","","","",""
"8U89SYCQ","videoRecording","2016","Georgia Tech","Cross Validation","","","","","https://www.youtube.com/watch?v=sFO2ff-gTh0","","2016-09-09","2019-09-17 21:42:55","2019-09-17 21:42:55","2016-09-09 19:37:11","","","","","","","","","","","","Youtube","","","","","","","","","","<p>Ultimately goal: find a way of predicting values and then testing them. Assessing how the results of a statistical analysis will generalize to an independent data set. Mainly used in settings where the goal is prediction, and one wants to estimate how accurately a predictive model will perform in practice.</p> <p>Use a model that is complex enough to fit the data without causing problems on the test set.</p>","","https://www.youtube.com/watch?v=sFO2ff-gTh0","","","","","","","","","","","","","","","","","","","","","","","","","","","","","","","","","","","","","","","","","","","","","","","",""
