"Key","Item Type","Publication Year","Author","Title","Publication Title","ISBN","ISSN","DOI","Url","Abstract Note","Date","Date Added","Date Modified","Access Date","Pages","Num Pages","Issue","Volume","Number Of Volumes","Journal Abbreviation","Short Title","Series","Series Number","Series Text","Series Title","Publisher","Place","Language","Rights","Type","Archive","Archive Location","Library Catalog","Call Number","Extra","Notes","File Attachments","Link Attachments","Manual Tags","Automatic Tags","Editor","Series Editor","Translator","Contributor","Attorney Agent","Book Author","Cast Member","Commenter","Composer","Cosponsor","Counsel","Interviewer","Producer","Recipient","Reviewed Author","Scriptwriter","Words By","Guest","Number","Edition","Running Time","Scale","Medium","Artwork Size","Filing Date","Application Number","Assignee","Issuing Authority","Country","Meeting Name","Conference Name","Court","References","Reporter","Legal Status","Priority Numbers","Programming Language","Version","System","Code","Code Number","Section","Session","Committee","History","Legislative Body"
"EFABK4YM","bookSection","2017","Bergner, Yoav","Measurement and its Uses in Learning Analytics","The Handbook of Learning Analytics","978-0-9952408-0-3","","","http://solaresearch.org/hla-17/hla17-chapter1","Psychological measurement is a process for making warranted claims about states of mind. As such, it typically comprises the following: de ning a construct; specifying a measurement model and (developing) a reliable instrument; analyzing and accounting for various sources of error (including operator error); and framing a valid argument for particular uses of the outcome. Measurement of latent variables is, after all, a noisy endeavor that can neverthe- less have high-stakes consequences for individuals and groups. This chapter is intended to serve as an introduction to educational and psychological measurement for practitioners in learning analytics and educational data mining. It is organized thematically rather than historically, from more conceptual material about constructs, instruments, and sources of measurement error toward increasing technical detail about particular measurement models and their uses. Some of the philosophical differences between explanatory and predictive modelling are explored toward the end.","2017","2019-09-17 21:42:47","2019-09-17 21:42:47","","34-48","","","","","","","","","","","Society for Learning Analytics Research (SoLAR)","Alberta, Canada","","","","","","","","","<p>pp.34-48</p> <div class=""page"" title=""Page 35""> <div class=""section""> <div class=""layoutArea""> <div class=""column""> <p><span style=""font-size: 9.000000pt; font-family: 'Lora';"">An introduction to educational and psychological measurement for practitioners </span><span style=""font-size: 9.000000pt; font-family: 'Lora';"">in learning analytics and educational data mining. </span></p> <p><span style=""font-size: 9.000000pt; font-family: 'Lora';"">After reading, I have a better understanding of measurement. This chapter shows a complete process of constructing models and it would be a great example if we need to do the similar thing in the future.</span></p> </div> </div> </div> </div>","","","","","Lang, Charles; Siemens, George; Wise, Alyssa Friend; Gaševic, Dragan","","","","","","","","","","","","","","","","","","","1","","","","","","","","","","","","","","","","","","","","","","","","","",""
"2BYTHKZZ","bookSection","2017","Prinsloo, Paul; Slade, Sharon","Ethics and Learning Analytics: Charting the (Un)Charted","The Handbook of Learning Analytics","978-0-9952408-0-3","","","http://solaresearch.org/hla-17/hla17-chapter1","As the field of learning analytics matures, and discourses surrounding the scope, de nition, challenges, and opportunities of learning analytics become more nuanced, there is bene t both in reviewing how far we have come in considering associated ethical issues and in looking ahead. This chapter provides an overview of how our own thinking has developed and maps our journey against broader developments in the  eld. Against a backdrop of technological advances and increasing concerns around pervasive surveillance and the role and unintended consequences of algorithms, the development of research in learning analytics as an ethical and moral practice provides a rich picture of fears and realities. More importantly, we begin to see ethics and privacy as crucial enablers within learning analytics. The chapter brie y locates ethics in learning analytics in the broader context of the forces shaping higher education and the roles of data and evidence before tracking our personal research journey, highlighting current work in the  eld, and concluding by mapping future issues for consideration.","2017","2019-09-17 21:42:48","2019-09-17 21:42:48","","49-57","","","","","","","","","","","Society for Learning Analytics Research (SoLAR)","Alberta, Canada","","","","","","","","","<p>pp. 49-57</p> <p>The focus of this chapter is on ethics in learning analysis. I haven't thought much about this before. The three main issues are 1) The location and interpretation of data, 2) Informed consent, privacy, and the de-identification of data, 3) The management, classification, and storage of data. </p> <p>Based on the issues, they concluded some principles, then some elements for student-centred learning analytics. In 2014, eight principles were concluded based on the ""Policy on ethical use of student data for learning analytics"" published.</p> <p>To be honest, as a student, I don't care if my data is used for develop education, but I'll feel better if they ask for agreement.</p>","","","","","Lang, Charles; Siemens, George; Wise, Alyssa Friend; Gaševic, Dragan","","","","","","","","","","","","","","","","","","","1","","","","","","","","","","","","","","","","","","","","","","","","","",""
"ZEDHX9ZD","bookSection","2017","Brooks, Christopher; Thompson, Craig","Predictive Modelling in Teaching and Learning","The Handbook of Learning Analytics","978-0-9952408-0-3","","","http://solaresearch.org/hla-17/hla17-chapter1","This article describes the process, practice, and challenges of using predictive modelling in teaching and learning. In both the  elds of educational data mining (EDM) and learning analytics (LA) predictive modelling has become a core practice of researchers, largely with a focus on predicting student success as operationalized by academic achievement. In this chapter, we provide a general overview of considerations when using predictive modelling, the steps that an educational data scientist must consider when engaging in the process, and a brief overview of the most popular techniques in the  eld.","2017","2019-09-17 21:42:48","2019-09-17 21:42:48","","61-68","","","","","","","","","","","Society for Learning Analytics Research (SoLAR)","Alberta, Canada","","","","","","","","","<p>pp. 61-68</p> <div class=""page"" title=""Page 61""> <div class=""section""> <div class=""layoutArea""> <div class=""column""> <p><span style=""font-size: 9.000000pt; font-family: 'Lora';"">This article describes the process, practice, and challenges of using predictive modelling </span><span style=""font-size: 9.000000pt; font-family: 'Lora';"">in teaching and learning in both EDM and LA predictive model. The models has become a core practice of researchers, largely focus on predicting student success as operationalized byacademic achievement. <br /></span></p> <p><span style=""font-size: 9.000000pt; font-family: 'Lora';"">It provides a general overview of considerations when using predictive modelling, the steps that an educational data scientist must consider when engaging in the process, and a brief overview of the most popular techniques in the field.</span></p> </div> </div> </div> </div>","","","","","Lang, Charles; Siemens, George; Wise, Alyssa Friend; Gaševic, Dragan","","","","","","","","","","","","","","","","","","","1","","","","","","","","","","","","","","","","","","","","","","","","","",""
"KK5VZTHR","bookSection","2017","Liu, Ren; Koedinger, Kenneth","Going Beyond Better Data Prediction to Create Explanatory Models of Educational Data","The Handbook of Learning Analytics","978-0-9952408-0-3","","","http://solaresearch.org/hla-17/hla17-chapter1","In the statistical modelling of educational data, approaches vary depending on whether the goal is to build a predictive or an explanatory model. Predictive models aim to  nd a combination of features that best predict outcomes; they are typically assessed by their accuracy in predicting held-out data. Explanatory models seek to identify interpretable causal relationships between constructs that can be either observed or inferred from the data. The vast majority of educational data mining research has focused on achieving pre- dictive accuracy, but we argue that the  eld could bene t from more focus on developing explanatory models. We review examples of educational data mining efforts that have pro- duced explanatory models and led to improvements to learning outcomes and/or learning theory. We also summarize some of the common characteristics of explanatory models, such as having parameters that map to interpretable constructs, having fewer parameters overall, and involving human input early in the model development process.","2017","2019-09-17 21:42:48","2019-09-17 21:42:48","","69-76","","","","","","","","","","","Society for Learning Analytics Research (SoLAR)","Alberta, Canada","","","","","","","","","<p>pp. 69-76</p> <p>Usually, models are evaluated by the accuracy of their predicted results. This article focuses about cognitive models, showing the progress of discover cognitive models and how to improve them.</p>","","","","","Lang, Charles; Siemens, George; Wise, Alyssa Friend; Gaševic, Dragan","","","","","","","","","","","","","","","","","","","1","","","","","","","","","","","","","","","","","","","","","","","","","",""
"GDUU7EGB","journalArticle","2011","Gelman, A; Niemi, J","Statistical graphics: making information clear – and beautiful","Significance","","","","","","2011-09","2019-09-17 21:42:48","2019-09-17 21:42:48","","134-136","","","","","","","","","","","","","","","","","","","","","","","","","","","","","","","","","","","","","","","","","","","","","","","","","","","","","","","","","","","","","","","","","","","","","","",""
"JJ83SKZN","journalArticle","2012","Gelman, A; Unwin, A","Infovis and Statistical Graphics: Different Goals, Different Looks (with discussion)","","","","","","","2012","2019-09-17 21:42:48","2019-09-17 21:42:48","","","","","","","","","","","","","","","","","","","","","","","<p>The article makes me understand the difference between infovis and statistical graphics. It is true that people not in field of statistics appears not interested in theoretical graphs. They pretend more intuitive information that helps them with making decisions.</p> <p>The article shows and discusses different types of visualization. And they conclude that the Baby Name Wizard did the best because it interpret information in an attractive, interesting, and open-ended way, which is the way most people seek.</p> <p>I very much agree that ""the interpretation of a joint product of the data, the designer, and the viewer."" This is also our principle of data visualization.</p>","","","","","","","","","","","","","","","","","","","","","","","","","","","","","","","","","","","","","","","","","","","","","","","","","",""
"EYLLFP5D","blogPost","2014","Fung, K","Junkcharts Trifecta Checkup: The Definitive Guide","Junkcharts","","","","http://junkcharts.typepad.com/junk_charts/junk-charts-trifecta-checkup-the-definitive-guide.html","","2014","2019-09-17 21:42:48","2019-09-17 21:42:48","","","","","","","","","","","","","","","","","Blog","","","","","","<p>A guide to check if your graphs are ""chartjunk"".</p> <p>I first know this concept in Tufte's book. Comparing to the abstract principles in the book, this guide let you first clear your purpose, and it seems easier to understand. But it doesn't contain enough details and examples as Tufte's book. Though it's just a general framework for data visualization criticism, there are much more kinds of issues a data visualization could have. Combining both information should be better to check your graphs.</p>","","","","","","","","","","","","","","","","","","","","","","","","","","","","","","","","","","","","","","","","","","","","","","","","","",""
"LJXC9SKK","journalArticle","2010","Bowers, Alex J.","Analyzing the Longitudinal K-12 Grading Histories of Entire Cohorts of Students: Grades, Data Driven Decision Making, Dropping out and Hierarchical Cluster Analysis","Practical Assessment, Research & Evaluation","","1531-7714","","","School personnel currently lack an effective method to pattern and visually interpret disaggregated achievement data collected on students as a means to help inform decision making. This study, through the examination of longitudinal K-12 teacher assigned grading histories for entire cohorts of students from a school district (n=188), demonstrates a novel application of hierarchical cluster analysis and pattern visualization in which all data points collected on every student in a cohort can be patterned, visualized and interpreted to aid in data driven decision making by teachers and administrators. Additionally, as a proof-of-concept study, overall schooling outcomes, such as student dropout or taking a college entrance exam, are identified from the data patterns and compared to past methods of dropout identification as one example of the usefulness of the method. Hierarchical cluster analysis correctly identified over 80% of the students who dropped out using the entire student grade history patterns from either K-12 or K-8. (Contains 5 figures.)","2010-05","2019-09-17 21:42:48","2019-09-17 21:42:48","2014-09-24 19:31:29","","","7","15","","","Analyzing the Longitudinal K-12 Grading Histories of Entire Cohorts of Students","","","","","","","en","","","","","ERIC","","","<p>School lack an efficient way to patten and visually interpret disaggregated achievement data collected from students as a methods for helping decision making. Overall it is analyzing students by historical data.</p> <p>It describes how they collected data, analyzes different indicators including the scores graded by the teachers and hierarchical clusters, and makes data visualization. After they got conclusion and explained, they provides some suggestions.</p>","","http://eric.ed.gov/?id=EJ933686","","data; data analysis; Decision Making; Dropouts; Elementary School Students; Grades (Scholastic); Identification; MULTIVARIATE analysis; School Districts; Secondary School Students","","","","","","","","","","","","","","","","","","","","","","","","","","","","","","","","","","","","","","","","","","","","","",""
"KYGXFWL6","journalArticle","2014","Grunspan, Daniel Z.; Wiggins, Benjamin L.; Goodreau, Steven M.","Understanding Classrooms through Social Network Analysis: A Primer for Social Network Analysis in Education Research","CBE-Life Sciences Education","",", 1931-7913","10.1187/cbe.13-08-0162","http://www.lifescied.org/content/13/2/167","Social interactions between students are a major and underexplored part of undergraduate education. Understanding how learning relationships form in undergraduate classrooms, as well as the impacts these relationships have on learning outcomes, can inform educators in unique ways and improve educational reform. Social network analysis (SNA) provides the necessary tool kit for investigating questions involving relational data. We introduce basic concepts in SNA, along with methods for data collection, data processing, and data analysis, using a previously collected example study on an undergraduate biology classroom as a tutorial. We conduct descriptive analyses of the structure of the network of costudying relationships. We explore generative processes that create observed study networks between students and also test for an association between network position and success on exams. We also cover practical issues, such as the unique aspects of human subjects review for network studies. Our aims are to convince readers that using SNA in classroom environments allows rich and informative analyses to take place and to provide some initial tools for doing so, in the process inspiring future educational studies incorporating relational data.","2014-06-20","2019-09-17 21:42:49","2019-09-17 21:42:49","2014-08-20 20:21:46","167-178","","2","13","","CBE Life Sci Educ","Understanding Classrooms through Social Network Analysis","","","","","","","en","","","","","www.lifescied.org","","","<p>A great topic, at first. Social relationships could be very influential for students and classrooms are top priority. The article introduces network concept, how they collected the data, and explains their standard for measurements, which make sense and is easy to understand in my eyes.</p> <p>Including variations, they conclude that ""networks are a relatively simple but powerful way of looking at the small and vital communities in every school and college.""</p> <p>It's hard to say their measurements and standards is rigorous in this case, so their analysis temporarily could be reference only.</p>","","http://www.lifescied.org/content/13/2/167","Week 2","","","","","","","","","","","","","","","","","","","","","","","","","","","","","","","","","","","","","","","","","","","","","","",""
"GSCTGUB7","blogPost","2014","Young, Jeffrey R.","Why Students Should Own Their Educational Data","The Chronicle of Higher Education Blogs: Wired Campus","","","","http://chronicle.com/blogs/wiredcampus/why-students-should-own-their-educational-data/54329","","2014-08-21","2019-09-17 21:42:49","2019-09-17 21:42:49","2014-08-23 21:32:22","","","","","","","","","","","","","","","","","","","","","","<p>The author's main point is that custom made different study method for individuals is a good way to enhance the efficiency of study because different people have different levels of skills.Besides, users have the right to know about their behavioral data and analysis is </p> <p>I would say their research sounds exciting after reading this article and I'm looking forward to their success. However, there are still many efforts to be done in the future (like data collecting and analyzing) and how could this work will still be problem.</p> <p>Since today’s society needs comprehensive talents, I don't think improving individual's ability of their talent is a absolutely correct choice. Their product might be properly used for targeted education rather than universal education. Also, though customize teaching is a relatively the most effective form of education, we don’t have as many educational resources for everyone.<span style=""color: #2a2e2e; font-family: 'Helvetica Neue', arial, sans-serif; font-size: 15px; font-style: normal; font-variant-ligatures: normal; font-variant-caps: normal; font-weight: 400; letter-spacing: normal; orphans: 2; text-align: left; text-indent: 0px; text-transform: none; white-space: normal; widows: 2; word-spacing: 0px; -webkit-text-stroke-width: 0px; text-decoration-style: initial; text-decoration-color: initial; display: inline !important; float: none;""><br /></span></p>","","http://chronicle.com/blogs/wiredcampus/why-students-should-own-their-educational-data/54329","","","","","","","","","","","","","","","","","","","","","","","","","","","","","","","","","","","","","","","","","","","","","","","",""
"PL7NU9LP","journalArticle","1994","Corbett, Albert T.; Anderson, John R.","Knowledge tracing: Modeling the acquisition of procedural knowledge","User Modeling and User-Adapted Interaction","","0924-1868, 1573-1391","10.1007/BF01099821","http://link.springer.com.ezp-prod1.hul.harvard.edu/article/10.1007/BF01099821","This paper describes an effort to model students' changing knowledge state during skill acquisition. Students in this research are learning to write short programs with the ACT Programming Tutor (APT). APT is constructed around a production rule cognitive model of programming knowledge, called theideal student model. This model allows the tutor to solve exercises along with the student and provide assistance as necessary. As the student works, the tutor also maintains an estimate of the probability that the student has learned each of the rules in the ideal model, in a process calledknowledge tracing. The tutor presents an individualized sequence of exercises to the student based on these probability estimates until the student has ‘mastered’ each rule. The programming tutor, cognitive model and learning and performance assumptions are described. A series of studies is reviewed that examine the empirical validity of knowledge tracing and has led to modifications in the process. Currently the model is quite successful in predicting test performance. Further modifications in the modeling process are discussed that may improve performance levels.","1994-12-01","2019-09-17 21:42:49","2019-09-17 21:42:49","2013-04-21 21:21:19","253-278","","4","4","","User Model User-Adap Inter","Knowledge tracing","","","","","","","en","","","","","link.springer.com.ezp-prod1.hul.harvard.edu","","","<p>This article introduced a type of model constructing by obtaining students' changing learning/knowledge condition when they are studying. While the students are working, the director would maintains an estimate of the probability that students has learned each of the rules in the ideal model by a progress called knowledge tracing. The director changes the teaching methods by each student's progress until everyone get every idea.</p> <p>Through the research, knowledge tracing is proved effective and leads to improvement. And currently the model is working great in predicting test performance. The article also discusses how to improve the model.</p>","","","","Education (general); empirical validity; individual differences; intelligent tutoring systems; Learning; Management of Computing and Information Systems; mastery learning; Multimedia Information Systems; procedural knowledge; Psychology, general; student modeling; User Interfaces and Human Computer Interaction","","","","","","","","","","","","","","","","","","","","","","","","","","","","","","","","","","","","","","","","","","","","","",""
"3NZFJI4T","conferencePaper","2012","Siemens, George; Baker, Ryan S. J. d.","Learning Analytics and Educational Data Mining: Towards Communication and Collaboration","Proceedings of the 2Nd International Conference on Learning Analytics and Knowledge","978-1-4503-1111-3","","10.1145/2330601.2330661","http://doi.acm.org/10.1145/2330601.2330661","Growing interest in data and analytics in education, teaching, and learning raises the priority for increased, high-quality research into the models, methods, technologies, and impact of analytics. Two research communities -- Educational Data Mining (EDM) and Learning Analytics and Knowledge (LAK) have developed separately to address this need. This paper argues for increased and formal communication and collaboration between these communities in order to share research, methods, and tools for data mining and analysis in the service of developing both LAK and EDM fields.","2012","2019-09-17 21:42:50","2019-09-17 21:42:50","2015-01-16 03:15:55","252–254","","","","","","Learning Analytics and Educational Data Mining","LAK '12","","","","ACM","New York, NY, USA","","","","","","ACM Digital Library","","","<p>Improving teaching methods through big data will become a trend, and teachers can better understand students through data. From the article I can see scientists have made a lot of efforts to achieve this goal. The development of such projects also requires cooperation from people in multiple fields that data is a very important part.</p> <p>The two main things in this article is educational data mining (EDM) and learning analytics and knowledge (LAK). And I believe our class would focus more one EDM, which is described as ""developing methods for exploring the unique types of data that come from educational settings, and using those methods to better understand students, and the settings which they learn in.""</p> <p>By comparison, the author clearly shows us different focus of the two fields.</p>","","","","Collaboration; educational data mining; learning analytics and knowledge","","","","","","","","","","","","","","","","","","","","","","","","","","","","","","","","","","","","","","","","","","","","","",""
"THK9H682","book","2015","Zheng, Alice","Evaluating Machine Learning Models","","","","","http://www.oreilly.com/data/free/evaluating-machine-learning-models.csp?intcmp=il-data-free-lp-lgen_free_reports_page","Data science today is a lot like the Wild West: there’s endless opportunity and excitement, but also a lot of chaos and confusion. If you’re new to data science and applied machine learning, evaluating a machine-learning model can seem pretty overwhelming...","2015-09","2019-09-17 21:42:50","2019-09-17 21:42:50","2015-12-15 18:26:39","","","","","","","","","","","","O'Reily Media","Sebastopol, CA","","","","","","","","","<p>There are infinite opportunities in data science, but also lots of confusion. Machine learning as an emerging technology, needs too many directions to develop, and at the same time leads to increased demand for talented people. Evaluating a machine-learning model is a new work from out branch, and it could be helpful but difficult at the same time.</p>","","http://www.oreilly.com/data/free/evaluating-machine-learning-models.csp?intcmp=il-data-free-lp-lgen_free_reports_page","","","","","","","","","","","","","","","","","","","","","","","","","","","","","","","","","","","","","","","","","","","","","","","",""
